issueDate,lastUpdated,report.enhancedWeatherDescription,report.gustSpeedKph,report.gustSpeedMph,report.localDate,report.lowermaxTemperatureC,report.lowermaxTemperatureF,report.lowerminTemperatureC,report.lowerminTemperatureF,report.maxTempC,report.maxTempF,report.minTempC,report.minTempF,report.mostLikelyHighTemperatureC,report.mostLikelyHighTemperatureF,report.mostLikelyLowTemperatureC,report.mostLikelyLowTemperatureF,report.pollenIndex,report.pollenIndexBand,report.pollenIndexIconText,report.pollenIndexText,report.pollutionIndex,report.pollutionIndexBand,report.pollutionIndexIconText,report.pollutionIndexText,report.precipitationProbabilityInPercent,report.precipitationProbabilityText,report.sunrise,report.sunset,report.uppermaxTemperatureC,report.uppermaxTemperatureF,report.upperminTemperatureC,report.upperminTemperatureF,report.uvIndex,report.uvIndexBand,report.uvIndexIconText,report.uvIndexText,report.weatherType,report.weatherTypeText,report.windDescription,report.windDirection,report.windDirectionAbbreviation,report.windDirectionFull,report.windSpeedKph,report.windSpeedMph,location_id,location_name
2023-08-13T22:56:00+01:00,2023-08-14T09:01:22.204+01:00,Sunny intervals and light winds,18,11,2023-08-14,,,,,18,65,11,51,20,68,9,49,1.0,LOW,L,Low,2.0,LOW,L,Low,18,Low chance of precipitation,05:41,20:53,,,,,5,MODERATE,M,Moderate,3,Sunny Intervals,Light winds from the north east,NE,NE,North Easterly,12,7,2650225,Edinburgh
2023-08-13T22:56:00+01:00,2023-08-14T09:01:22.204+01:00,Light rain showers and light winds,15,9,2023-08-15,,,,,20,68,11,53,21,71,11,51,1.0,LOW,L,Low,3.0,LOW,L,Low,33,Chance of precipitation,05:43,20:50,,,,,4,MODERATE,M,Moderate,10,Light Rain Showers,Light winds from the west,W,W,Westerly,8,5,2650225,Edinburgh
2023-08-13T22:56:00+01:00,2023-08-14T09:01:22.204+01:00,Drizzle and a gentle breeze,17,11,2023-08-16,,,,,18,65,12,53,19,66,11,52,1.0,LOW,L,Low,2.0,LOW,L,Low,55,Chance of precipitation,05:45,20:48,,,,,3,MODERATE,M,Moderate,11,Drizzle,A gentle breeze from the north east,NE,NE,North Easterly,13,8,2650225,Edinburgh
2023-08-13T22:56:00+01:00,2023-08-14T09:01:22.204+01:00,Sunny intervals and a gentle breeze,23,14,2023-08-17,,,,,20,68,11,52,21,71,11,51,1.0,LOW,L,Low,3.0,LOW,L,Low,19,Low chance of precipitation,05:47,20:46,,,,,4,MODERATE,M,Moderate,3,Sunny Intervals,A gentle breeze from the east,E,E,Easterly,16,10,2650225,Edinburgh
2023-08-13T22:56:00+01:00,2023-08-14T09:01:22.204+01:00,Sunny intervals and a moderate breeze,35,22,2023-08-18,,,,,19,67,13,56,21,69,13,55,1.0,LOW,L,Low,3.0,LOW,L,Low,0,Precipitation is not expected,05:49,20:43,,,,,5,MODERATE,M,Moderate,3,Sunny Intervals,A moderate breeze from the east,E,E,Easterly,23,15,2650225,Edinburgh
2023-08-13T22:56:00+01:00,2023-08-14T09:01:22.204+01:00,Light rain showers and a moderate breeze,46,29,2023-08-19,,,,,20,68,15,58,22,72,13,55,,,,,,,,,70,Chance of precipitation,05:51,20:41,,,,,3,MODERATE,M,Moderate,10,Light Rain Showers,A moderate breeze from the east,E,E,Easterly,21,13,2650225,Edinburgh
2023-08-13T22:56:00+01:00,2023-08-14T09:01:22.204+01:00,Sunny intervals and a gentle breeze,35,22,2023-08-20,,,,,21,69,12,54,22,71,11,53,,,,,,,,,20,Low chance of precipitation,05:53,20:38,,,,,4,MODERATE,M,Moderate,3,Sunny Intervals,A gentle breeze from the south west,SW,SW,South Westerly,18,11,2650225,Edinburgh
2023-08-13T22:56:00+01:00,2023-08-14T09:01:22.204+01:00,Light rain showers and a gentle breeze,22,14,2023-08-21,,,,,20,67,11,53,22,71,9,49,,,,,,,,,49,Chance of precipitation,05:55,20:36,,,,,4,MODERATE,M,Moderate,10,Light Rain Showers,A gentle breeze from the south west,SW,SW,South Westerly,13,8,2650225,Edinburgh
2023-08-14T09:01:22+01:00,2023-08-14T09:01:22.204+01:00,Thundery showers and a gentle breeze,40,25,2023-08-22,,,,,19,66,12,53,21,69,9,49,,,,,,,,,55,Chance of precipitation,05:57,20:33,,,,,2,LOW,L,Low,29,Thundery Showers,A gentle breeze from the west,W,W,Westerly,15,9,2650225,Edinburgh
2023-08-14T09:01:22+01:00,2023-08-14T09:01:22.204+01:00,Light rain and a gentle breeze,31,19,2023-08-23,,,,,18,65,11,52,21,70,8,47,,,,,,,,,58,Chance of precipitation,05:59,20:31,,,,,4,MODERATE,M,Moderate,12,Light Rain,A gentle breeze from the west,W,W,Westerly,15,9,2650225,Edinburgh
2023-08-14T09:01:22+01:00,2023-08-14T09:01:22.204+01:00,Light rain and a gentle breeze,32,20,2023-08-24,,,,,18,65,11,52,21,70,7,45,,,,,,,,,70,Chance of precipitation,06:01,20:29,,,,,3,MODERATE,M,Moderate,12,Light Rain,A gentle breeze from the west,W,W,Westerly,17,11,2650225,Edinburgh
2023-08-14T09:01:22+01:00,2023-08-14T09:01:22.204+01:00,Light rain and a gentle breeze,30,19,2023-08-25,,,,,18,64,11,53,21,70,7,45,,,,,,,,,69,Chance of precipitation,06:03,20:26,,,,,1,LOW,L,Low,12,Light Rain,A gentle breeze from the west,W,W,Westerly,17,11,2650225,Edinburgh
2023-08-14T09:01:22+01:00,2023-08-14T09:01:22.204+01:00,Light rain showers and a gentle breeze,63,39,2023-08-26,,,,,18,65,11,51,23,73,6,43,,,,,,,,,70,Chance of precipitation,06:05,20:24,,,,,5,MODERATE,M,Moderate,10,Light Rain Showers,A gentle breeze from the south west,SW,SW,South Westerly,19,12,2650225,Edinburgh
2023-08-14T09:01:22+01:00,2023-08-14T09:01:22.204+01:00,Sunny intervals and a gentle breeze,30,19,2023-08-27,,,,,18,65,9,48,23,74,4,39,,,,,,,,,24,Low chance of precipitation,06:07,20:21,,,,,3,MODERATE,M,Moderate,3,Sunny Intervals,A gentle breeze from the west,W,W,Westerly,17,11,2650225,Edinburgh
