issueDate,lastUpdated,report.enhancedWeatherDescription,report.gustSpeedKph,report.gustSpeedMph,report.localDate,report.lowermaxTemperatureC,report.lowermaxTemperatureF,report.lowerminTemperatureC,report.lowerminTemperatureF,report.maxTempC,report.maxTempF,report.minTempC,report.minTempF,report.mostLikelyHighTemperatureC,report.mostLikelyHighTemperatureF,report.mostLikelyLowTemperatureC,report.mostLikelyLowTemperatureF,report.pollenIndex,report.pollenIndexBand,report.pollenIndexIconText,report.pollenIndexText,report.pollutionIndex,report.pollutionIndexBand,report.pollutionIndexIconText,report.pollutionIndexText,report.precipitationProbabilityInPercent,report.precipitationProbabilityText,report.sunrise,report.sunset,report.uppermaxTemperatureC,report.uppermaxTemperatureF,report.upperminTemperatureC,report.upperminTemperatureF,report.uvIndex,report.uvIndexBand,report.uvIndexIconText,report.uvIndexText,report.weatherType,report.weatherTypeText,report.windDescription,report.windDirection,report.windDirectionAbbreviation,report.windDirectionFull,report.windSpeedKph,report.windSpeedMph,location_id,location_name
2024-12-12T09:45:00+00:00,2024-12-12T16:01:29.523Z,Sunny intervals and light winds,12,7,2024-12-12,,,,,2,35,0,33,3,38,-1,30,,,,,2.0,LOW,L,Low,6,Low chance of precipitation,08:35,15:38,,,,,0,LOW,L,Low,3,Sunny Intervals,Light winds from the west,W,W,Westerly,6,4,2650225,Edinburgh
2024-12-12T09:45:00+00:00,2024-12-12T16:01:29.523Z,Light cloud and light winds,22,14,2024-12-13,,,,,5,41,0,32,6,43,-1,30,,,,,2.0,LOW,L,Low,25,Low chance of precipitation,08:36,15:38,,,,,1,LOW,L,Low,7,Light Cloud,Light winds from the west,W,W,Westerly,10,6,2650225,Edinburgh
2024-12-12T09:45:00+00:00,2024-12-12T16:01:29.523Z,Sunny and a gentle breeze,29,18,2024-12-14,,,,,5,40,3,38,6,43,2,36,,,,,2.0,LOW,L,Low,0,Precipitation is not expected,08:37,15:38,,,,,1,LOW,L,Low,1,Sunny,A gentle breeze from the west,W,W,Westerly,15,9,2650225,Edinburgh
2024-12-12T09:45:00+00:00,2024-12-12T16:01:29.523Z,Drizzle and a fresh breeze,63,39,2024-12-15,,,,,11,52,9,48,12,54,8,46,,,,,3.0,LOW,L,Low,50,Chance of precipitation,08:38,15:38,,,,,1,LOW,L,Low,11,Drizzle,A fresh breeze from the west,W,W,Westerly,32,20,2650225,Edinburgh
2024-12-12T09:45:00+00:00,2024-12-12T16:01:29.523Z,Gusty winds and light cloud,70,43,2024-12-16,,,,,11,51,8,46,12,53,6,43,,,,,3.0,LOW,L,Low,26,Low chance of precipitation,08:39,15:38,,,,,1,LOW,L,Low,7,Light Cloud,Gusty winds from the south west,SW,SW,South Westerly,33,20,2650225,Edinburgh
2024-12-12T09:45:00+00:00,2024-12-12T16:01:29.523Z,Light rain and a moderate breeze,47,29,2024-12-17,,,,,10,49,7,45,11,53,5,41,,,,,,,,,39,Chance of precipitation,08:40,15:38,,,,,1,LOW,L,Low,12,Light Rain,A moderate breeze from the south west,SW,SW,South Westerly,21,13,2650225,Edinburgh
2024-12-12T09:45:00+00:00,2024-12-12T16:01:29.523Z,Light rain and a moderate breeze,62,39,2024-12-18,,,,,11,52,6,43,14,57,3,37,,,,,,,,,70,Chance of precipitation,08:41,15:39,,,,,1,LOW,L,Low,12,Light Rain,A moderate breeze from the south west,SW,SW,South Westerly,29,18,2650225,Edinburgh
2024-12-12T09:45:00+00:00,2024-12-12T16:01:29.523Z,Gusty winds and rain,70,43,2024-12-19,,,,,7,44,2,36,8,47,0,31,,,,,,,,,70,Chance of precipitation,08:41,15:39,,,,,1,LOW,L,Low,12,Light Rain,Gusty winds from the west,W,W,Westerly,29,18,2650225,Edinburgh
2024-12-12T16:01:29+00:00,2024-12-12T16:01:29.523Z,Sunny intervals and a moderate breeze,57,35,2024-12-20,,,,,6,43,2,36,9,47,0,33,,,,,,,,,18,Low chance of precipitation,08:42,15:40,,,,,1,LOW,L,Low,3,Sunny Intervals,A moderate breeze from the west,W,W,Westerly,23,15,2650225,Edinburgh
2024-12-12T16:01:29+00:00,2024-12-12T16:01:29.523Z,Drizzle and a moderate breeze,50,31,2024-12-21,,,,,6,43,2,35,8,47,-1,31,,,,,,,,,35,Chance of precipitation,08:42,15:40,,,,,1,LOW,L,Low,11,Drizzle,A moderate breeze from the south west,SW,SW,South Westerly,21,13,2650225,Edinburgh
2024-12-12T16:01:29+00:00,2024-12-12T16:01:29.523Z,Sunny and a gentle breeze,42,26,2024-12-22,,,,,5,41,3,37,8,46,0,32,,,,,,,,,33,Chance of precipitation,08:43,15:41,,,,,1,LOW,L,Low,1,Sunny,A gentle breeze from the west,W,W,Westerly,18,11,2650225,Edinburgh
2024-12-12T16:01:29+00:00,2024-12-12T16:01:29.523Z,Light rain and a moderate breeze,57,35,2024-12-23,,,,,6,42,1,35,9,48,-2,29,,,,,,,,,68,Chance of precipitation,08:43,15:41,,,,,1,LOW,L,Low,12,Light Rain,A moderate breeze from the west,W,W,Westerly,22,14,2650225,Edinburgh
2024-12-12T16:01:29+00:00,2024-12-12T16:01:29.523Z,Drizzle and a gentle breeze,45,28,2024-12-24,,,,,6,43,4,38,9,49,0,32,,,,,,,,,46,Chance of precipitation,08:44,15:42,,,,,1,LOW,L,Low,11,Drizzle,A gentle breeze from the west,W,W,Westerly,17,11,2650225,Edinburgh
2024-12-12T16:01:29+00:00,2024-12-12T16:01:29.523Z,Drizzle and a gentle breeze,48,30,2024-12-25,,,,,6,43,2,36,10,50,-2,28,,,,,,,,,47,Chance of precipitation,08:44,15:43,,,,,1,LOW,L,Low,11,Drizzle,A gentle breeze from the west,W,W,Westerly,18,11,2650225,Edinburgh
