issueDate,lastUpdated,report.enhancedWeatherDescription,report.gustSpeedKph,report.gustSpeedMph,report.localDate,report.lowermaxTemperatureC,report.lowermaxTemperatureF,report.lowerminTemperatureC,report.lowerminTemperatureF,report.maxTempC,report.maxTempF,report.minTempC,report.minTempF,report.mostLikelyHighTemperatureC,report.mostLikelyHighTemperatureF,report.mostLikelyLowTemperatureC,report.mostLikelyLowTemperatureF,report.pollenIndex,report.pollenIndexBand,report.pollenIndexIconText,report.pollenIndexText,report.pollutionIndex,report.pollutionIndexBand,report.pollutionIndexIconText,report.pollutionIndexText,report.precipitationProbabilityInPercent,report.precipitationProbabilityText,report.sunrise,report.sunset,report.uppermaxTemperatureC,report.uppermaxTemperatureF,report.upperminTemperatureC,report.upperminTemperatureF,report.uvIndex,report.uvIndexBand,report.uvIndexIconText,report.uvIndexText,report.weatherType,report.weatherTypeText,report.windDescription,report.windDirection,report.windDirectionAbbreviation,report.windDirectionFull,report.windSpeedKph,report.windSpeedMph,location_id,location_name
2024-04-12T10:45:00+01:00,2024-04-12T17:00:12.767+01:00,Drizzle and a fresh breeze,58,36,2024-04-12,,,,,15,59,8,46,16,60,7,44,4.0,MODERATE,M,Moderate,2.0,LOW,L,Low,31,Chance of precipitation,06:13,20:15,,,,,2,LOW,L,Low,11,Drizzle,A fresh breeze from the south west,SW,SW,South Westerly,30,19,2650225,Edinburgh
2024-04-12T10:45:00+01:00,2024-04-12T17:00:12.767+01:00,Gusty winds and light rain showers,72,45,2024-04-13,,,,,14,57,4,40,15,59,3,38,1.0,LOW,L,Low,3.0,LOW,L,Low,70,Chance of precipitation,06:11,20:17,,,,,3,MODERATE,M,Moderate,10,Light Rain Showers,Gusty winds from the south west,SW,SW,South Westerly,36,22,2650225,Edinburgh
2024-04-12T10:45:00+01:00,2024-04-12T17:00:12.767+01:00,Light rain and a moderate breeze,48,30,2024-04-14,,,,,11,51,5,41,11,53,4,39,1.0,LOW,L,Low,3.0,LOW,L,Low,68,Chance of precipitation,06:08,20:19,,,,,3,MODERATE,M,Moderate,12,Light Rain,A moderate breeze from the west,W,W,Westerly,28,17,2650225,Edinburgh
2024-04-12T10:45:00+01:00,2024-04-12T17:00:12.767+01:00,Light rain showers and a fresh breeze,63,39,2024-04-15,,,,,9,48,4,40,10,50,2,36,1.0,LOW,L,Low,3.0,LOW,L,Low,68,Chance of precipitation,06:06,20:21,,,,,3,MODERATE,M,Moderate,10,Light Rain Showers,A fresh breeze from the west,W,W,Westerly,35,22,2650225,Edinburgh
2024-04-12T10:45:00+01:00,2024-04-12T17:00:12.767+01:00,Light rain showers and a moderate breeze,35,22,2024-04-16,,,,,11,51,2,36,12,54,1,33,1.0,LOW,L,Low,3.0,LOW,L,Low,51,Chance of precipitation,06:03,20:23,,,,,3,MODERATE,M,Moderate,10,Light Rain Showers,A moderate breeze from the north west,NW,NW,North Westerly,21,13,2650225,Edinburgh
2024-04-12T10:45:00+01:00,2024-04-12T17:00:12.767+01:00,Light rain and a gentle breeze,40,25,2024-04-17,,,,,10,50,4,39,11,53,2,36,,,,,,,,,52,Chance of precipitation,06:01,20:25,,,,,3,MODERATE,M,Moderate,12,Light Rain,A gentle breeze from the west,W,W,Westerly,19,12,2650225,Edinburgh
2024-04-12T10:45:00+01:00,2024-04-12T17:00:12.767+01:00,Light cloud and a gentle breeze,21,13,2024-04-18,,,,,12,53,6,43,14,58,5,40,,,,,,,,,20,Low chance of precipitation,05:58,20:27,,,,,3,MODERATE,M,Moderate,7,Light Cloud,A gentle breeze from the north west,NW,NW,North Westerly,17,10,2650225,Edinburgh
2024-04-12T10:45:00+01:00,2024-04-12T17:00:12.767+01:00,Light cloud and a moderate breeze,36,22,2024-04-19,,,,,13,56,6,43,16,61,4,39,,,,,,,,,14,Low chance of precipitation,05:56,20:29,,,,,4,MODERATE,M,Moderate,7,Light Cloud,A moderate breeze from the west,W,W,Westerly,23,15,2650225,Edinburgh
2024-04-12T17:00:12+01:00,2024-04-12T17:00:12.767+01:00,Sunny intervals and a moderate breeze,35,22,2024-04-20,,,,,13,56,6,43,15,60,3,38,,,,,,,,,24,Low chance of precipitation,05:53,20:31,,,,,3,MODERATE,M,Moderate,3,Sunny Intervals,A moderate breeze from the west,W,W,Westerly,20,13,2650225,Edinburgh
2024-04-12T17:00:12+01:00,2024-04-12T17:00:12.767+01:00,Light cloud and a gentle breeze,35,22,2024-04-21,,,,,13,55,5,41,15,60,3,37,,,,,,,,,0,Precipitation is not expected,05:51,20:33,,,,,3,MODERATE,M,Moderate,7,Light Cloud,A gentle breeze from the west,W,W,Westerly,18,11,2650225,Edinburgh
2024-04-12T17:00:12+01:00,2024-04-12T17:00:12.767+01:00,Light rain and light winds,23,14,2024-04-22,,,,,11,51,4,39,13,56,1,34,,,,,,,,,59,Chance of precipitation,05:49,20:35,,,,,2,LOW,L,Low,12,Light Rain,Light winds from the east,E,E,Easterly,10,6,2650225,Edinburgh
2024-04-12T17:00:12+01:00,2024-04-12T17:00:12.767+01:00,Sunny intervals and a gentle breeze,35,22,2024-04-23,,,,,10,51,3,38,14,57,0,32,,,,,,,,,22,Low chance of precipitation,05:46,20:37,,,,,4,MODERATE,M,Moderate,3,Sunny Intervals,A gentle breeze from the north east,NE,NE,North Easterly,14,9,2650225,Edinburgh
2024-04-12T17:00:12+01:00,2024-04-12T17:00:12.767+01:00,Light rain showers and a gentle breeze,31,19,2024-04-24,,,,,11,51,4,40,14,58,0,33,,,,,,,,,47,Chance of precipitation,05:44,20:39,,,,,2,LOW,L,Low,10,Light Rain Showers,A gentle breeze from the north east,NE,NE,North Easterly,14,9,2650225,Edinburgh
2024-04-12T17:00:12+01:00,2024-04-12T17:00:12.767+01:00,Sunny intervals and light winds,27,17,2024-04-25,,,,,11,53,4,39,15,60,0,31,,,,,,,,,23,Low chance of precipitation,05:41,20:41,,,,,4,MODERATE,M,Moderate,3,Sunny Intervals,Light winds from the north east,NE,NE,North Easterly,12,7,2650225,Edinburgh
