issueDate,lastUpdated,report.enhancedWeatherDescription,report.gustSpeedKph,report.gustSpeedMph,report.localDate,report.lowermaxTemperatureC,report.lowermaxTemperatureF,report.lowerminTemperatureC,report.lowerminTemperatureF,report.maxTempC,report.maxTempF,report.minTempC,report.minTempF,report.mostLikelyHighTemperatureC,report.mostLikelyHighTemperatureF,report.mostLikelyLowTemperatureC,report.mostLikelyLowTemperatureF,report.pollenIndex,report.pollenIndexBand,report.pollenIndexIconText,report.pollenIndexText,report.pollutionIndex,report.pollutionIndexBand,report.pollutionIndexIconText,report.pollutionIndexText,report.precipitationProbabilityInPercent,report.precipitationProbabilityText,report.sunrise,report.sunset,report.uppermaxTemperatureC,report.uppermaxTemperatureF,report.upperminTemperatureC,report.upperminTemperatureF,report.uvIndex,report.uvIndexBand,report.uvIndexIconText,report.uvIndexText,report.weatherType,report.weatherTypeText,report.windDescription,report.windDirection,report.windDirectionAbbreviation,report.windDirectionFull,report.windSpeedKph,report.windSpeedMph,location_id,location_name
2024-03-16T21:45:00+00:00,2024-03-17T08:00:33.059Z,Light cloud and light winds,18,11,2024-03-17,,,,,12,54,7,44,14,57,6,42,,,,,2.0,LOW,L,Low,20,Low chance of precipitation,06:21,18:22,,,,,2,LOW,L,Low,7,Light Cloud,Light winds from the south,S,S,Southerly,10,6,2650225,Edinburgh
2024-03-16T21:45:00+00:00,2024-03-17T08:00:33.059Z,Sunny intervals and a moderate breeze,45,28,2024-03-18,,,,,13,55,8,47,14,57,7,45,,,,,3.0,LOW,L,Low,0,Precipitation is not expected,06:19,18:24,,,,,4,MODERATE,M,Moderate,3,Sunny Intervals,A moderate breeze from the south west,SW,SW,South Westerly,22,14,2650225,Edinburgh
2024-03-16T21:45:00+00:00,2024-03-17T08:00:33.059Z,Light rain and a moderate breeze,50,31,2024-03-19,,,,,11,53,4,39,13,56,3,38,,,,,3.0,LOW,L,Low,33,Chance of precipitation,06:16,18:26,,,,,3,MODERATE,M,Moderate,12,Light Rain,A moderate breeze from the west,W,W,Westerly,29,18,2650225,Edinburgh
2024-03-16T21:45:00+00:00,2024-03-17T08:00:33.059Z,Light rain and light winds,18,11,2024-03-20,,,,,8,47,3,38,9,49,1,33,,,,,2.0,LOW,L,Low,70,Chance of precipitation,06:13,18:28,,,,,2,LOW,L,Low,12,Light Rain,Light winds from the north,N,N,Northerly,11,7,2650225,Edinburgh
2024-03-16T21:45:00+00:00,2024-03-17T08:00:33.059Z,Gusty winds and drizzle,68,43,2024-03-21,,,,,11,51,7,45,13,55,6,42,,,,,2.0,LOW,L,Low,38,Chance of precipitation,06:11,18:30,,,,,2,LOW,L,Low,11,Drizzle,Gusty winds from the south west,SW,SW,South Westerly,29,18,2650225,Edinburgh
2024-03-16T21:45:00+00:00,2024-03-17T08:00:33.059Z,Gusty winds and drizzle,72,45,2024-03-22,,,,,10,50,4,39,11,52,3,37,,,,,,,,,69,Chance of precipitation,06:08,18:32,,,,,2,LOW,L,Low,11,Drizzle,Gusty winds from the west,W,W,Westerly,38,24,2650225,Edinburgh
2024-03-16T21:45:00+00:00,2024-03-17T08:00:33.059Z,Light rain showers and a fresh breeze,48,30,2024-03-23,,,,,10,50,2,35,11,52,0,32,,,,,,,,,47,Chance of precipitation,06:06,18:34,,,,,3,MODERATE,M,Moderate,10,Light Rain Showers,A fresh breeze from the north west,NW,NW,North Westerly,30,19,2650225,Edinburgh
2024-03-16T21:45:00+00:00,2024-03-17T08:00:33.059Z,Sunny intervals and a gentle breeze,24,15,2024-03-24,,,,,9,49,3,37,10,51,1,34,,,,,,,,,12,Low chance of precipitation,06:03,18:36,,,,,4,MODERATE,M,Moderate,3,Sunny Intervals,A gentle breeze from the north west,NW,NW,North Westerly,17,11,2650225,Edinburgh
2024-03-17T08:00:33+00:00,2024-03-17T08:00:33.059Z,Light rain and a gentle breeze,35,22,2024-03-25,,,,,9,49,3,38,11,51,2,35,,,,,,,,,55,Chance of precipitation,06:00,18:38,,,,,2,LOW,L,Low,12,Light Rain,A gentle breeze from the south west,SW,SW,South Westerly,16,10,2650225,Edinburgh
2024-03-17T08:00:33+00:00,2024-03-17T08:00:33.059Z,Drizzle and a gentle breeze,31,19,2024-03-26,,,,,10,51,4,40,12,54,2,36,,,,,,,,,45,Chance of precipitation,05:58,18:40,,,,,4,MODERATE,M,Moderate,11,Drizzle,A gentle breeze from the south east,SE,SE,South Easterly,14,9,2650225,Edinburgh
2024-03-17T08:00:33+00:00,2024-03-17T08:00:33.059Z,Sunny intervals and a moderate breeze,40,25,2024-03-27,,,,,11,51,4,39,13,56,1,35,,,,,,,,,42,Chance of precipitation,05:55,18:42,,,,,4,MODERATE,M,Moderate,3,Sunny Intervals,A moderate breeze from the south east,SE,SE,South Easterly,20,13,2650225,Edinburgh
2024-03-17T08:00:33+00:00,2024-03-17T08:00:33.059Z,Sunny intervals and a gentle breeze,44,27,2024-03-28,,,,,10,50,4,39,13,55,1,34,,,,,,,,,25,Low chance of precipitation,05:52,18:44,,,,,4,MODERATE,M,Moderate,3,Sunny Intervals,A gentle breeze from the south east,SE,SE,South Easterly,17,11,2650225,Edinburgh
2024-03-17T08:00:33+00:00,2024-03-17T08:00:33.059Z,Light rain and a gentle breeze,39,24,2024-03-29,,,,,10,50,4,39,13,56,1,33,,,,,,,,,38,Chance of precipitation,05:50,18:46,,,,,4,MODERATE,M,Moderate,12,Light Rain,A gentle breeze from the east,E,E,Easterly,16,10,2650225,Edinburgh
2024-03-17T08:00:33+00:00,2024-03-17T08:00:33.059Z,Light rain and a gentle breeze,34,21,2024-03-30,,,,,11,51,4,39,14,58,0,32,,,,,,,,,25,Low chance of precipitation,05:47,18:48,,,,,3,MODERATE,M,Moderate,12,Light Rain,A gentle breeze from the east,E,E,Easterly,16,10,2650225,Edinburgh
