issueDate,lastUpdated,report.enhancedWeatherDescription,report.gustSpeedKph,report.gustSpeedMph,report.localDate,report.lowermaxTemperatureC,report.lowermaxTemperatureF,report.lowerminTemperatureC,report.lowerminTemperatureF,report.maxTempC,report.maxTempF,report.minTempC,report.minTempF,report.mostLikelyHighTemperatureC,report.mostLikelyHighTemperatureF,report.mostLikelyLowTemperatureC,report.mostLikelyLowTemperatureF,report.pollenIndex,report.pollenIndexBand,report.pollenIndexIconText,report.pollenIndexText,report.pollutionIndex,report.pollutionIndexBand,report.pollutionIndexIconText,report.pollutionIndexText,report.precipitationProbabilityInPercent,report.precipitationProbabilityText,report.sunrise,report.sunset,report.uppermaxTemperatureC,report.uppermaxTemperatureF,report.upperminTemperatureC,report.upperminTemperatureF,report.uvIndex,report.uvIndexBand,report.uvIndexIconText,report.uvIndexText,report.weatherType,report.weatherTypeText,report.windDescription,report.windDirection,report.windDirectionAbbreviation,report.windDirectionFull,report.windSpeedKph,report.windSpeedMph,location_id,location_name
2025-03-10T09:46:00+00:00,2025-03-10T16:00:51.859Z,Light cloud and a moderate breeze,52,33,2025-03-10,,,,,6,43,-1,30,7,45,-3,27,,,,,3.0,LOW,L,Low,15,Low chance of precipitation,06:42,18:05,,,,,2,LOW,L,Low,7,Light Cloud,A moderate breeze from the north east,NE,NE,North Easterly,29,18,2650225,Edinburgh
2025-03-10T09:46:00+00:00,2025-03-10T16:00:51.859Z,Sunny intervals and a gentle breeze,35,22,2025-03-11,,,,,8,47,2,35,10,50,0,33,,,,,3.0,LOW,L,Low,32,Chance of precipitation,06:40,18:07,,,,,2,LOW,L,Low,3,Sunny Intervals,A gentle breeze from the north west,NW,NW,North Westerly,18,11,2650225,Edinburgh
2025-03-10T09:46:00+00:00,2025-03-10T16:00:51.859Z,Drizzle and a moderate breeze,42,26,2025-03-12,,,,,7,45,1,33,8,46,0,31,,,,,3.0,LOW,L,Low,51,Chance of precipitation,06:37,18:09,,,,,2,LOW,L,Low,11,Drizzle,A moderate breeze from the north,N,N,Northerly,23,14,2650225,Edinburgh
2025-03-10T09:46:00+00:00,2025-03-10T16:00:51.859Z,Light cloud and light winds,20,12,2025-03-13,,,,,7,45,1,34,8,47,0,31,,,,,3.0,LOW,L,Low,27,Low chance of precipitation,06:34,18:11,,,,,2,LOW,L,Low,7,Light Cloud,Light winds from the north west,NW,NW,North Westerly,12,7,2650225,Edinburgh
2025-03-10T09:46:00+00:00,2025-03-10T16:00:51.859Z,Light rain and a gentle breeze,26,16,2025-03-14,,,,,7,45,0,31,8,47,-2,28,,,,,3.0,LOW,L,Low,35,Chance of precipitation,06:32,18:14,,,,,2,LOW,L,Low,12,Light Rain,A gentle breeze from the north east,NE,NE,North Easterly,16,10,2650225,Edinburgh
2025-03-10T09:46:00+00:00,2025-03-10T16:00:51.859Z,Sunny intervals and a gentle breeze,17,11,2025-03-15,,,,,8,47,0,33,10,49,-1,29,,,,,,,,,0,Precipitation is not expected,06:29,18:16,,,,,3,MODERATE,M,Moderate,3,Sunny Intervals,A gentle breeze from the north west,NW,NW,North Westerly,13,8,2650225,Edinburgh
2025-03-10T09:46:00+00:00,2025-03-10T16:00:51.859Z,Sunny intervals and light winds,13,8,2025-03-16,,,,,9,49,3,37,11,52,1,34,,,,,,,,,0,Precipitation is not expected,06:27,18:18,,,,,4,MODERATE,M,Moderate,3,Sunny Intervals,Light winds from the south west,SW,SW,South Westerly,9,5,2650225,Edinburgh
2025-03-10T09:46:00+00:00,2025-03-10T16:00:51.859Z,Drizzle and a gentle breeze,24,15,2025-03-17,,,,,9,48,3,37,11,51,1,34,,,,,,,,,43,Chance of precipitation,06:24,18:20,,,,,2,LOW,L,Low,11,Drizzle,A gentle breeze from the south,S,S,Southerly,17,10,2650225,Edinburgh
2025-03-10T16:00:51+00:00,2025-03-10T16:00:51.859Z,Light rain and a gentle breeze,33,20,2025-03-18,,,,,8,47,2,35,10,50,0,32,,,,,,,,,40,Chance of precipitation,06:21,18:22,,,,,3,MODERATE,M,Moderate,12,Light Rain,A gentle breeze from the south,S,S,Southerly,18,11,2650225,Edinburgh
2025-03-10T16:00:51+00:00,2025-03-10T16:00:51.859Z,Sunny intervals and a gentle breeze,45,28,2025-03-19,,,,,9,48,5,41,11,51,3,37,,,,,,,,,41,Chance of precipitation,06:19,18:24,,,,,2,LOW,L,Low,3,Sunny Intervals,A gentle breeze from the south west,SW,SW,South Westerly,18,11,2650225,Edinburgh
2025-03-10T16:00:51+00:00,2025-03-10T16:00:51.859Z,Light rain and a moderate breeze,58,36,2025-03-20,,,,,11,52,6,42,13,56,3,38,,,,,,,,,42,Chance of precipitation,06:16,18:26,,,,,2,LOW,L,Low,12,Light Rain,A moderate breeze from the south west,SW,SW,South Westerly,23,14,2650225,Edinburgh
2025-03-10T16:00:51+00:00,2025-03-10T16:00:51.859Z,Light rain and a gentle breeze,34,21,2025-03-21,,,,,11,51,5,41,13,55,3,37,,,,,,,,,57,Chance of precipitation,06:13,18:28,,,,,1,LOW,L,Low,12,Light Rain,A gentle breeze from the south west,SW,SW,South Westerly,14,9,2650225,Edinburgh
2025-03-10T16:00:51+00:00,2025-03-10T16:00:51.859Z,Drizzle and a gentle breeze,24,15,2025-03-22,,,,,11,51,4,40,14,57,1,35,,,,,,,,,53,Chance of precipitation,06:11,18:30,,,,,3,MODERATE,M,Moderate,11,Drizzle,A gentle breeze from the south,S,S,Southerly,14,9,2650225,Edinburgh
2025-03-10T16:00:51+00:00,2025-03-10T16:00:51.859Z,Light rain showers and a gentle breeze,14,9,2025-03-23,,,,,12,53,5,41,15,59,2,35,,,,,,,,,47,Chance of precipitation,06:08,18:32,,,,,4,MODERATE,M,Moderate,10,Light Rain Showers,A gentle breeze from the south,S,S,Southerly,13,8,2650225,Edinburgh
