issueDate,lastUpdated,report.enhancedWeatherDescription,report.gustSpeedKph,report.gustSpeedMph,report.localDate,report.lowermaxTemperatureC,report.lowermaxTemperatureF,report.lowerminTemperatureC,report.lowerminTemperatureF,report.maxTempC,report.maxTempF,report.minTempC,report.minTempF,report.mostLikelyHighTemperatureC,report.mostLikelyHighTemperatureF,report.mostLikelyLowTemperatureC,report.mostLikelyLowTemperatureF,report.pollenIndex,report.pollenIndexBand,report.pollenIndexIconText,report.pollenIndexText,report.pollutionIndex,report.pollutionIndexBand,report.pollutionIndexIconText,report.pollutionIndexText,report.precipitationProbabilityInPercent,report.precipitationProbabilityText,report.sunrise,report.sunset,report.uppermaxTemperatureC,report.uppermaxTemperatureF,report.upperminTemperatureC,report.upperminTemperatureF,report.uvIndex,report.uvIndexBand,report.uvIndexIconText,report.uvIndexText,report.weatherType,report.weatherTypeText,report.windDescription,report.windDirection,report.windDirectionAbbreviation,report.windDirectionFull,report.windSpeedKph,report.windSpeedMph,location_id,location_name
2024-02-05T09:46:00+00:00,2024-02-05T16:00:13.814Z,Strong winds and rain,77,48,2024-02-05,,,,,10,51,6,42,11,52,5,41,,,,,3.0,LOW,L,Low,87,High chance of precipitation,08:01,16:54,,,,,1,LOW,L,Low,12,Light Rain,Strong winds from the south west,SW,SW,South Westerly,40,25,2650225,Edinburgh
2024-02-05T09:46:00+00:00,2024-02-05T16:00:13.814Z,Sunny intervals and a moderate breeze,46,28,2024-02-06,,,,,7,45,-1,31,7,45,-2,28,,,,,3.0,LOW,L,Low,38,Chance of precipitation,07:58,16:56,,,,,2,LOW,L,Low,3,Sunny Intervals,A moderate breeze from the west,W,W,Westerly,23,14,2650225,Edinburgh
2024-02-05T09:46:00+00:00,2024-02-05T16:00:13.814Z,Sunny intervals and a gentle breeze,25,16,2024-02-07,,,,,5,41,-2,29,6,43,-3,27,,,,,2.0,LOW,L,Low,7,Low chance of precipitation,07:56,16:59,,,,,2,LOW,L,Low,3,Sunny Intervals,A gentle breeze from the south west,SW,SW,South Westerly,12,8,2650225,Edinburgh
2024-02-05T09:46:00+00:00,2024-02-05T16:00:13.814Z,Sleet showers and a moderate breeze,52,33,2024-02-08,,,,,4,40,2,35,5,41,1,34,,,,,2.0,LOW,L,Low,53,Chance of precipitation,07:54,17:01,,,,,2,LOW,L,Low,17,Sleet Showers,A moderate breeze from the east,E,E,Easterly,27,17,2650225,Edinburgh
2024-02-05T09:46:00+00:00,2024-02-05T16:00:13.814Z,Light rain and a fresh breeze,61,38,2024-02-09,,,,,5,41,3,37,6,42,1,35,,,,,2.0,LOW,L,Low,70,Chance of precipitation,07:52,17:03,,,,,1,LOW,L,Low,12,Light Rain,A fresh breeze from the north east,NE,NE,North Easterly,33,20,2650225,Edinburgh
2024-02-05T09:46:00+00:00,2024-02-05T16:00:13.814Z,Light rain and a moderate breeze,42,26,2024-02-10,,,,,5,41,2,35,6,43,0,32,,,,,,,,,70,Chance of precipitation,07:50,17:05,,,,,1,LOW,L,Low,12,Light Rain,A moderate breeze from the north east,NE,NE,North Easterly,29,18,2650225,Edinburgh
2024-02-05T09:46:00+00:00,2024-02-05T16:00:13.814Z,Light rain and a gentle breeze,20,13,2024-02-11,,,,,5,41,0,32,7,45,-4,25,,,,,,,,,70,Chance of precipitation,07:48,17:07,,,,,1,LOW,L,Low,12,Light Rain,A gentle breeze from the north,N,N,Northerly,15,9,2650225,Edinburgh
2024-02-05T09:46:00+00:00,2024-02-05T16:00:13.814Z,Sleet and light winds,22,14,2024-02-12,,,,,5,41,0,33,8,47,-3,27,,,,,,,,,44,Chance of precipitation,07:46,17:10,,,,,2,LOW,L,Low,18,Sleet,Light winds from the north,N,N,Northerly,12,7,2650225,Edinburgh
2024-02-05T16:00:13+00:00,2024-02-05T16:00:13.814Z,Light rain and a gentle breeze,23,15,2024-02-13,,,,,5,41,0,31,7,44,-3,27,,,,,,,,,42,Chance of precipitation,07:43,17:12,,,,,2,LOW,L,Low,12,Light Rain,A gentle breeze from the east,E,E,Easterly,13,8,2650225,Edinburgh
2024-02-05T16:00:13+00:00,2024-02-05T16:00:13.814Z,Sunny intervals and light winds,28,18,2024-02-14,,,,,6,43,2,35,9,47,-1,31,,,,,,,,,24,Low chance of precipitation,07:41,17:14,,,,,2,LOW,L,Low,3,Sunny Intervals,Light winds from the south west,SW,SW,South Westerly,12,7,2650225,Edinburgh
2024-02-05T16:00:13+00:00,2024-02-05T16:00:13.814Z,Light cloud and light winds,9,6,2024-02-15,,,,,7,44,2,36,9,49,-1,31,,,,,,,,,0,Precipitation is not expected,07:39,17:16,,,,,1,LOW,L,Low,7,Light Cloud,Light winds from the south west,SW,SW,South Westerly,6,4,2650225,Edinburgh
2024-02-05T16:00:13+00:00,2024-02-05T16:00:13.814Z,Light rain and light winds,9,5,2024-02-16,,,,,7,45,2,36,11,51,-1,29,,,,,,,,,60,Chance of precipitation,07:37,17:18,,,,,1,LOW,L,Low,12,Light Rain,Light winds from the south west,SW,SW,South Westerly,6,4,2650225,Edinburgh
2024-02-05T16:00:13+00:00,2024-02-05T16:00:13.814Z,Light rain and light winds,16,10,2024-02-17,,,,,7,44,3,37,10,50,-1,29,,,,,,,,,52,Chance of precipitation,07:34,17:21,,,,,1,LOW,L,Low,12,Light Rain,Light winds from the south west,SW,SW,South Westerly,10,6,2650225,Edinburgh
2024-02-05T16:00:13+00:00,2024-02-05T16:00:13.814Z,Light rain and light winds,14,9,2024-02-18,,,,,7,45,3,37,11,52,-2,29,,,,,,,,,43,Chance of precipitation,07:32,17:23,,,,,1,LOW,L,Low,12,Light Rain,Light winds from the west,W,W,Westerly,11,7,2650225,Edinburgh
