issueDate,lastUpdated,report.enhancedWeatherDescription,report.gustSpeedKph,report.gustSpeedMph,report.localDate,report.lowermaxTemperatureC,report.lowermaxTemperatureF,report.lowerminTemperatureC,report.lowerminTemperatureF,report.maxTempC,report.maxTempF,report.minTempC,report.minTempF,report.mostLikelyHighTemperatureC,report.mostLikelyHighTemperatureF,report.mostLikelyLowTemperatureC,report.mostLikelyLowTemperatureF,report.pollenIndex,report.pollenIndexBand,report.pollenIndexIconText,report.pollenIndexText,report.pollutionIndex,report.pollutionIndexBand,report.pollutionIndexIconText,report.pollutionIndexText,report.precipitationProbabilityInPercent,report.precipitationProbabilityText,report.sunrise,report.sunset,report.uppermaxTemperatureC,report.uppermaxTemperatureF,report.upperminTemperatureC,report.upperminTemperatureF,report.uvIndex,report.uvIndexBand,report.uvIndexIconText,report.uvIndexText,report.weatherType,report.weatherTypeText,report.windDescription,report.windDirection,report.windDirectionAbbreviation,report.windDirectionFull,report.windSpeedKph,report.windSpeedMph,location_id,location_name
2024-07-12T10:45:00+01:00,2024-07-12T17:01:33.27+01:00,Drizzle and light winds,21,13,2024-07-12,,,,,14,57,11,51,15,59,10,49,6.0,HIGH,H,High,2.0,LOW,L,Low,37,Chance of precipitation,04:45,21:52,,,,,4,MODERATE,M,Moderate,38,Drizzle,Light winds from the east,E,E,Easterly,12,7,2650225,Edinburgh
2024-07-12T10:45:00+01:00,2024-07-12T17:01:33.27+01:00,Light rain and light winds,24,15,2024-07-13,,,,,14,57,11,51,15,59,10,50,4.0,MODERATE,M,Moderate,2.0,LOW,L,Low,74,High chance of precipitation,04:46,21:50,,,,,1,LOW,L,Low,12,Light Rain,Light winds from the north east,NE,NE,North Easterly,12,7,2650225,Edinburgh
2024-07-12T10:45:00+01:00,2024-07-12T17:01:33.27+01:00,Drizzle and light winds,18,11,2024-07-14,,,,,18,64,11,52,19,67,10,49,6.0,HIGH,H,High,3.0,LOW,L,Low,40,Chance of precipitation,04:47,21:49,,,,,3,MODERATE,M,Moderate,11,Drizzle,Light winds from the west,W,W,Westerly,11,7,2650225,Edinburgh
2024-07-12T10:45:00+01:00,2024-07-12T17:01:33.27+01:00,Light rain showers and light winds,23,14,2024-07-15,,,,,19,67,11,52,21,70,10,50,6.0,HIGH,H,High,3.0,LOW,L,Low,31,Chance of precipitation,04:49,21:48,,,,,5,MODERATE,M,Moderate,10,Light Rain Showers,Light winds from the south west,SW,SW,South Westerly,11,7,2650225,Edinburgh
2024-07-12T10:45:00+01:00,2024-07-12T17:01:33.27+01:00,Light rain and a moderate breeze,34,21,2024-07-16,,,,,19,66,10,51,21,69,10,49,4.0,MODERATE,M,Moderate,3.0,LOW,L,Low,62,Chance of precipitation,04:50,21:47,,,,,4,MODERATE,M,Moderate,12,Light Rain,A moderate breeze from the west,W,W,Westerly,21,13,2650225,Edinburgh
2024-07-12T10:45:00+01:00,2024-07-12T17:01:33.27+01:00,Light rain showers and a gentle breeze,31,19,2024-07-17,,,,,18,65,10,51,20,68,9,48,,,,,,,,,66,Chance of precipitation,04:52,21:45,,,,,4,MODERATE,M,Moderate,10,Light Rain Showers,A gentle breeze from the south west,SW,SW,South Westerly,19,12,2650225,Edinburgh
2024-07-12T10:45:00+01:00,2024-07-12T17:01:33.27+01:00,Light rain and a moderate breeze,31,19,2024-07-18,,,,,18,65,10,51,20,68,9,48,,,,,,,,,50,Chance of precipitation,04:54,21:44,,,,,5,MODERATE,M,Moderate,12,Light Rain,A moderate breeze from the west,W,W,Westerly,22,14,2650225,Edinburgh
2024-07-12T10:45:00+01:00,2024-07-12T17:01:33.27+01:00,Light rain showers and a moderate breeze,42,26,2024-07-19,,,,,18,65,11,52,19,67,10,50,,,,,,,,,70,Chance of precipitation,04:55,21:42,,,,,3,MODERATE,M,Moderate,10,Light Rain Showers,A moderate breeze from the south west,SW,SW,South Westerly,23,14,2650225,Edinburgh
2024-07-12T17:01:33+01:00,2024-07-12T17:01:33.27+01:00,Light rain showers and a moderate breeze,31,19,2024-07-20,,,,,18,64,9,49,19,66,8,46,,,,,,,,,40,Chance of precipitation,04:57,21:41,,,,,5,MODERATE,M,Moderate,10,Light Rain Showers,A moderate breeze from the west,W,W,Westerly,21,13,2650225,Edinburgh
2024-07-12T17:01:33+01:00,2024-07-12T17:01:33.27+01:00,Light rain and a gentle breeze,25,16,2024-07-21,,,,,17,63,11,52,19,65,9,49,,,,,,,,,70,Chance of precipitation,04:58,21:39,,,,,3,MODERATE,M,Moderate,12,Light Rain,A gentle breeze from the west,W,W,Westerly,19,12,2650225,Edinburgh
2024-07-12T17:01:33+01:00,2024-07-12T17:01:33.27+01:00,Drizzle and a moderate breeze,24,15,2024-07-22,,,,,17,63,9,49,19,66,7,45,,,,,,,,,44,Chance of precipitation,05:00,21:37,,,,,4,MODERATE,M,Moderate,11,Drizzle,A moderate breeze from the west,W,W,Westerly,21,13,2650225,Edinburgh
2024-07-12T17:01:33+01:00,2024-07-12T17:01:33.27+01:00,Drizzle and a moderate breeze,33,20,2024-07-23,,,,,17,63,11,51,19,67,8,46,,,,,,,,,41,Chance of precipitation,05:02,21:36,,,,,3,MODERATE,M,Moderate,11,Drizzle,A moderate breeze from the west,W,W,Westerly,23,15,2650225,Edinburgh
2024-07-12T17:01:33+01:00,2024-07-12T17:01:33.27+01:00,Light rain and a moderate breeze,42,26,2024-07-24,,,,,18,64,10,50,21,69,7,44,,,,,,,,,49,Chance of precipitation,05:04,21:34,,,,,2,LOW,L,Low,12,Light Rain,A moderate breeze from the west,W,W,Westerly,24,15,2650225,Edinburgh
2024-07-12T17:01:33+01:00,2024-07-12T17:01:33.27+01:00,Light cloud and a moderate breeze,53,33,2024-07-25,,,,,17,63,9,48,21,69,5,41,,,,,,,,,11,Low chance of precipitation,05:05,21:32,,,,,4,MODERATE,M,Moderate,7,Light Cloud,A moderate breeze from the west,W,W,Westerly,23,15,2650225,Edinburgh
