issueDate,lastUpdated,report.enhancedWeatherDescription,report.gustSpeedKph,report.gustSpeedMph,report.localDate,report.lowermaxTemperatureC,report.lowermaxTemperatureF,report.lowerminTemperatureC,report.lowerminTemperatureF,report.maxTempC,report.maxTempF,report.minTempC,report.minTempF,report.mostLikelyHighTemperatureC,report.mostLikelyHighTemperatureF,report.mostLikelyLowTemperatureC,report.mostLikelyLowTemperatureF,report.pollenIndex,report.pollenIndexBand,report.pollenIndexIconText,report.pollenIndexText,report.pollutionIndex,report.pollutionIndexBand,report.pollutionIndexIconText,report.pollutionIndexText,report.precipitationProbabilityInPercent,report.precipitationProbabilityText,report.sunrise,report.sunset,report.uppermaxTemperatureC,report.uppermaxTemperatureF,report.upperminTemperatureC,report.upperminTemperatureF,report.uvIndex,report.uvIndexBand,report.uvIndexIconText,report.uvIndexText,report.weatherType,report.weatherTypeText,report.windDescription,report.windDirection,report.windDirectionAbbreviation,report.windDirectionFull,report.windSpeedKph,report.windSpeedMph,location_id,location_name
2024-05-03T10:45:00+01:00,2024-05-03T17:00:54.675+01:00,Light rain and a moderate breeze,38,24,2024-05-03,,,,,12,53,8,46,13,56,7,45,1.0,LOW,L,Low,3.0,LOW,L,Low,6,Low chance of precipitation,05:23,20:57,,,,,3,MODERATE,M,Moderate,12,Light Rain,A moderate breeze from the north east,NE,NE,North Easterly,23,14,2650225,Edinburgh
2024-05-03T10:45:00+01:00,2024-05-03T17:00:54.675+01:00,Light rain and light winds,13,8,2024-05-04,,,,,13,55,9,49,15,58,8,47,1.0,LOW,L,Low,3.0,LOW,L,Low,73,High chance of precipitation,05:21,20:59,,,,,1,LOW,L,Low,12,Light Rain,Light winds from the east,E,E,Easterly,7,4,2650225,Edinburgh
2024-05-03T10:45:00+01:00,2024-05-03T17:00:54.675+01:00,Light rain and light winds,23,14,2024-05-05,,,,,15,59,9,47,16,61,8,46,4.0,MODERATE,M,Moderate,3.0,LOW,L,Low,58,Chance of precipitation,05:19,21:01,,,,,2,LOW,L,Low,12,Light Rain,Light winds from the south west,SW,SW,South Westerly,11,7,2650225,Edinburgh
2024-05-03T10:45:00+01:00,2024-05-03T17:00:54.675+01:00,Light rain and light winds,13,8,2024-05-06,,,,,14,58,8,47,17,62,7,45,4.0,MODERATE,M,Moderate,3.0,LOW,L,Low,45,Chance of precipitation,05:17,21:03,,,,,3,MODERATE,M,Moderate,12,Light Rain,Light winds from the north east,NE,NE,North Easterly,11,7,2650225,Edinburgh
2024-05-03T10:45:00+01:00,2024-05-03T17:00:54.675+01:00,Misty and light winds,17,11,2024-05-07,,,,,14,57,7,45,16,60,6,42,4.0,MODERATE,M,Moderate,3.0,LOW,L,Low,23,Low chance of precipitation,05:15,21:05,,,,,3,MODERATE,M,Moderate,5,Mist,Light winds from the north east,NE,NE,North Easterly,12,7,2650225,Edinburgh
2024-05-03T10:45:00+01:00,2024-05-03T17:00:54.675+01:00,Light cloud and light winds,19,12,2024-05-08,,,,,15,59,9,49,17,62,7,45,,,,,,,,,28,Low chance of precipitation,05:13,21:07,,,,,4,MODERATE,M,Moderate,7,Light Cloud,Light winds from the east,E,E,Easterly,9,6,2650225,Edinburgh
2024-05-03T10:45:00+01:00,2024-05-03T17:00:54.675+01:00,Light cloud and a gentle breeze,31,19,2024-05-09,,,,,17,63,9,48,19,65,8,46,,,,,,,,,19,Low chance of precipitation,05:11,21:09,,,,,3,MODERATE,M,Moderate,7,Light Cloud,A gentle breeze from the south west,SW,SW,South Westerly,20,12,2650225,Edinburgh
2024-05-03T10:45:00+01:00,2024-05-03T17:00:54.675+01:00,Drizzle and light winds,16,10,2024-05-10,,,,,18,64,9,48,20,67,8,46,,,,,,,,,41,Chance of precipitation,05:09,21:11,,,,,5,MODERATE,M,Moderate,11,Drizzle,Light winds from the west,W,W,Westerly,11,7,2650225,Edinburgh
2024-05-03T17:00:54+01:00,2024-05-03T17:00:54.675+01:00,Light rain showers and a gentle breeze,20,13,2024-05-11,,,,,18,64,9,49,20,68,7,45,,,,,,,,,39,Chance of precipitation,05:07,21:13,,,,,4,MODERATE,M,Moderate,10,Light Rain Showers,A gentle breeze from the east,E,E,Easterly,13,8,2650225,Edinburgh
2024-05-03T17:00:54+01:00,2024-05-03T17:00:54.675+01:00,Drizzle and a gentle breeze,31,19,2024-05-12,,,,,17,62,8,47,19,66,6,43,,,,,,,,,48,Chance of precipitation,05:05,21:15,,,,,4,MODERATE,M,Moderate,11,Drizzle,A gentle breeze from the east,E,E,Easterly,13,8,2650225,Edinburgh
2024-05-03T17:00:54+01:00,2024-05-03T17:00:54.675+01:00,Drizzle and a gentle breeze,31,19,2024-05-13,,,,,16,60,8,46,18,65,5,41,,,,,,,,,70,Chance of precipitation,05:03,21:17,,,,,3,MODERATE,M,Moderate,11,Drizzle,A gentle breeze from the south west,SW,SW,South Westerly,12,8,2650225,Edinburgh
2024-05-03T17:00:54+01:00,2024-05-03T17:00:54.675+01:00,Light rain showers and light winds,23,15,2024-05-14,,,,,15,58,8,46,17,63,5,40,,,,,,,,,44,Chance of precipitation,05:01,21:18,,,,,3,MODERATE,M,Moderate,10,Light Rain Showers,Light winds from the south west,SW,SW,South Westerly,9,6,2650225,Edinburgh
2024-05-03T17:00:54+01:00,2024-05-03T17:00:54.675+01:00,Light rain and light winds,20,13,2024-05-15,,,,,14,57,8,47,17,63,5,41,,,,,,,,,70,Chance of precipitation,04:59,21:20,,,,,3,MODERATE,M,Moderate,12,Light Rain,Light winds from the north west,NW,NW,North Westerly,8,5,2650225,Edinburgh
2024-05-03T17:00:54+01:00,2024-05-03T17:00:54.675+01:00,Drizzle and light winds,23,15,2024-05-16,,,,,14,57,6,44,18,64,3,37,,,,,,,,,60,Chance of precipitation,04:57,21:22,,,,,3,MODERATE,M,Moderate,11,Drizzle,Light winds from the north,N,N,Northerly,10,6,2650225,Edinburgh
