issueDate,lastUpdated,report.enhancedWeatherDescription,report.gustSpeedKph,report.gustSpeedMph,report.localDate,report.lowermaxTemperatureC,report.lowermaxTemperatureF,report.lowerminTemperatureC,report.lowerminTemperatureF,report.maxTempC,report.maxTempF,report.minTempC,report.minTempF,report.mostLikelyHighTemperatureC,report.mostLikelyHighTemperatureF,report.mostLikelyLowTemperatureC,report.mostLikelyLowTemperatureF,report.pollenIndex,report.pollenIndexBand,report.pollenIndexIconText,report.pollenIndexText,report.pollutionIndex,report.pollutionIndexBand,report.pollutionIndexIconText,report.pollutionIndexText,report.precipitationProbabilityInPercent,report.precipitationProbabilityText,report.sunrise,report.sunset,report.uppermaxTemperatureC,report.uppermaxTemperatureF,report.upperminTemperatureC,report.upperminTemperatureF,report.uvIndex,report.uvIndexBand,report.uvIndexIconText,report.uvIndexText,report.weatherType,report.weatherTypeText,report.windDescription,report.windDirection,report.windDirectionAbbreviation,report.windDirectionFull,report.windSpeedKph,report.windSpeedMph,location_id,location_name
2023-02-22T21:51:00+00:00,2023-02-23T08:13:34.087Z,Sunny and a moderate breeze,50,31,2023-02-23,,,,,9,47,6,43,9,49,5,41,,,,,2.0,LOW,L,Low,0,Precipitation is not expected,07:20,17:34,,,,,2,LOW,L,Low,1,Sunny,A moderate breeze from the west,W,W,Westerly,24,15,2650225,Edinburgh
2023-02-22T21:51:00+00:00,2023-02-23T08:13:34.087Z,Light rain showers and a gentle breeze,35,22,2023-02-24,,,,,8,47,0,31,9,48,-2,28,,,,,3.0,LOW,L,Low,43,Chance of precipitation,07:18,17:36,,,,,1,LOW,L,Low,10,Light Rain Showers,A gentle breeze from the north,N,N,Northerly,18,11,2650225,Edinburgh
2023-02-22T21:51:00+00:00,2023-02-23T08:13:34.087Z,Sunny intervals and a gentle breeze,27,17,2023-02-25,,,,,7,44,1,34,8,47,-1,29,,,,,3.0,LOW,L,Low,11,Low chance of precipitation,07:15,17:38,,,,,2,LOW,L,Low,3,Sunny Intervals,A gentle breeze from the north east,NE,NE,North Easterly,15,9,2650225,Edinburgh
2023-02-22T21:51:00+00:00,2023-02-23T08:13:34.087Z,Sunny intervals and light winds,16,10,2023-02-26,,,,,7,45,1,33,10,50,-3,26,,,,,3.0,LOW,L,Low,0,Precipitation is not expected,07:13,17:40,,,,,2,LOW,L,Low,3,Sunny Intervals,Light winds from the north west,NW,NW,North Westerly,9,6,2650225,Edinburgh
2023-02-22T21:51:00+00:00,2023-02-23T08:13:34.087Z,Light cloud and light winds,21,13,2023-02-27,,,,,7,45,4,39,9,48,2,36,,,,,3.0,LOW,L,Low,13,Low chance of precipitation,07:10,17:42,,,,,1,LOW,L,Low,7,Light Cloud,Light winds from the north east,NE,NE,North Easterly,11,7,2650225,Edinburgh
2023-02-22T21:51:00+00:00,2023-02-23T08:13:34.087Z,Drizzle and a gentle breeze,28,18,2023-02-28,,,,,8,46,4,40,9,48,3,38,,,,,,,,,42,Chance of precipitation,07:08,17:44,,,,,1,LOW,L,Low,11,Drizzle,A gentle breeze from the north east,NE,NE,North Easterly,16,10,2650225,Edinburgh
2023-02-22T21:51:00+00:00,2023-02-23T08:13:34.087Z,Light rain showers and a gentle breeze,31,19,2023-03-01,,,,,7,45,4,40,8,47,2,36,,,,,,,,,52,Chance of precipitation,07:05,17:46,,,,,1,LOW,L,Low,10,Light Rain Showers,A gentle breeze from the north east,NE,NE,North Easterly,17,10,2650225,Edinburgh
2023-02-22T21:51:00+00:00,2023-02-23T08:13:34.087Z,Light cloud and light winds,19,12,2023-03-02,,,,,8,46,2,35,9,47,-1,31,,,,,,,,,25,Low chance of precipitation,07:03,17:48,,,,,1,LOW,L,Low,7,Light Cloud,Light winds from the north,N,N,Northerly,12,7,2650225,Edinburgh
2023-02-23T08:13:34+00:00,2023-02-23T08:13:34.087Z,Sunny intervals and light winds,18,11,2023-03-03,,,,,8,46,3,37,10,50,2,36,,,,,,,,,19,Low chance of precipitation,07:00,17:51,,,,,2,LOW,L,Low,3,Sunny Intervals,Light winds from the north west,NW,NW,North Westerly,12,7,2650225,Edinburgh
2023-02-23T08:13:34+00:00,2023-02-23T08:13:34.087Z,Sleet showers and a gentle breeze,40,25,2023-03-04,,,,,7,44,3,38,7,45,2,36,,,,,,,,,50,Chance of precipitation,06:58,17:53,,,,,1,LOW,L,Low,17,Sleet Showers,A gentle breeze from the north west,NW,NW,North Westerly,15,10,2650225,Edinburgh
2023-02-23T08:13:34+00:00,2023-02-23T08:13:34.087Z,Sleet and a gentle breeze,28,17,2023-03-05,,,,,6,43,2,36,7,45,1,34,,,,,,,,,70,Chance of precipitation,06:55,17:55,,,,,1,LOW,L,Low,18,Sleet,A gentle breeze from the north west,NW,NW,North Westerly,16,10,2650225,Edinburgh
2023-02-23T08:13:34+00:00,2023-02-23T08:13:34.087Z,Light snow and a gentle breeze,47,29,2023-03-06,,,,,7,44,3,37,8,46,2,35,,,,,,,,,69,Chance of precipitation,06:53,17:57,,,,,1,LOW,L,Low,24,Light Snow,A gentle breeze from the north west,NW,NW,North Westerly,16,10,2650225,Edinburgh
2023-02-23T08:13:34+00:00,2023-02-23T08:13:34.087Z,Light rain and a gentle breeze,26,16,2023-03-07,,,,,7,44,2,35,8,46,1,33,,,,,,,,,48,Chance of precipitation,06:50,17:59,,,,,1,LOW,L,Low,12,Light Rain,A gentle breeze from the west,W,W,Westerly,12,8,2650225,Edinburgh
2023-02-23T08:13:34+00:00,2023-02-23T08:13:34.087Z,Sleet and a gentle breeze,27,17,2023-03-08,,,,,7,44,3,37,8,46,2,35,,,,,,,,,70,Chance of precipitation,06:47,18:01,,,,,1,LOW,L,Low,18,Sleet,A gentle breeze from the west,W,W,Westerly,15,10,2650225,Edinburgh
