issueDate,lastUpdated,report.enhancedWeatherDescription,report.gustSpeedKph,report.gustSpeedMph,report.localDate,report.lowermaxTemperatureC,report.lowermaxTemperatureF,report.lowerminTemperatureC,report.lowerminTemperatureF,report.maxTempC,report.maxTempF,report.minTempC,report.minTempF,report.mostLikelyHighTemperatureC,report.mostLikelyHighTemperatureF,report.mostLikelyLowTemperatureC,report.mostLikelyLowTemperatureF,report.pollenIndex,report.pollenIndexBand,report.pollenIndexIconText,report.pollenIndexText,report.pollutionIndex,report.pollutionIndexBand,report.pollutionIndexIconText,report.pollutionIndexText,report.precipitationProbabilityInPercent,report.precipitationProbabilityText,report.sunrise,report.sunset,report.uppermaxTemperatureC,report.uppermaxTemperatureF,report.upperminTemperatureC,report.upperminTemperatureF,report.uvIndex,report.uvIndexBand,report.uvIndexIconText,report.uvIndexText,report.weatherType,report.weatherTypeText,report.windDescription,report.windDirection,report.windDirectionAbbreviation,report.windDirectionFull,report.windSpeedKph,report.windSpeedMph,location_id,location_name
2024-12-05T21:45:00+00:00,2024-12-06T00:56:13.428Z,A clear sky and a moderate breeze,55,34,2024-12-05,,,,,7,44,3,37,7,45,2,35,,,,,2.0,LOW,L,Low,0,Precipitation is not expected,08:26,15:40,,,,,0,LOW,L,Low,0,Clear Sky,A moderate breeze from the west,W,W,Westerly,28,18,2650225,Edinburgh
2024-12-05T21:45:00+00:00,2024-12-06T00:56:13.428Z,Light rain and a gentle breeze,37,23,2024-12-06,,,,,7,44,3,37,7,45,1,34,,,,,2.0,LOW,L,Low,80,High chance of precipitation,08:28,15:40,,,,,1,LOW,L,Low,12,Light Rain,A gentle breeze from the south west,SW,SW,South Westerly,17,11,2650225,Edinburgh
2024-12-05T21:45:00+00:00,2024-12-06T00:56:13.428Z,Gusty winds and heavy rain,67,42,2024-12-07,,,,,6,43,3,37,7,44,2,35,,,,,2.0,LOW,L,Low,70,Chance of precipitation,08:29,15:39,,,,,1,LOW,L,Low,15,Heavy Rain,Gusty winds from the north west,NW,NW,North Westerly,31,19,2650225,Edinburgh
2024-12-05T21:45:00+00:00,2024-12-06T00:56:13.428Z,Sunny intervals and a moderate breeze,60,37,2024-12-08,,,,,7,44,4,39,9,47,2,35,,,,,2.0,LOW,L,Low,29,Low chance of precipitation,08:31,15:39,,,,,1,LOW,L,Low,3,Sunny Intervals,A moderate breeze from the north,N,N,Northerly,25,16,2650225,Edinburgh
2024-12-05T21:45:00+00:00,2024-12-06T00:56:13.428Z,Light cloud and a gentle breeze,36,22,2024-12-09,,,,,6,43,0,33,8,46,-2,29,,,,,2.0,LOW,L,Low,0,Precipitation is not expected,08:32,15:39,,,,,1,LOW,L,Low,7,Light Cloud,A gentle breeze from the north,N,N,Northerly,15,9,2650225,Edinburgh
2024-12-05T21:45:00+00:00,2024-12-06T00:56:13.428Z,Sunny intervals and light winds,12,7,2024-12-10,,,,,4,39,0,32,6,43,-2,29,,,,,,,,,0,Precipitation is not expected,08:33,15:38,,,,,1,LOW,L,Low,3,Sunny Intervals,Light winds from the west,W,W,Westerly,5,3,2650225,Edinburgh
2024-12-05T21:45:00+00:00,2024-12-06T00:56:13.428Z,Sunny intervals and light winds,14,9,2024-12-11,,,,,4,40,1,34,6,43,-2,29,,,,,,,,,0,Precipitation is not expected,08:34,15:38,,,,,1,LOW,L,Low,3,Sunny Intervals,Light winds from the west,W,W,Westerly,7,4,2650225,Edinburgh
2024-12-06T00:56:13+00:00,2024-12-06T00:56:13.428Z,Drizzle and light winds,20,12,2024-12-12,,,,,5,41,1,33,7,45,-2,28,,,,,,,,,31,Chance of precipitation,08:35,15:38,,,,,1,LOW,L,Low,11,Drizzle,Light winds from the south,S,S,Southerly,9,5,2650225,Edinburgh
2024-12-06T00:56:13+00:00,2024-12-06T00:56:13.428Z,Sunny intervals and light winds,16,10,2024-12-13,,,,,5,41,1,34,7,44,-1,29,,,,,,,,,0,Precipitation is not expected,08:36,15:38,,,,,1,LOW,L,Low,3,Sunny Intervals,Light winds from the south west,SW,SW,South Westerly,9,6,2650225,Edinburgh
2024-12-06T00:56:13+00:00,2024-12-06T00:56:13.428Z,Sunny intervals and light winds,21,13,2024-12-14,,,,,4,39,1,33,6,43,-2,29,,,,,,,,,63,Chance of precipitation,08:37,15:38,,,,,1,LOW,L,Low,3,Sunny Intervals,Light winds from the west,W,W,Westerly,12,7,2650225,Edinburgh
2024-12-06T00:56:13+00:00,2024-12-06T00:56:13.428Z,Light rain and a moderate breeze,49,30,2024-12-15,,,,,7,44,3,38,9,49,1,33,,,,,,,,,53,Chance of precipitation,08:38,15:38,,,,,1,LOW,L,Low,12,Light Rain,A moderate breeze from the south west,SW,SW,South Westerly,21,13,2650225,Edinburgh
2024-12-06T00:56:13+00:00,2024-12-06T00:56:13.428Z,Gusty winds and light cloud,65,41,2024-12-16,,,,,6,43,2,35,9,48,-1,29,,,,,,,,,71,High chance of precipitation,08:39,15:38,,,,,1,LOW,L,Low,7,Light Cloud,Gusty winds from the south west,SW,SW,South Westerly,25,16,2650225,Edinburgh
2024-12-06T00:56:13+00:00,2024-12-06T00:56:13.428Z,Light rain and a moderate breeze,53,33,2024-12-17,,,,,5,41,1,34,10,49,-3,26,,,,,,,,,70,Chance of precipitation,08:40,15:38,,,,,1,LOW,L,Low,12,Light Rain,A moderate breeze from the south west,SW,SW,South Westerly,22,14,2650225,Edinburgh
2024-12-06T00:56:13+00:00,2024-12-06T00:56:13.428Z,Sunny and a gentle breeze,35,22,2024-12-18,,,,,6,42,3,37,10,51,-3,27,,,,,,,,,34,Chance of precipitation,08:41,15:39,,,,,1,LOW,L,Low,1,Sunny,A gentle breeze from the south west,SW,SW,South Westerly,19,12,2650225,Edinburgh
