issueDate,lastUpdated,report.enhancedWeatherDescription,report.gustSpeedKph,report.gustSpeedMph,report.localDate,report.lowermaxTemperatureC,report.lowermaxTemperatureF,report.lowerminTemperatureC,report.lowerminTemperatureF,report.maxTempC,report.maxTempF,report.minTempC,report.minTempF,report.mostLikelyHighTemperatureC,report.mostLikelyHighTemperatureF,report.mostLikelyLowTemperatureC,report.mostLikelyLowTemperatureF,report.pollenIndex,report.pollenIndexBand,report.pollenIndexIconText,report.pollenIndexText,report.pollutionIndex,report.pollutionIndexBand,report.pollutionIndexIconText,report.pollutionIndexText,report.precipitationProbabilityInPercent,report.precipitationProbabilityText,report.sunrise,report.sunset,report.uppermaxTemperatureC,report.uppermaxTemperatureF,report.upperminTemperatureC,report.upperminTemperatureF,report.uvIndex,report.uvIndexBand,report.uvIndexIconText,report.uvIndexText,report.weatherType,report.weatherTypeText,report.windDescription,report.windDirection,report.windDirectionAbbreviation,report.windDirectionFull,report.windSpeedKph,report.windSpeedMph,location_id,location_name
2023-03-07T21:55:00+00:00,2023-03-08T08:01:22.853Z,Sunny intervals and a gentle breeze,24,15,2023-03-08,,,,,3,37,-3,26,4,39,-5,23,,,,,3.0,LOW,L,Low,27,Low chance of precipitation,06:47,18:01,,,,,3,MODERATE,M,Moderate,3,Sunny Intervals,A gentle breeze from the north east,NE,NE,North Easterly,16,10,2650225,Edinburgh
2023-03-07T21:55:00+00:00,2023-03-08T08:01:22.853Z,Light snow and a moderate breeze,42,26,2023-03-09,,,,,4,39,-1,31,5,41,-3,27,,,,,3.0,LOW,L,Low,33,Chance of precipitation,06:45,18:03,,,,,2,LOW,L,Low,24,Light Snow,A moderate breeze from the north east,NE,NE,North Easterly,22,14,2650225,Edinburgh
2023-03-07T21:55:00+00:00,2023-03-08T08:01:22.853Z,Light snow and a gentle breeze,21,13,2023-03-10,,,,,4,39,-4,24,6,43,-7,19,,,,,3.0,LOW,L,Low,70,Chance of precipitation,06:42,18:05,,,,,2,LOW,L,Low,24,Light Snow,A gentle breeze from the north,N,N,Northerly,16,10,2650225,Edinburgh
2023-03-07T21:55:00+00:00,2023-03-08T08:01:22.853Z,Sleet and a gentle breeze,30,19,2023-03-11,,,,,4,40,0,31,6,43,-5,23,,,,,3.0,LOW,L,Low,52,Chance of precipitation,06:40,18:07,,,,,2,LOW,L,Low,18,Sleet,A gentle breeze from the south east,SE,SE,South Easterly,16,10,2650225,Edinburgh
2023-03-07T21:55:00+00:00,2023-03-08T08:01:22.853Z,Sleet and a moderate breeze,36,22,2023-03-12,,,,,6,43,3,37,10,50,1,34,,,,,3.0,LOW,L,Low,66,Chance of precipitation,06:37,18:09,,,,,1,LOW,L,Low,18,Sleet,A moderate breeze from the south west,SW,SW,South Westerly,23,14,2650225,Edinburgh
2023-03-07T21:55:00+00:00,2023-03-08T08:01:22.853Z,Heavy rain and a gentle breeze,25,15,2023-03-13,,,,,7,44,3,37,9,48,-3,27,,,,,,,,,70,Chance of precipitation,06:34,18:11,,,,,1,LOW,L,Low,15,Heavy Rain,A gentle breeze from the north east,NE,NE,North Easterly,18,11,2650225,Edinburgh
2023-03-07T21:55:00+00:00,2023-03-08T08:01:22.853Z,Sleet showers and a moderate breeze,46,28,2023-03-14,,,,,5,42,-1,30,9,48,-6,21,,,,,,,,,70,Chance of precipitation,06:32,18:14,,,,,2,LOW,L,Low,17,Sleet Showers,A moderate breeze from the north west,NW,NW,North Westerly,23,14,2650225,Edinburgh
2023-03-07T21:55:00+00:00,2023-03-08T08:01:22.853Z,Light snow and a gentle breeze,49,30,2023-03-15,,,,,6,42,1,34,9,48,-8,18,,,,,,,,,63,Chance of precipitation,06:29,18:16,,,,,2,LOW,L,Low,24,Light Snow,A gentle breeze from the west,W,W,Westerly,18,11,2650225,Edinburgh
2023-03-08T08:01:22+00:00,2023-03-08T08:01:22.853Z,Sleet and a gentle breeze,19,12,2023-03-16,,,,,7,44,3,38,12,53,3,38,,,,,,,,,68,Chance of precipitation,06:27,18:18,,,,,1,LOW,L,Low,18,Sleet,A gentle breeze from the south east,SE,SE,South Easterly,16,10,2650225,Edinburgh
2023-03-08T08:01:22+00:00,2023-03-08T08:01:22.853Z,Heavy rain and light winds,14,9,2023-03-17,,,,,7,44,2,35,7,45,2,35,,,,,,,,,70,Chance of precipitation,06:24,18:20,,,,,1,LOW,L,Low,15,Heavy Rain,Light winds from the north east,NE,NE,North Easterly,11,7,2650225,Edinburgh
2023-03-08T08:01:22+00:00,2023-03-08T08:01:22.853Z,Light rain and light winds,18,11,2023-03-18,,,,,7,45,3,37,8,46,3,37,,,,,,,,,25,Low chance of precipitation,06:21,18:22,,,,,2,LOW,L,Low,12,Light Rain,Light winds from the north west,NW,NW,North Westerly,11,7,2650225,Edinburgh
2023-03-08T08:01:22+00:00,2023-03-08T08:01:22.853Z,Light rain showers and a gentle breeze,36,23,2023-03-19,,,,,8,46,2,35,8,47,1,34,,,,,,,,,38,Chance of precipitation,06:19,18:24,,,,,2,LOW,L,Low,10,Light Rain Showers,A gentle breeze from the west,W,W,Westerly,17,11,2650225,Edinburgh
2023-03-08T08:01:22+00:00,2023-03-08T08:01:22.853Z,Sunny and a gentle breeze,22,14,2023-03-20,,,,,9,47,2,36,9,47,2,36,,,,,,,,,27,Low chance of precipitation,06:16,18:26,,,,,3,MODERATE,M,Moderate,1,Sunny,A gentle breeze from the south west,SW,SW,South Westerly,18,11,2650225,Edinburgh
2023-03-08T08:01:22+00:00,2023-03-08T08:01:22.853Z,Light rain showers and a moderate breeze,24,15,2023-03-21,,,,,9,49,3,37,9,49,2,36,,,,,,,,,28,Low chance of precipitation,06:13,18:28,,,,,3,MODERATE,M,Moderate,10,Light Rain Showers,A moderate breeze from the south west,SW,SW,South Westerly,20,13,2650225,Edinburgh
