issueDate,lastUpdated,report.enhancedWeatherDescription,report.gustSpeedKph,report.gustSpeedMph,report.localDate,report.lowermaxTemperatureC,report.lowermaxTemperatureF,report.lowerminTemperatureC,report.lowerminTemperatureF,report.maxTempC,report.maxTempF,report.minTempC,report.minTempF,report.mostLikelyHighTemperatureC,report.mostLikelyHighTemperatureF,report.mostLikelyLowTemperatureC,report.mostLikelyLowTemperatureF,report.pollenIndex,report.pollenIndexBand,report.pollenIndexIconText,report.pollenIndexText,report.pollutionIndex,report.pollutionIndexBand,report.pollutionIndexIconText,report.pollutionIndexText,report.precipitationProbabilityInPercent,report.precipitationProbabilityText,report.sunrise,report.sunset,report.uppermaxTemperatureC,report.uppermaxTemperatureF,report.upperminTemperatureC,report.upperminTemperatureF,report.uvIndex,report.uvIndexBand,report.uvIndexIconText,report.uvIndexText,report.weatherType,report.weatherTypeText,report.windDescription,report.windDirection,report.windDirectionAbbreviation,report.windDirectionFull,report.windSpeedKph,report.windSpeedMph,location_id,location_name
2025-03-02T09:45:00+00:00,2025-03-02T16:00:19.868Z,Sunny intervals and a moderate breeze,49,31,2025-03-02,,,,,9,49,7,44,11,51,5,42,,,,,2.0,LOW,L,Low,0,Precipitation is not expected,07:03,17:48,,,,,2,LOW,L,Low,3,Sunny Intervals,A moderate breeze from the west,W,W,Westerly,29,18,2650225,Edinburgh
2025-03-02T09:45:00+00:00,2025-03-02T16:00:19.868Z,Sunny intervals and a moderate breeze,51,32,2025-03-03,,,,,11,52,7,44,12,54,6,43,,,,,3.0,LOW,L,Low,0,Precipitation is not expected,07:00,17:51,,,,,3,MODERATE,M,Moderate,3,Sunny Intervals,A moderate breeze from the west,W,W,Westerly,26,16,2650225,Edinburgh
2025-03-02T09:45:00+00:00,2025-03-02T16:00:19.868Z,Gusty winds and sunny intervals,66,41,2025-03-04,,,,,11,51,9,48,11,53,8,47,,,,,3.0,LOW,L,Low,0,Precipitation is not expected,06:58,17:53,,,,,3,MODERATE,M,Moderate,3,Sunny Intervals,Gusty winds from the south west,SW,SW,South Westerly,34,21,2650225,Edinburgh
2025-03-02T09:45:00+00:00,2025-03-02T16:00:19.868Z,Drizzle and a fresh breeze,58,36,2025-03-05,,,,,12,53,5,41,13,55,4,39,,,,,2.0,LOW,L,Low,54,Chance of precipitation,06:55,17:55,,,,,2,LOW,L,Low,11,Drizzle,A fresh breeze from the south west,SW,SW,South Westerly,31,19,2650225,Edinburgh
2025-03-02T09:45:00+00:00,2025-03-02T16:00:19.868Z,Sunny and a gentle breeze,37,23,2025-03-06,,,,,12,54,6,43,14,57,5,41,,,,,3.0,LOW,L,Low,9,Low chance of precipitation,06:53,17:57,,,,,3,MODERATE,M,Moderate,1,Sunny,A gentle breeze from the south west,SW,SW,South Westerly,16,10,2650225,Edinburgh
2025-03-02T09:45:00+00:00,2025-03-02T16:00:19.868Z,Light cloud and a gentle breeze,21,13,2025-03-07,,,,,11,53,6,43,12,54,5,41,,,,,,,,,30,Low chance of precipitation,06:50,17:59,,,,,2,LOW,L,Low,7,Light Cloud,A gentle breeze from the south,S,S,Southerly,13,8,2650225,Edinburgh
2025-03-02T09:45:00+00:00,2025-03-02T16:00:19.868Z,Sunny intervals and light winds,16,10,2025-03-08,,,,,12,53,3,38,13,56,3,37,,,,,,,,,43,Chance of precipitation,06:47,18:01,,,,,3,MODERATE,M,Moderate,3,Sunny Intervals,Light winds from the east,E,E,Easterly,9,6,2650225,Edinburgh
2025-03-02T09:45:00+00:00,2025-03-02T16:00:19.868Z,Sunny and a gentle breeze,24,15,2025-03-09,,,,,9,49,3,37,11,51,1,34,,,,,,,,,15,Low chance of precipitation,06:45,18:03,,,,,3,MODERATE,M,Moderate,1,Sunny,A gentle breeze from the north east,NE,NE,North Easterly,15,9,2650225,Edinburgh
2025-03-02T16:00:19+00:00,2025-03-02T16:00:19.868Z,Drizzle and a moderate breeze,47,29,2025-03-10,,,,,8,46,2,36,9,47,1,34,,,,,,,,,45,Chance of precipitation,06:42,18:05,,,,,1,LOW,L,Low,11,Drizzle,A moderate breeze from the north east,NE,NE,North Easterly,22,14,2650225,Edinburgh
2025-03-02T16:00:19+00:00,2025-03-02T16:00:19.868Z,Sunny intervals and a gentle breeze,38,24,2025-03-11,,,,,8,46,1,34,9,49,-1,31,,,,,,,,,9,Low chance of precipitation,06:40,18:07,,,,,2,LOW,L,Low,3,Sunny Intervals,A gentle breeze from the north east,NE,NE,North Easterly,16,10,2650225,Edinburgh
2025-03-02T16:00:19+00:00,2025-03-02T16:00:19.868Z,Sunny and light winds,13,8,2025-03-12,,,,,8,47,1,33,10,50,-1,30,,,,,,,,,0,Precipitation is not expected,06:37,18:09,,,,,3,MODERATE,M,Moderate,1,Sunny,Light winds from the north east,NE,NE,North Easterly,9,6,2650225,Edinburgh
2025-03-02T16:00:19+00:00,2025-03-02T16:00:19.868Z,Sunny and light winds,10,6,2025-03-13,,,,,9,48,1,33,11,52,-1,29,,,,,,,,,0,Precipitation is not expected,06:34,18:11,,,,,3,MODERATE,M,Moderate,1,Sunny,Light winds from the east,E,E,Easterly,9,6,2650225,Edinburgh
2025-03-02T16:00:19+00:00,2025-03-02T16:00:19.868Z,Sunny and light winds,9,6,2025-03-14,,,,,9,47,1,33,11,52,-2,28,,,,,,,,,0,Precipitation is not expected,06:32,18:14,,,,,4,MODERATE,M,Moderate,1,Sunny,Light winds from the east,E,E,Easterly,8,5,2650225,Edinburgh
2025-03-02T16:00:19+00:00,2025-03-02T16:00:19.868Z,Sunny and light winds,17,10,2025-03-15,,,,,9,48,1,35,12,53,-1,29,,,,,,,,,0,Precipitation is not expected,06:29,18:16,,,,,4,MODERATE,M,Moderate,1,Sunny,Light winds from the east,E,E,Easterly,8,5,2650225,Edinburgh
