issueDate,lastUpdated,report.enhancedWeatherDescription,report.gustSpeedKph,report.gustSpeedMph,report.localDate,report.lowermaxTemperatureC,report.lowermaxTemperatureF,report.lowerminTemperatureC,report.lowerminTemperatureF,report.maxTempC,report.maxTempF,report.minTempC,report.minTempF,report.mostLikelyHighTemperatureC,report.mostLikelyHighTemperatureF,report.mostLikelyLowTemperatureC,report.mostLikelyLowTemperatureF,report.pollenIndex,report.pollenIndexBand,report.pollenIndexIconText,report.pollenIndexText,report.pollutionIndex,report.pollutionIndexBand,report.pollutionIndexIconText,report.pollutionIndexText,report.precipitationProbabilityInPercent,report.precipitationProbabilityText,report.sunrise,report.sunset,report.uppermaxTemperatureC,report.uppermaxTemperatureF,report.upperminTemperatureC,report.upperminTemperatureF,report.uvIndex,report.uvIndexBand,report.uvIndexIconText,report.uvIndexText,report.weatherType,report.weatherTypeText,report.windDescription,report.windDirection,report.windDirectionAbbreviation,report.windDirectionFull,report.windSpeedKph,report.windSpeedMph,location_id,location_name
2024-03-21T21:45:00+00:00,2024-03-22T08:00:13.13Z,Strong winds and rain,77,48,2024-03-22,,,,,9,48,3,38,10,49,2,36,1.0,LOW,L,Low,3.0,LOW,L,Low,51,Chance of precipitation,06:08,18:32,,,,,3,MODERATE,M,Moderate,12,Light Rain,Strong winds from the west,W,W,Westerly,41,26,2650225,Edinburgh
2024-03-21T21:45:00+00:00,2024-03-22T08:00:13.13Z,Gusty winds and light rain showers,68,42,2024-03-23,,,,,9,49,3,37,10,50,1,34,1.0,LOW,L,Low,3.0,LOW,L,Low,46,Chance of precipitation,06:06,18:34,,,,,2,LOW,L,Low,10,Light Rain Showers,Gusty winds from the west,W,W,Westerly,35,22,2650225,Edinburgh
2024-03-21T21:45:00+00:00,2024-03-22T08:00:13.13Z,Sunny intervals and a gentle breeze,32,20,2024-03-24,,,,,11,51,3,38,12,54,2,36,1.0,LOW,L,Low,3.0,LOW,L,Low,0,Precipitation is not expected,06:03,18:36,,,,,3,MODERATE,M,Moderate,3,Sunny Intervals,A gentle breeze from the north west,NW,NW,North Westerly,18,11,2650225,Edinburgh
2024-03-21T21:45:00+00:00,2024-03-22T08:00:13.13Z,Light rain and a moderate breeze,38,24,2024-03-25,,,,,7,45,3,38,9,47,1,35,1.0,LOW,L,Low,3.0,LOW,L,Low,70,Chance of precipitation,06:00,18:38,,,,,1,LOW,L,Low,12,Light Rain,A moderate breeze from the east,E,E,Easterly,22,14,2650225,Edinburgh
2024-03-21T21:45:00+00:00,2024-03-22T08:00:13.13Z,Light rain and a moderate breeze,48,30,2024-03-26,,,,,7,45,3,38,9,47,2,35,1.0,LOW,L,Low,3.0,LOW,L,Low,70,Chance of precipitation,05:58,18:40,,,,,1,LOW,L,Low,12,Light Rain,A moderate breeze from the east,E,E,Easterly,22,14,2650225,Edinburgh
2024-03-21T21:45:00+00:00,2024-03-22T08:00:13.13Z,Light rain and a moderate breeze,44,27,2024-03-27,,,,,8,47,4,40,10,50,3,37,,,,,,,,,46,Chance of precipitation,05:55,18:42,,,,,2,LOW,L,Low,12,Light Rain,A moderate breeze from the east,E,E,Easterly,24,15,2650225,Edinburgh
2024-03-21T21:45:00+00:00,2024-03-22T08:00:13.13Z,Light rain and a moderate breeze,47,29,2024-03-28,,,,,9,48,4,40,11,52,3,37,,,,,,,,,70,Chance of precipitation,05:52,18:44,,,,,2,LOW,L,Low,12,Light Rain,A moderate breeze from the east,E,E,Easterly,24,15,2650225,Edinburgh
2024-03-21T21:45:00+00:00,2024-03-22T08:00:13.13Z,Light rain and a gentle breeze,45,28,2024-03-29,,,,,10,50,4,40,11,53,3,37,,,,,,,,,70,Chance of precipitation,05:50,18:46,,,,,2,LOW,L,Low,12,Light Rain,A gentle breeze from the east,E,E,Easterly,18,11,2650225,Edinburgh
2024-03-22T08:00:13+00:00,2024-03-22T08:00:13.13Z,Drizzle and a gentle breeze,34,21,2024-03-30,,,,,10,51,4,39,12,54,2,36,,,,,,,,,45,Chance of precipitation,05:47,18:48,,,,,2,LOW,L,Low,11,Drizzle,A gentle breeze from the south,S,S,Southerly,19,12,2650225,Edinburgh
2024-03-22T08:00:13+00:00,2024-03-22T08:00:13.13Z,Light rain and a gentle breeze,17,11,2024-03-31,,,,,12,53,4,40,14,57,2,35,,,,,,,,,70,Chance of precipitation,06:45,19:50,,,,,4,MODERATE,M,Moderate,12,Light Rain,A gentle breeze from the south east,SE,SE,South Easterly,15,9,2650225,Edinburgh
2024-03-22T08:00:13+00:00,2024-03-22T08:00:13.13Z,Light rain and light winds,20,13,2024-04-01,,,,,11,52,6,42,14,57,3,37,,,,,,,,,42,Chance of precipitation,06:42,19:52,,,,,4,MODERATE,M,Moderate,12,Light Rain,Light winds from the east,E,E,Easterly,10,6,2650225,Edinburgh
2024-03-22T08:00:13+00:00,2024-03-22T08:00:13.13Z,Light rain showers and light winds,24,15,2024-04-02,,,,,10,50,5,40,13,56,1,34,,,,,,,,,49,Chance of precipitation,06:39,19:54,,,,,1,LOW,L,Low,10,Light Rain Showers,Light winds from the east,E,E,Easterly,10,6,2650225,Edinburgh
2024-03-22T08:00:13+00:00,2024-03-22T08:00:13.13Z,Drizzle and light winds,14,9,2024-04-03,,,,,10,51,4,40,14,57,1,33,,,,,,,,,32,Chance of precipitation,06:37,19:56,,,,,1,LOW,L,Low,11,Drizzle,Light winds from the south,S,S,Southerly,8,5,2650225,Edinburgh
2024-03-22T08:00:13+00:00,2024-03-22T08:00:13.13Z,Drizzle and light winds,12,7,2024-04-04,,,,,10,50,5,41,14,57,1,33,,,,,,,,,65,Chance of precipitation,06:34,19:58,,,,,2,LOW,L,Low,11,Drizzle,Light winds from the south,S,S,Southerly,10,6,2650225,Edinburgh
