issueDate,lastUpdated,report.enhancedWeatherDescription,report.gustSpeedKph,report.gustSpeedMph,report.localDate,report.lowermaxTemperatureC,report.lowermaxTemperatureF,report.lowerminTemperatureC,report.lowerminTemperatureF,report.maxTempC,report.maxTempF,report.minTempC,report.minTempF,report.mostLikelyHighTemperatureC,report.mostLikelyHighTemperatureF,report.mostLikelyLowTemperatureC,report.mostLikelyLowTemperatureF,report.pollenIndex,report.pollenIndexBand,report.pollenIndexIconText,report.pollenIndexText,report.pollutionIndex,report.pollutionIndexBand,report.pollutionIndexIconText,report.pollutionIndexText,report.precipitationProbabilityInPercent,report.precipitationProbabilityText,report.sunrise,report.sunset,report.uppermaxTemperatureC,report.uppermaxTemperatureF,report.upperminTemperatureC,report.upperminTemperatureF,report.uvIndex,report.uvIndexBand,report.uvIndexIconText,report.uvIndexText,report.weatherType,report.weatherTypeText,report.windDescription,report.windDirection,report.windDirectionAbbreviation,report.windDirectionFull,report.windSpeedKph,report.windSpeedMph,location_id,location_name
2023-09-22T22:52:00+01:00,2023-09-23T01:16:34.053+01:00,Partly cloudy and light winds,16,10,2023-09-22,,,,,14,58,7,44,15,59,5,40,,,,,2.0,LOW,L,Low,0,Precipitation is not expected,06:57,19:13,,,,,0,LOW,L,Low,2,Partly Cloudy,Light winds from the west,W,W,Westerly,6,4,2650225,Edinburgh
2023-09-22T22:52:00+01:00,2023-09-23T01:16:34.053+01:00,Sunny intervals and light winds,23,14,2023-09-23,,,,,14,58,10,50,15,59,9,47,,,,,2.0,LOW,L,Low,0,Precipitation is not expected,06:59,19:10,,,,,4,MODERATE,M,Moderate,3,Sunny Intervals,Light winds from the south west,SW,SW,South Westerly,11,7,2650225,Edinburgh
2023-09-22T22:52:00+01:00,2023-09-23T01:16:34.053+01:00,Gusty winds and rain,68,43,2023-09-24,,,,,18,65,12,54,19,66,11,52,,,,,2.0,LOW,L,Low,70,Chance of precipitation,07:01,19:08,,,,,3,MODERATE,M,Moderate,12,Light Rain,Gusty winds from the south,S,S,Southerly,35,22,2650225,Edinburgh
2023-09-22T22:52:00+01:00,2023-09-23T01:16:34.053+01:00,Sunny intervals and a fresh breeze,63,39,2023-09-25,,,,,17,63,12,54,18,65,11,52,,,,,2.0,LOW,L,Low,17,Low chance of precipitation,07:03,19:05,,,,,4,MODERATE,M,Moderate,3,Sunny Intervals,A fresh breeze from the south west,SW,SW,South Westerly,30,19,2650225,Edinburgh
2023-09-22T22:52:00+01:00,2023-09-23T01:16:34.053+01:00,Light rain and a moderate breeze,50,31,2023-09-26,,,,,17,62,9,48,19,65,7,45,,,,,2.0,LOW,L,Low,61,Chance of precipitation,07:05,19:02,,,,,2,LOW,L,Low,12,Light Rain,A moderate breeze from the south,S,S,Southerly,26,16,2650225,Edinburgh
2023-09-22T22:52:00+01:00,2023-09-23T01:16:34.053+01:00,Light rain showers and a gentle breeze,37,23,2023-09-27,,,,,15,60,10,51,17,63,9,48,,,,,,,,,70,Chance of precipitation,07:07,19:00,,,,,3,MODERATE,M,Moderate,10,Light Rain Showers,A gentle breeze from the south,S,S,Southerly,20,12,2650225,Edinburgh
2023-09-22T22:52:00+01:00,2023-09-23T01:16:34.053+01:00,Light rain and a fresh breeze,61,38,2023-09-28,,,,,16,61,10,50,17,63,9,48,,,,,,,,,70,Chance of precipitation,07:09,18:57,,,,,3,MODERATE,M,Moderate,12,Light Rain,A fresh breeze from the south west,SW,SW,South Westerly,30,19,2650225,Edinburgh
2023-09-22T22:52:00+01:00,2023-09-23T01:16:34.053+01:00,Light rain showers and a moderate breeze,53,33,2023-09-29,,,,,15,60,7,45,16,61,5,42,,,,,,,,,43,Chance of precipitation,07:11,18:54,,,,,3,MODERATE,M,Moderate,10,Light Rain Showers,A moderate breeze from the south west,SW,SW,South Westerly,26,16,2650225,Edinburgh
2023-09-23T01:16:34+01:00,2023-09-23T01:16:34.053+01:00,Light rain and a moderate breeze,27,17,2023-09-30,,,,,15,59,9,48,17,62,6,43,,,,,,,,,70,Chance of precipitation,07:13,18:52,,,,,2,LOW,L,Low,12,Light Rain,A moderate breeze from the south west,SW,SW,South Westerly,20,13,2650225,Edinburgh
2023-09-23T01:16:34+01:00,2023-09-23T01:16:34.053+01:00,Light rain and a gentle breeze,23,14,2023-10-01,,,,,15,59,9,48,18,64,6,43,,,,,,,,,50,Chance of precipitation,07:15,18:49,,,,,3,MODERATE,M,Moderate,12,Light Rain,A gentle breeze from the south west,SW,SW,South Westerly,19,12,2650225,Edinburgh
2023-09-23T01:16:34+01:00,2023-09-23T01:16:34.053+01:00,Light rain showers and a moderate breeze,60,37,2023-10-02,,,,,14,58,9,48,18,64,5,41,,,,,,,,,66,Chance of precipitation,07:17,18:46,,,,,2,LOW,L,Low,10,Light Rain Showers,A moderate breeze from the south west,SW,SW,South Westerly,24,15,2650225,Edinburgh
2023-09-23T01:16:34+01:00,2023-09-23T01:16:34.053+01:00,Light rain showers and a moderate breeze,49,30,2023-10-03,,,,,14,58,8,47,18,65,4,39,,,,,,,,,44,Chance of precipitation,07:19,18:44,,,,,2,LOW,L,Low,10,Light Rain Showers,A moderate breeze from the south west,SW,SW,South Westerly,20,13,2650225,Edinburgh
2023-09-23T01:16:34+01:00,2023-09-23T01:16:34.053+01:00,Drizzle and a gentle breeze,28,18,2023-10-04,,,,,15,59,9,49,20,67,4,40,,,,,,,,,32,Chance of precipitation,07:21,18:41,,,,,3,MODERATE,M,Moderate,11,Drizzle,A gentle breeze from the south west,SW,SW,South Westerly,13,8,2650225,Edinburgh
2023-09-23T01:16:34+01:00,2023-09-23T01:16:34.053+01:00,Sunny intervals and a gentle breeze,29,18,2023-10-05,,,,,15,59,8,46,20,69,2,36,,,,,,,,,0,Precipitation is not expected,07:23,18:39,,,,,2,LOW,L,Low,3,Sunny Intervals,A gentle breeze from the south west,SW,SW,South Westerly,18,11,2650225,Edinburgh
