issueDate,lastUpdated,report.enhancedWeatherDescription,report.gustSpeedKph,report.gustSpeedMph,report.localDate,report.lowermaxTemperatureC,report.lowermaxTemperatureF,report.lowerminTemperatureC,report.lowerminTemperatureF,report.maxTempC,report.maxTempF,report.minTempC,report.minTempF,report.mostLikelyHighTemperatureC,report.mostLikelyHighTemperatureF,report.mostLikelyLowTemperatureC,report.mostLikelyLowTemperatureF,report.pollenIndex,report.pollenIndexBand,report.pollenIndexIconText,report.pollenIndexText,report.pollutionIndex,report.pollutionIndexBand,report.pollutionIndexIconText,report.pollutionIndexText,report.precipitationProbabilityInPercent,report.precipitationProbabilityText,report.sunrise,report.sunset,report.uppermaxTemperatureC,report.uppermaxTemperatureF,report.upperminTemperatureC,report.upperminTemperatureF,report.uvIndex,report.uvIndexBand,report.uvIndexIconText,report.uvIndexText,report.weatherType,report.weatherTypeText,report.windDescription,report.windDirection,report.windDirectionAbbreviation,report.windDirectionFull,report.windSpeedKph,report.windSpeedMph,location_id,location_name
2023-10-13T22:56:00+01:00,2023-10-14T09:01:58.86+01:00,Sunny and a moderate breeze,49,31,2023-10-14,,,,,10,49,0,33,11,51,-1,30,,,,,2.0,LOW,L,Low,0,Precipitation is not expected,07:41,18:16,,,,,3,MODERATE,M,Moderate,1,Sunny,A moderate breeze from the west,W,W,Westerly,26,16,2650225,Edinburgh
2023-10-13T22:56:00+01:00,2023-10-14T09:01:58.86+01:00,Sunny and a moderate breeze,38,24,2023-10-15,,,,,10,50,3,37,12,53,1,34,,,,,2.0,LOW,L,Low,0,Precipitation is not expected,07:43,18:13,,,,,3,MODERATE,M,Moderate,1,Sunny,A moderate breeze from the west,W,W,Westerly,22,14,2650225,Edinburgh
2023-10-13T22:56:00+01:00,2023-10-14T09:01:58.86+01:00,Sunny intervals and a gentle breeze,26,16,2023-10-16,,,,,11,52,2,36,13,56,0,32,,,,,2.0,LOW,L,Low,0,Precipitation is not expected,07:45,18:11,,,,,3,MODERATE,M,Moderate,3,Sunny Intervals,A gentle breeze from the west,W,W,Westerly,16,10,2650225,Edinburgh
2023-10-13T22:56:00+01:00,2023-10-14T09:01:58.86+01:00,Sunny and light winds,12,7,2023-10-17,,,,,12,54,3,37,14,58,0,32,,,,,2.0,LOW,L,Low,0,Precipitation is not expected,07:47,18:08,,,,,3,MODERATE,M,Moderate,1,Sunny,Light winds from the west,W,W,Westerly,10,6,2650225,Edinburgh
2023-10-13T22:56:00+01:00,2023-10-14T09:01:58.86+01:00,Sunny intervals and a moderate breeze,39,24,2023-10-18,,,,,12,54,9,47,13,55,7,44,,,,,2.0,LOW,L,Low,9,Low chance of precipitation,07:49,18:06,,,,,2,LOW,L,Low,3,Sunny Intervals,A moderate breeze from the east,E,E,Easterly,22,14,2650225,Edinburgh
2023-10-13T22:56:00+01:00,2023-10-14T09:01:58.86+01:00,Gusty winds and light cloud,72,45,2023-10-19,,,,,13,55,9,49,13,56,7,45,,,,,,,,,27,Low chance of precipitation,07:51,18:03,,,,,1,LOW,L,Low,7,Light Cloud,Gusty winds from the east,E,E,Easterly,34,21,2650225,Edinburgh
2023-10-13T22:56:00+01:00,2023-10-14T09:01:58.86+01:00,Gusty winds and rain,68,42,2023-10-20,,,,,12,54,8,47,14,57,7,44,,,,,,,,,51,Chance of precipitation,07:53,18:01,,,,,1,LOW,L,Low,12,Light Rain,Gusty winds from the east,E,E,Easterly,31,19,2650225,Edinburgh
2023-10-13T22:56:00+01:00,2023-10-14T09:01:58.86+01:00,Drizzle and a fresh breeze,61,38,2023-10-21,,,,,11,53,7,44,14,57,4,39,,,,,,,,,50,Chance of precipitation,07:56,17:58,,,,,2,LOW,L,Low,11,Drizzle,A fresh breeze from the east,E,E,Easterly,30,19,2650225,Edinburgh
2023-10-14T09:01:58+01:00,2023-10-14T09:01:58.86+01:00,Light cloud and a moderate breeze,51,32,2023-10-22,,,,,11,51,7,45,13,56,4,40,,,,,,,,,27,Low chance of precipitation,07:58,17:56,,,,,1,LOW,L,Low,7,Light Cloud,A moderate breeze from the east,E,E,Easterly,25,16,2650225,Edinburgh
2023-10-14T09:01:58+01:00,2023-10-14T09:01:58.86+01:00,Light rain and light winds,14,9,2023-10-23,,,,,11,52,6,43,14,58,2,36,,,,,,,,,35,Chance of precipitation,08:00,17:54,,,,,1,LOW,L,Low,12,Light Rain,Light winds from the south east,SE,SE,South Easterly,12,7,2650225,Edinburgh
2023-10-14T09:01:58+01:00,2023-10-14T09:01:58.86+01:00,Sunny intervals and light winds,15,9,2023-10-24,,,,,11,52,5,41,15,59,1,33,,,,,,,,,35,Chance of precipitation,08:02,17:51,,,,,2,LOW,L,Low,3,Sunny Intervals,Light winds from the south west,SW,SW,South Westerly,12,7,2650225,Edinburgh
2023-10-14T09:01:58+01:00,2023-10-14T09:01:58.86+01:00,Light rain and light winds,21,13,2023-10-25,,,,,11,52,7,44,15,59,2,36,,,,,,,,,33,Chance of precipitation,08:04,17:49,,,,,1,LOW,L,Low,12,Light Rain,Light winds from the south west,SW,SW,South Westerly,11,7,2650225,Edinburgh
2023-10-14T09:01:58+01:00,2023-10-14T09:01:58.86+01:00,Sunny intervals and a gentle breeze,29,18,2023-10-26,,,,,12,53,7,44,17,62,1,34,,,,,,,,,0,Precipitation is not expected,08:06,17:47,,,,,2,LOW,L,Low,3,Sunny Intervals,A gentle breeze from the south,S,S,Southerly,13,8,2650225,Edinburgh
2023-10-14T09:01:58+01:00,2023-10-14T09:01:58.86+01:00,Light rain showers and a gentle breeze,31,19,2023-10-27,,,,,11,53,7,45,17,63,2,35,,,,,,,,,40,Chance of precipitation,08:08,17:44,,,,,1,LOW,L,Low,10,Light Rain Showers,A gentle breeze from the east,E,E,Easterly,13,8,2650225,Edinburgh
