issueDate,lastUpdated,report.enhancedWeatherDescription,report.gustSpeedKph,report.gustSpeedMph,report.localDate,report.lowermaxTemperatureC,report.lowermaxTemperatureF,report.lowerminTemperatureC,report.lowerminTemperatureF,report.maxTempC,report.maxTempF,report.minTempC,report.minTempF,report.mostLikelyHighTemperatureC,report.mostLikelyHighTemperatureF,report.mostLikelyLowTemperatureC,report.mostLikelyLowTemperatureF,report.pollenIndex,report.pollenIndexBand,report.pollenIndexIconText,report.pollenIndexText,report.pollutionIndex,report.pollutionIndexBand,report.pollutionIndexIconText,report.pollutionIndexText,report.precipitationProbabilityInPercent,report.precipitationProbabilityText,report.sunrise,report.sunset,report.uppermaxTemperatureC,report.uppermaxTemperatureF,report.upperminTemperatureC,report.upperminTemperatureF,report.uvIndex,report.uvIndexBand,report.uvIndexIconText,report.uvIndexText,report.weatherType,report.weatherTypeText,report.windDescription,report.windDirection,report.windDirectionAbbreviation,report.windDirectionFull,report.windSpeedKph,report.windSpeedMph,location_id,location_name
2023-12-23T21:45:00+00:00,2023-12-24T00:00:41.193Z,Gusty winds and drizzle,77,48,2023-12-23,,,,,11,51,10,50,11,52,9,49,,,,,3.0,LOW,L,Low,42,Chance of precipitation,08:43,15:41,,,,,0,LOW,L,Low,38,Drizzle,Gusty winds from the west,W,W,Westerly,39,24,2650225,Edinburgh
2023-12-23T21:45:00+00:00,2023-12-24T00:00:41.193Z,Strong winds and rain,93,58,2023-12-24,,,,,11,51,3,38,11,52,2,35,,,,,3.0,LOW,L,Low,55,Chance of precipitation,08:43,15:41,,,,,1,LOW,L,Low,12,Light Rain,Strong winds from the west,W,W,Westerly,44,28,2650225,Edinburgh
2023-12-23T21:45:00+00:00,2023-12-24T00:00:41.193Z,Light rain showers and a moderate breeze,38,24,2023-12-25,,,,,8,47,2,35,9,48,1,34,,,,,2.0,LOW,L,Low,70,Chance of precipitation,08:44,15:42,,,,,1,LOW,L,Low,10,Light Rain Showers,A moderate breeze from the south west,SW,SW,South Westerly,22,14,2650225,Edinburgh
2023-12-23T21:45:00+00:00,2023-12-24T00:00:41.193Z,Sunny and a gentle breeze,38,24,2023-12-26,,,,,5,42,0,32,6,43,-1,31,,,,,2.0,LOW,L,Low,0,Precipitation is not expected,08:44,15:43,,,,,1,LOW,L,Low,1,Sunny,A gentle breeze from the west,W,W,Westerly,19,12,2650225,Edinburgh
2023-12-23T21:45:00+00:00,2023-12-24T00:00:41.193Z,Light rain showers and a moderate breeze,46,29,2023-12-27,,,,,6,42,3,38,8,47,1,34,,,,,2.0,LOW,L,Low,70,Chance of precipitation,08:44,15:44,,,,,1,LOW,L,Low,10,Light Rain Showers,A moderate breeze from the east,E,E,Easterly,22,14,2650225,Edinburgh
2023-12-23T21:45:00+00:00,2023-12-24T00:00:41.193Z,Light rain and a moderate breeze,62,39,2023-12-28,,,,,5,42,2,35,7,45,-1,31,,,,,,,,,57,Chance of precipitation,08:44,15:45,,,,,1,LOW,L,Low,12,Light Rain,A moderate breeze from the west,W,W,Westerly,25,15,2650225,Edinburgh
2023-12-23T21:45:00+00:00,2023-12-24T00:00:41.193Z,Sunny intervals and a gentle breeze,42,26,2023-12-29,,,,,5,41,1,34,7,45,-1,30,,,,,,,,,28,Low chance of precipitation,08:44,15:45,,,,,1,LOW,L,Low,3,Sunny Intervals,A gentle breeze from the south west,SW,SW,South Westerly,17,11,2650225,Edinburgh
2023-12-24T00:00:41+00:00,2023-12-24T00:00:41.193Z,Sleet and a gentle breeze,36,22,2023-12-30,,,,,4,39,0,33,6,43,-1,30,,,,,,,,,32,Chance of precipitation,08:44,15:47,,,,,1,LOW,L,Low,18,Sleet,A gentle breeze from the west,W,W,Westerly,16,10,2650225,Edinburgh
2023-12-24T00:00:41+00:00,2023-12-24T00:00:41.193Z,Light rain and a gentle breeze,26,16,2023-12-31,,,,,5,40,1,34,6,42,-2,29,,,,,,,,,37,Chance of precipitation,08:44,15:48,,,,,1,LOW,L,Low,12,Light Rain,A gentle breeze from the west,W,W,Westerly,15,9,2650225,Edinburgh
2023-12-24T00:00:41+00:00,2023-12-24T00:00:41.193Z,Drizzle and a gentle breeze,20,12,2024-01-01,,,,,5,40,1,35,8,46,-2,29,,,,,,,,,38,Chance of precipitation,08:44,15:49,,,,,1,LOW,L,Low,11,Drizzle,A gentle breeze from the south west,SW,SW,South Westerly,13,8,2650225,Edinburgh
2023-12-24T00:00:41+00:00,2023-12-24T00:00:41.193Z,Light rain and a gentle breeze,37,23,2024-01-02,,,,,5,41,1,35,8,47,-2,28,,,,,,,,,35,Chance of precipitation,08:44,15:50,,,,,1,LOW,L,Low,12,Light Rain,A gentle breeze from the west,W,W,Westerly,17,10,2650225,Edinburgh
2023-12-24T00:00:41+00:00,2023-12-24T00:00:41.193Z,Drizzle and a gentle breeze,18,11,2024-01-03,,,,,5,41,1,33,9,47,-3,26,,,,,,,,,36,Chance of precipitation,08:43,15:52,,,,,1,LOW,L,Low,11,Drizzle,A gentle breeze from the west,W,W,Westerly,13,8,2650225,Edinburgh
2023-12-24T00:00:41+00:00,2023-12-24T00:00:41.193Z,Sleet and a gentle breeze,16,10,2024-01-04,,,,,5,40,0,32,9,48,-4,24,,,,,,,,,36,Chance of precipitation,08:43,15:53,,,,,1,LOW,L,Low,18,Sleet,A gentle breeze from the west,W,W,Westerly,14,9,2650225,Edinburgh
2023-12-24T00:00:41+00:00,2023-12-24T00:00:41.193Z,Light cloud and a gentle breeze,30,19,2024-01-05,,,,,5,41,3,37,9,48,-1,30,,,,,,,,,27,Low chance of precipitation,08:42,15:54,,,,,1,LOW,L,Low,7,Light Cloud,A gentle breeze from the west,W,W,Westerly,18,11,2650225,Edinburgh
