issueDate,lastUpdated,report.enhancedWeatherDescription,report.gustSpeedKph,report.gustSpeedMph,report.localDate,report.lowermaxTemperatureC,report.lowermaxTemperatureF,report.lowerminTemperatureC,report.lowerminTemperatureF,report.maxTempC,report.maxTempF,report.minTempC,report.minTempF,report.mostLikelyHighTemperatureC,report.mostLikelyHighTemperatureF,report.mostLikelyLowTemperatureC,report.mostLikelyLowTemperatureF,report.pollenIndex,report.pollenIndexBand,report.pollenIndexIconText,report.pollenIndexText,report.pollutionIndex,report.pollutionIndexBand,report.pollutionIndexIconText,report.pollutionIndexText,report.precipitationProbabilityInPercent,report.precipitationProbabilityText,report.sunrise,report.sunset,report.uppermaxTemperatureC,report.uppermaxTemperatureF,report.upperminTemperatureC,report.upperminTemperatureF,report.uvIndex,report.uvIndexBand,report.uvIndexIconText,report.uvIndexText,report.weatherType,report.weatherTypeText,report.windDescription,report.windDirection,report.windDirectionAbbreviation,report.windDirectionFull,report.windSpeedKph,report.windSpeedMph,location_id,location_name
2023-05-03T22:54:00+01:00,2023-05-04T01:32:26.191+01:00,Partly cloudy and a gentle breeze,34,21,2023-05-03,,,,,11,51,7,44,13,55,6,43,4.0,MODERATE,M,Moderate,3.0,LOW,L,Low,16,Low chance of precipitation,05:25,20:55,,,,,0,LOW,L,Low,2,Partly Cloudy,A gentle breeze from the east,E,E,Easterly,16,10,2650225,Edinburgh
2023-05-03T22:54:00+01:00,2023-05-04T01:32:26.191+01:00,Light cloud and a fresh breeze,48,30,2023-05-04,,,,,11,51,7,44,13,55,6,43,4.0,MODERATE,M,Moderate,3.0,LOW,L,Low,0,Precipitation is not expected,05:23,20:57,,,,,3,MODERATE,M,Moderate,7,Light Cloud,A fresh breeze from the east,E,E,Easterly,30,19,2650225,Edinburgh
2023-05-03T22:54:00+01:00,2023-05-04T01:32:26.191+01:00,Light rain and a gentle breeze,27,17,2023-05-05,,,,,11,52,8,47,13,55,7,45,1.0,LOW,L,Low,3.0,LOW,L,Low,71,High chance of precipitation,05:21,20:59,,,,,1,LOW,L,Low,12,Light Rain,A gentle breeze from the east,E,E,Easterly,16,10,2650225,Edinburgh
2023-05-03T22:54:00+01:00,2023-05-04T01:32:26.191+01:00,Thundery showers and a gentle breeze,18,11,2023-05-06,,,,,14,57,9,48,16,61,7,45,4.0,MODERATE,M,Moderate,3.0,LOW,L,Low,70,Chance of precipitation,05:19,21:01,,,,,2,LOW,L,Low,29,Thundery Showers,A gentle breeze from the east,E,E,Easterly,14,9,2650225,Edinburgh
2023-05-03T22:54:00+01:00,2023-05-04T01:32:26.191+01:00,Drizzle and a gentle breeze,27,17,2023-05-07,,,,,15,59,9,49,18,64,8,46,4.0,MODERATE,M,Moderate,2.0,LOW,L,Low,54,Chance of precipitation,05:17,21:03,,,,,3,MODERATE,M,Moderate,11,Drizzle,A gentle breeze from the south west,SW,SW,South Westerly,15,9,2650225,Edinburgh
2023-05-03T22:54:00+01:00,2023-05-04T01:32:26.191+01:00,Light rain and a gentle breeze,30,19,2023-05-08,,,,,15,59,10,50,16,61,9,49,,,,,,,,,70,Chance of precipitation,05:15,21:05,,,,,2,LOW,L,Low,12,Light Rain,A gentle breeze from the south east,SE,SE,South Easterly,16,10,2650225,Edinburgh
2023-05-03T22:54:00+01:00,2023-05-04T01:32:26.191+01:00,Drizzle and a moderate breeze,38,24,2023-05-09,,,,,14,58,7,45,16,60,7,44,,,,,,,,,38,Chance of precipitation,05:13,21:07,,,,,4,MODERATE,M,Moderate,11,Drizzle,A moderate breeze from the west,W,W,Westerly,21,13,2650225,Edinburgh
2023-05-03T22:54:00+01:00,2023-05-04T01:32:26.191+01:00,Drizzle and a gentle breeze,32,20,2023-05-10,,,,,13,56,7,45,14,57,6,43,,,,,,,,,69,Chance of precipitation,05:11,21:09,,,,,2,LOW,L,Low,11,Drizzle,A gentle breeze from the west,W,W,Westerly,16,10,2650225,Edinburgh
2023-05-04T01:32:26+01:00,2023-05-04T01:32:26.191+01:00,Light rain showers and a gentle breeze,22,14,2023-05-11,,,,,13,56,7,44,15,59,5,41,,,,,,,,,38,Chance of precipitation,05:09,21:11,,,,,3,MODERATE,M,Moderate,10,Light Rain Showers,A gentle breeze from the west,W,W,Westerly,13,8,2650225,Edinburgh
2023-05-04T01:32:26+01:00,2023-05-04T01:32:26.191+01:00,Drizzle and light winds,23,14,2023-05-12,,,,,14,56,7,45,16,60,4,40,,,,,,,,,54,Chance of precipitation,05:07,21:13,,,,,4,MODERATE,M,Moderate,11,Drizzle,Light winds from the west,W,W,Westerly,11,7,2650225,Edinburgh
2023-05-04T01:32:26+01:00,2023-05-04T01:32:26.191+01:00,Light rain and a gentle breeze,25,15,2023-05-13,,,,,13,56,8,46,16,61,5,40,,,,,,,,,63,Chance of precipitation,05:05,21:15,,,,,3,MODERATE,M,Moderate,12,Light Rain,A gentle breeze from the south west,SW,SW,South Westerly,13,8,2650225,Edinburgh
2023-05-04T01:32:26+01:00,2023-05-04T01:32:26.191+01:00,Light cloud and a gentle breeze,45,28,2023-05-14,,,,,13,56,6,43,17,62,2,36,,,,,,,,,68,Chance of precipitation,05:03,21:17,,,,,4,MODERATE,M,Moderate,7,Light Cloud,A gentle breeze from the west,W,W,Westerly,13,8,2650225,Edinburgh
2023-05-04T01:32:26+01:00,2023-05-04T01:32:26.191+01:00,Light rain and light winds,15,9,2023-05-15,,,,,13,55,7,44,17,62,3,37,,,,,,,,,70,Chance of precipitation,05:01,21:18,,,,,2,LOW,L,Low,12,Light Rain,Light winds from the west,W,W,Westerly,11,7,2650225,Edinburgh
2023-05-04T01:32:26+01:00,2023-05-04T01:32:26.191+01:00,Light rain and light winds,34,21,2023-05-16,,,,,12,54,6,43,17,63,1,34,,,,,,,,,55,Chance of precipitation,04:59,21:20,,,,,1,LOW,L,Low,12,Light Rain,Light winds from the north west,NW,NW,North Westerly,10,6,2650225,Edinburgh
