issueDate,lastUpdated,report.enhancedWeatherDescription,report.gustSpeedKph,report.gustSpeedMph,report.localDate,report.lowermaxTemperatureC,report.lowermaxTemperatureF,report.lowerminTemperatureC,report.lowerminTemperatureF,report.maxTempC,report.maxTempF,report.minTempC,report.minTempF,report.mostLikelyHighTemperatureC,report.mostLikelyHighTemperatureF,report.mostLikelyLowTemperatureC,report.mostLikelyLowTemperatureF,report.pollenIndex,report.pollenIndexBand,report.pollenIndexIconText,report.pollenIndexText,report.pollutionIndex,report.pollutionIndexBand,report.pollutionIndexIconText,report.pollutionIndexText,report.precipitationProbabilityInPercent,report.precipitationProbabilityText,report.sunrise,report.sunset,report.uppermaxTemperatureC,report.uppermaxTemperatureF,report.upperminTemperatureC,report.upperminTemperatureF,report.uvIndex,report.uvIndexBand,report.uvIndexIconText,report.uvIndexText,report.weatherType,report.weatherTypeText,report.windDescription,report.windDirection,report.windDirectionAbbreviation,report.windDirectionFull,report.windSpeedKph,report.windSpeedMph,location_id,location_name
2024-07-10T22:41:00+01:00,2024-07-11T01:01:37.941+01:00,Light cloud and light winds,18,11,2024-07-10,,,,,16,60,11,52,17,63,10,50,4.0,MODERATE,M,Moderate,2.0,LOW,L,Low,28,Low chance of precipitation,04:42,21:54,,,,,0,LOW,L,Low,36,Light Cloud,Light winds from the north west,NW,NW,North Westerly,9,5,2650225,Edinburgh
2024-07-10T22:41:00+01:00,2024-07-11T01:01:37.941+01:00,Light cloud and light winds,24,15,2024-07-11,,,,,16,60,9,48,17,63,8,46,4.0,MODERATE,M,Moderate,2.0,LOW,L,Low,20,Low chance of precipitation,04:43,21:53,,,,,3,MODERATE,M,Moderate,7,Light Cloud,Light winds from the north west,NW,NW,North Westerly,10,6,2650225,Edinburgh
2024-07-10T22:41:00+01:00,2024-07-11T01:01:37.941+01:00,Light cloud and light winds,17,11,2024-07-12,,,,,17,63,10,51,19,66,9,49,4.0,MODERATE,M,Moderate,2.0,LOW,L,Low,0,Precipitation is not expected,04:45,21:52,,,,,4,MODERATE,M,Moderate,7,Light Cloud,Light winds from the north,N,N,Northerly,10,6,2650225,Edinburgh
2024-07-10T22:41:00+01:00,2024-07-11T01:01:37.941+01:00,Light rain and light winds,21,13,2024-07-13,,,,,15,59,11,51,16,60,10,50,4.0,MODERATE,M,Moderate,2.0,LOW,L,Low,45,Chance of precipitation,04:46,21:50,,,,,1,LOW,L,Low,12,Light Rain,Light winds from the north east,NE,NE,North Easterly,10,6,2650225,Edinburgh
2024-07-10T22:41:00+01:00,2024-07-11T01:01:37.941+01:00,Drizzle and light winds,17,11,2024-07-14,,,,,17,63,11,51,19,67,9,49,4.0,MODERATE,M,Moderate,2.0,LOW,L,Low,46,Chance of precipitation,04:47,21:49,,,,,3,MODERATE,M,Moderate,11,Drizzle,Light winds from the west,W,W,Westerly,11,7,2650225,Edinburgh
2024-07-10T22:41:00+01:00,2024-07-11T01:01:37.941+01:00,Light rain showers and light winds,21,13,2024-07-15,,,,,19,66,11,51,20,68,10,49,,,,,,,,,30,Low chance of precipitation,04:49,21:48,,,,,4,MODERATE,M,Moderate,10,Light Rain Showers,Light winds from the west,W,W,Westerly,10,6,2650225,Edinburgh
2024-07-10T22:41:00+01:00,2024-07-11T01:01:37.941+01:00,Light rain and a gentle breeze,22,14,2024-07-16,,,,,18,65,10,49,20,68,9,48,,,,,,,,,57,Chance of precipitation,04:50,21:47,,,,,5,MODERATE,M,Moderate,12,Light Rain,A gentle breeze from the west,W,W,Westerly,14,9,2650225,Edinburgh
2024-07-10T22:41:00+01:00,2024-07-11T01:01:37.941+01:00,Light rain showers and a gentle breeze,23,14,2024-07-17,,,,,19,67,9,49,20,69,8,47,,,,,,,,,35,Chance of precipitation,04:52,21:45,,,,,6,HIGH,H,High,10,Light Rain Showers,A gentle breeze from the west,W,W,Westerly,16,10,2650225,Edinburgh
2024-07-11T01:01:37+01:00,2024-07-11T01:01:37.941+01:00,Light rain showers and a gentle breeze,24,15,2024-07-18,,,,,19,66,12,53,20,68,10,51,,,,,,,,,31,Chance of precipitation,04:54,21:44,,,,,5,MODERATE,M,Moderate,10,Light Rain Showers,A gentle breeze from the south west,SW,SW,South Westerly,17,11,2650225,Edinburgh
2024-07-11T01:01:37+01:00,2024-07-11T01:01:37.941+01:00,Light cloud and a gentle breeze,34,21,2024-07-19,,,,,18,65,11,52,20,68,9,49,,,,,,,,,24,Low chance of precipitation,04:55,21:42,,,,,4,MODERATE,M,Moderate,7,Light Cloud,A gentle breeze from the south west,SW,SW,South Westerly,20,12,2650225,Edinburgh
2024-07-11T01:01:37+01:00,2024-07-11T01:01:37.941+01:00,Drizzle and a gentle breeze,27,17,2024-07-20,,,,,17,63,11,51,19,67,8,47,,,,,,,,,52,Chance of precipitation,04:57,21:41,,,,,5,MODERATE,M,Moderate,11,Drizzle,A gentle breeze from the west,W,W,Westerly,18,11,2650225,Edinburgh
2024-07-11T01:01:37+01:00,2024-07-11T01:01:37.941+01:00,Light rain and a gentle breeze,21,13,2024-07-21,,,,,18,65,12,53,21,69,9,49,,,,,,,,,64,Chance of precipitation,04:58,21:39,,,,,3,MODERATE,M,Moderate,12,Light Rain,A gentle breeze from the west,W,W,Westerly,18,11,2650225,Edinburgh
2024-07-11T01:01:37+01:00,2024-07-11T01:01:37.941+01:00,Drizzle and a moderate breeze,39,24,2024-07-22,,,,,18,64,10,50,21,69,7,45,,,,,,,,,51,Chance of precipitation,05:00,21:37,,,,,3,MODERATE,M,Moderate,11,Drizzle,A moderate breeze from the west,W,W,Westerly,23,14,2650225,Edinburgh
2024-07-11T01:01:37+01:00,2024-07-11T01:01:37.941+01:00,Light rain showers and a moderate breeze,29,18,2024-07-23,,,,,17,63,9,49,20,69,6,43,,,,,,,,,49,Chance of precipitation,05:02,21:36,,,,,4,MODERATE,M,Moderate,10,Light Rain Showers,A moderate breeze from the west,W,W,Westerly,25,15,2650225,Edinburgh
