issueDate,lastUpdated,report.enhancedWeatherDescription,report.gustSpeedKph,report.gustSpeedMph,report.localDate,report.lowermaxTemperatureC,report.lowermaxTemperatureF,report.lowerminTemperatureC,report.lowerminTemperatureF,report.maxTempC,report.maxTempF,report.minTempC,report.minTempF,report.mostLikelyHighTemperatureC,report.mostLikelyHighTemperatureF,report.mostLikelyLowTemperatureC,report.mostLikelyLowTemperatureF,report.pollenIndex,report.pollenIndexBand,report.pollenIndexIconText,report.pollenIndexText,report.pollutionIndex,report.pollutionIndexBand,report.pollutionIndexIconText,report.pollutionIndexText,report.precipitationProbabilityInPercent,report.precipitationProbabilityText,report.sunrise,report.sunset,report.uppermaxTemperatureC,report.uppermaxTemperatureF,report.upperminTemperatureC,report.upperminTemperatureF,report.uvIndex,report.uvIndexBand,report.uvIndexIconText,report.uvIndexText,report.weatherType,report.weatherTypeText,report.windDescription,report.windDirection,report.windDirectionAbbreviation,report.windDirectionFull,report.windSpeedKph,report.windSpeedMph,location_id,location_name
2023-09-28T10:52:00+01:00,2023-09-28T17:06:25.922+01:00,Light rain showers and a moderate breeze,55,34,2023-09-28,,,,,16,60,10,49,16,61,9,48,,,,,2.0,LOW,L,Low,86,High chance of precipitation,07:09,18:57,,,,,1,LOW,L,Low,9,Light Rain Showers,A moderate breeze from the south west,SW,SW,South Westerly,27,17,2650225,Edinburgh
2023-09-28T10:52:00+01:00,2023-09-28T17:06:25.922+01:00,Gusty winds and sunny intervals,72,45,2023-09-29,,,,,16,60,7,45,16,61,7,44,,,,,2.0,LOW,L,Low,0,Precipitation is not expected,07:11,18:54,,,,,3,MODERATE,M,Moderate,3,Sunny Intervals,Gusty winds from the west,W,W,Westerly,36,23,2650225,Edinburgh
2023-09-28T10:52:00+01:00,2023-09-28T17:06:25.922+01:00,Light rain and light winds,24,15,2023-09-30,,,,,15,59,11,51,16,61,9,48,,,,,2.0,LOW,L,Low,70,Chance of precipitation,07:13,18:52,,,,,3,MODERATE,M,Moderate,12,Light Rain,Light winds from the south west,SW,SW,South Westerly,11,7,2650225,Edinburgh
2023-09-28T10:52:00+01:00,2023-09-28T17:06:25.922+01:00,Sunny intervals and a moderate breeze,47,29,2023-10-01,,,,,17,62,8,47,18,64,7,45,,,,,2.0,LOW,L,Low,25,Low chance of precipitation,07:15,18:49,,,,,3,MODERATE,M,Moderate,3,Sunny Intervals,A moderate breeze from the south west,SW,SW,South Westerly,23,14,2650225,Edinburgh
2023-09-28T10:52:00+01:00,2023-09-28T17:06:25.922+01:00,Sunny intervals and a gentle breeze,39,24,2023-10-02,,,,,16,60,9,47,16,61,7,45,,,,,,,,,17,Low chance of precipitation,07:17,18:46,,,,,2,LOW,L,Low,3,Sunny Intervals,A gentle breeze from the south west,SW,SW,South Westerly,19,12,2650225,Edinburgh
2023-09-28T10:52:00+01:00,2023-09-28T17:06:25.922+01:00,Drizzle and a moderate breeze,60,37,2023-10-03,,,,,15,59,8,46,16,60,5,41,,,,,,,,,51,Chance of precipitation,07:19,18:44,,,,,2,LOW,L,Low,11,Drizzle,A moderate breeze from the west,W,W,Westerly,29,18,2650225,Edinburgh
2023-09-28T10:52:00+01:00,2023-09-28T17:06:25.922+01:00,Sunny intervals and a gentle breeze,40,25,2023-10-04,,,,,15,59,9,49,16,61,7,45,,,,,,,,,24,Low chance of precipitation,07:21,18:41,,,,,2,LOW,L,Low,3,Sunny Intervals,A gentle breeze from the south west,SW,SW,South Westerly,19,12,2650225,Edinburgh
2023-09-28T10:52:00+01:00,2023-09-28T17:06:25.922+01:00,Light cloud and a gentle breeze,47,29,2023-10-05,,,,,16,61,10,51,17,63,8,47,,,,,,,,,24,Low chance of precipitation,07:23,18:39,,,,,1,LOW,L,Low,7,Light Cloud,A gentle breeze from the south west,SW,SW,South Westerly,18,11,2650225,Edinburgh
2023-09-28T17:06:25+01:00,2023-09-28T17:06:25.922+01:00,Drizzle and a gentle breeze,48,30,2023-10-06,,,,,16,61,10,50,18,65,8,46,,,,,,,,,52,Chance of precipitation,07:25,18:36,,,,,2,LOW,L,Low,11,Drizzle,A gentle breeze from the south,S,S,Southerly,19,12,2650225,Edinburgh
2023-09-28T17:06:25+01:00,2023-09-28T17:06:25.922+01:00,Sunny intervals and a moderate breeze,62,38,2023-10-07,,,,,15,60,10,49,18,65,7,45,,,,,,,,,46,Chance of precipitation,07:27,18:33,,,,,3,MODERATE,M,Moderate,3,Sunny Intervals,A moderate breeze from the south west,SW,SW,South Westerly,24,15,2650225,Edinburgh
2023-09-28T17:06:25+01:00,2023-09-28T17:06:25.922+01:00,Drizzle and a moderate breeze,53,33,2023-10-08,,,,,15,59,9,49,19,66,6,42,,,,,,,,,34,Chance of precipitation,07:29,18:31,,,,,2,LOW,L,Low,11,Drizzle,A moderate breeze from the south west,SW,SW,South Westerly,21,13,2650225,Edinburgh
2023-09-28T17:06:25+01:00,2023-09-28T17:06:25.922+01:00,Gusty winds and light rain showers,68,43,2023-10-09,,,,,15,59,10,49,19,66,6,42,,,,,,,,,56,Chance of precipitation,07:31,18:28,,,,,1,LOW,L,Low,10,Light Rain Showers,Gusty winds from the south west,SW,SW,South Westerly,27,17,2650225,Edinburgh
2023-09-28T17:06:25+01:00,2023-09-28T17:06:25.922+01:00,Gusty winds and rain,77,48,2023-10-10,,,,,14,58,8,46,19,66,3,38,,,,,,,,,70,Chance of precipitation,07:33,18:26,,,,,1,LOW,L,Low,12,Light Rain,Gusty winds from the south west,SW,SW,South Westerly,30,19,2650225,Edinburgh
2023-09-28T17:06:25+01:00,2023-09-28T17:06:25.922+01:00,Gusty winds and light rain showers,75,46,2023-10-11,,,,,14,57,8,46,19,66,2,36,,,,,,,,,70,Chance of precipitation,07:35,18:23,,,,,2,LOW,L,Low,10,Light Rain Showers,Gusty winds from the west,W,W,Westerly,29,18,2650225,Edinburgh
