issueDate,lastUpdated,report.enhancedWeatherDescription,report.gustSpeedKph,report.gustSpeedMph,report.localDate,report.lowermaxTemperatureC,report.lowermaxTemperatureF,report.lowerminTemperatureC,report.lowerminTemperatureF,report.maxTempC,report.maxTempF,report.minTempC,report.minTempF,report.mostLikelyHighTemperatureC,report.mostLikelyHighTemperatureF,report.mostLikelyLowTemperatureC,report.mostLikelyLowTemperatureF,report.pollenIndex,report.pollenIndexBand,report.pollenIndexIconText,report.pollenIndexText,report.pollutionIndex,report.pollutionIndexBand,report.pollutionIndexIconText,report.pollutionIndexText,report.precipitationProbabilityInPercent,report.precipitationProbabilityText,report.sunrise,report.sunset,report.uppermaxTemperatureC,report.uppermaxTemperatureF,report.upperminTemperatureC,report.upperminTemperatureF,report.uvIndex,report.uvIndexBand,report.uvIndexIconText,report.uvIndexText,report.weatherType,report.weatherTypeText,report.windDescription,report.windDirection,report.windDirectionAbbreviation,report.windDirectionFull,report.windSpeedKph,report.windSpeedMph,location_id,location_name
2024-06-28T10:45:00+01:00,2024-06-28T17:01:37.172+01:00,A clear sky and a fresh breeze,53,33,2024-06-28,,,,,17,62,8,46,18,64,7,44,4.0,MODERATE,M,Moderate,2.0,LOW,L,Low,0,Precipitation is not expected,04:30,22:02,,,,,3,MODERATE,M,Moderate,0,Clear Sky,A fresh breeze from the south west,SW,SW,South Westerly,31,19,2650225,Edinburgh
2024-06-28T10:45:00+01:00,2024-06-28T17:01:37.172+01:00,Sunny intervals and a moderate breeze,45,28,2024-06-29,,,,,17,62,8,47,18,64,7,45,6.0,HIGH,H,High,2.0,LOW,L,Low,0,Precipitation is not expected,04:30,22:02,,,,,5,MODERATE,M,Moderate,3,Sunny Intervals,A moderate breeze from the west,W,W,Westerly,27,17,2650225,Edinburgh
2024-06-28T10:45:00+01:00,2024-06-28T17:01:37.172+01:00,Light rain showers and a gentle breeze,23,15,2024-06-30,,,,,16,62,9,48,17,63,8,46,6.0,HIGH,H,High,2.0,LOW,L,Low,51,Chance of precipitation,04:31,22:02,,,,,2,LOW,L,Low,10,Light Rain Showers,A gentle breeze from the west,W,W,Westerly,13,8,2650225,Edinburgh
2024-06-28T10:45:00+01:00,2024-06-28T17:01:37.172+01:00,Light rain and a moderate breeze,42,26,2024-07-01,,,,,15,60,9,48,17,63,8,46,6.0,HIGH,H,High,2.0,LOW,L,Low,70,Chance of precipitation,04:32,22:01,,,,,2,LOW,L,Low,12,Light Rain,A moderate breeze from the west,W,W,Westerly,23,15,2650225,Edinburgh
2024-06-28T10:45:00+01:00,2024-06-28T17:01:37.172+01:00,Drizzle and a moderate breeze,42,26,2024-07-02,,,,,16,61,10,49,17,63,9,48,6.0,HIGH,H,High,2.0,LOW,L,Low,38,Chance of precipitation,04:33,22:01,,,,,4,MODERATE,M,Moderate,11,Drizzle,A moderate breeze from the west,W,W,Westerly,24,15,2650225,Edinburgh
2024-06-28T10:45:00+01:00,2024-06-28T17:01:37.172+01:00,Light rain and a moderate breeze,54,34,2024-07-03,,,,,16,61,10,50,17,63,9,47,,,,,,,,,58,Chance of precipitation,04:34,22:00,,,,,2,LOW,L,Low,12,Light Rain,A moderate breeze from the south west,SW,SW,South Westerly,28,18,2650225,Edinburgh
2024-06-28T10:45:00+01:00,2024-06-28T17:01:37.172+01:00,Gusty winds and light rain showers,66,41,2024-07-04,,,,,15,60,9,48,18,64,8,46,,,,,,,,,42,Chance of precipitation,04:35,21:59,,,,,4,MODERATE,M,Moderate,10,Light Rain Showers,Gusty winds from the west,W,W,Westerly,31,19,2650225,Edinburgh
2024-06-28T10:45:00+01:00,2024-06-28T17:01:37.172+01:00,Light rain showers and a moderate breeze,48,30,2024-07-05,,,,,16,60,8,47,18,64,7,45,,,,,,,,,71,High chance of precipitation,04:36,21:58,,,,,4,MODERATE,M,Moderate,10,Light Rain Showers,A moderate breeze from the south west,SW,SW,South Westerly,29,18,2650225,Edinburgh
2024-06-28T17:01:37+01:00,2024-06-28T17:01:37.172+01:00,Light rain showers and a moderate breeze,28,17,2024-07-06,,,,,15,60,8,46,17,63,6,43,,,,,,,,,70,Chance of precipitation,04:37,21:58,,,,,5,MODERATE,M,Moderate,10,Light Rain Showers,A moderate breeze from the west,W,W,Westerly,22,14,2650225,Edinburgh
2024-06-28T17:01:37+01:00,2024-06-28T17:01:37.172+01:00,Drizzle and a moderate breeze,35,22,2024-07-07,,,,,16,61,10,49,18,65,8,46,,,,,,,,,70,Chance of precipitation,04:38,21:57,,,,,3,MODERATE,M,Moderate,11,Drizzle,A moderate breeze from the west,W,W,Westerly,21,13,2650225,Edinburgh
2024-06-28T17:01:37+01:00,2024-06-28T17:01:37.172+01:00,Drizzle and a gentle breeze,41,25,2024-07-08,,,,,17,63,11,52,19,66,9,47,,,,,,,,,49,Chance of precipitation,04:39,21:56,,,,,5,MODERATE,M,Moderate,11,Drizzle,A gentle breeze from the west,W,W,Westerly,17,11,2650225,Edinburgh
2024-06-28T17:01:37+01:00,2024-06-28T17:01:37.172+01:00,Thundery showers and a gentle breeze,32,20,2024-07-09,,,,,18,64,11,52,21,69,8,47,,,,,,,,,49,Chance of precipitation,04:41,21:55,,,,,3,MODERATE,M,Moderate,29,Thundery Showers,A gentle breeze from the west,W,W,Westerly,13,8,2650225,Edinburgh
2024-06-28T17:01:37+01:00,2024-06-28T17:01:37.172+01:00,Light rain showers and light winds,19,12,2024-07-10,,,,,19,65,11,52,22,71,8,46,,,,,,,,,44,Chance of precipitation,04:42,21:54,,,,,5,MODERATE,M,Moderate,10,Light Rain Showers,Light winds from the west,W,W,Westerly,12,7,2650225,Edinburgh
2024-06-28T17:01:37+01:00,2024-06-28T17:01:37.172+01:00,Light rain and light winds,17,10,2024-07-11,,,,,18,65,11,52,22,71,7,45,,,,,,,,,43,Chance of precipitation,04:43,21:53,,,,,5,MODERATE,M,Moderate,12,Light Rain,Light winds from the west,W,W,Westerly,11,7,2650225,Edinburgh
