issueDate,lastUpdated,report.enhancedWeatherDescription,report.gustSpeedKph,report.gustSpeedMph,report.localDate,report.lowermaxTemperatureC,report.lowermaxTemperatureF,report.lowerminTemperatureC,report.lowerminTemperatureF,report.maxTempC,report.maxTempF,report.minTempC,report.minTempF,report.mostLikelyHighTemperatureC,report.mostLikelyHighTemperatureF,report.mostLikelyLowTemperatureC,report.mostLikelyLowTemperatureF,report.pollenIndex,report.pollenIndexBand,report.pollenIndexIconText,report.pollenIndexText,report.pollutionIndex,report.pollutionIndexBand,report.pollutionIndexIconText,report.pollutionIndexText,report.precipitationProbabilityInPercent,report.precipitationProbabilityText,report.sunrise,report.sunset,report.uppermaxTemperatureC,report.uppermaxTemperatureF,report.upperminTemperatureC,report.upperminTemperatureF,report.uvIndex,report.uvIndexBand,report.uvIndexIconText,report.uvIndexText,report.weatherType,report.weatherTypeText,report.windDescription,report.windDirection,report.windDirectionAbbreviation,report.windDirectionFull,report.windSpeedKph,report.windSpeedMph,location_id,location_name
2023-09-27T10:52:00+01:00,2023-09-27T17:02:01.432+01:00,Gusty winds and light rain showers,73,46,2023-09-27,,,,,17,62,13,55,17,63,12,53,,,,,2.0,LOW,L,Low,100,Precipitation is expected,07:07,19:00,,,,,1,LOW,L,Low,9,Light Rain Showers,Gusty winds from the south east,SE,SE,South Easterly,35,22,2650225,Edinburgh
2023-09-27T10:52:00+01:00,2023-09-27T17:02:01.432+01:00,Gusty winds and light rain showers,75,47,2023-09-28,,,,,17,62,10,51,17,63,9,49,,,,,2.0,LOW,L,Low,29,Low chance of precipitation,07:09,18:57,,,,,3,MODERATE,M,Moderate,10,Light Rain Showers,Gusty winds from the south west,SW,SW,South Westerly,34,21,2650225,Edinburgh
2023-09-27T10:52:00+01:00,2023-09-27T17:02:01.432+01:00,Gusty winds and sunny intervals,68,43,2023-09-29,,,,,16,61,7,45,17,62,7,44,,,,,2.0,LOW,L,Low,20,Low chance of precipitation,07:11,18:54,,,,,3,MODERATE,M,Moderate,3,Sunny Intervals,Gusty winds from the west,W,W,Westerly,32,20,2650225,Edinburgh
2023-09-27T10:52:00+01:00,2023-09-27T17:02:01.432+01:00,Light rain and light winds,21,13,2023-09-30,,,,,15,60,11,52,17,62,9,48,,,,,2.0,LOW,L,Low,41,Chance of precipitation,07:13,18:52,,,,,2,LOW,L,Low,12,Light Rain,Light winds from the south west,SW,SW,South Westerly,10,6,2650225,Edinburgh
2023-09-27T10:52:00+01:00,2023-09-27T17:02:01.432+01:00,Light rain and a moderate breeze,57,36,2023-10-01,,,,,17,62,9,48,18,64,8,46,,,,,2.0,LOW,L,Low,51,Chance of precipitation,07:15,18:49,,,,,3,MODERATE,M,Moderate,12,Light Rain,A moderate breeze from the south west,SW,SW,South Westerly,27,17,2650225,Edinburgh
2023-09-27T10:52:00+01:00,2023-09-27T17:02:01.432+01:00,Light rain showers and a moderate breeze,47,29,2023-10-02,,,,,15,59,9,48,16,61,8,46,,,,,,,,,38,Chance of precipitation,07:17,18:46,,,,,2,LOW,L,Low,10,Light Rain Showers,A moderate breeze from the south west,SW,SW,South Westerly,27,17,2650225,Edinburgh
2023-09-27T10:52:00+01:00,2023-09-27T17:02:01.432+01:00,Light rain showers and a moderate breeze,53,33,2023-10-03,,,,,15,59,6,43,16,60,4,40,,,,,,,,,38,Chance of precipitation,07:19,18:44,,,,,3,MODERATE,M,Moderate,10,Light Rain Showers,A moderate breeze from the west,W,W,Westerly,27,17,2650225,Edinburgh
2023-09-27T10:52:00+01:00,2023-09-27T17:02:01.432+01:00,Drizzle and a gentle breeze,32,20,2023-10-04,,,,,15,59,9,48,16,60,6,43,,,,,,,,,56,Chance of precipitation,07:21,18:41,,,,,3,MODERATE,M,Moderate,11,Drizzle,A gentle breeze from the south,S,S,Southerly,14,9,2650225,Edinburgh
2023-09-27T17:02:01+01:00,2023-09-27T17:02:01.432+01:00,Light rain and a gentle breeze,20,13,2023-10-05,,,,,15,59,8,47,18,64,6,43,,,,,,,,,70,Chance of precipitation,07:23,18:39,,,,,2,LOW,L,Low,12,Light Rain,A gentle breeze from the south west,SW,SW,South Westerly,16,10,2650225,Edinburgh
2023-09-27T17:02:01+01:00,2023-09-27T17:02:01.432+01:00,Light rain and a gentle breeze,40,25,2023-10-06,,,,,15,59,7,45,17,63,4,40,,,,,,,,,62,Chance of precipitation,07:25,18:36,,,,,2,LOW,L,Low,12,Light Rain,A gentle breeze from the south west,SW,SW,South Westerly,17,11,2650225,Edinburgh
2023-09-27T17:02:01+01:00,2023-09-27T17:02:01.432+01:00,Sunny intervals and a gentle breeze,23,14,2023-10-07,,,,,15,59,9,48,18,65,5,42,,,,,,,,,0,Precipitation is not expected,07:27,18:33,,,,,3,MODERATE,M,Moderate,3,Sunny Intervals,A gentle breeze from the south,S,S,Southerly,13,8,2650225,Edinburgh
2023-09-27T17:02:01+01:00,2023-09-27T17:02:01.432+01:00,Sunny intervals and a gentle breeze,34,21,2023-10-08,,,,,15,60,8,46,19,66,4,39,,,,,,,,,16,Low chance of precipitation,07:29,18:31,,,,,3,MODERATE,M,Moderate,3,Sunny Intervals,A gentle breeze from the south west,SW,SW,South Westerly,16,10,2650225,Edinburgh
2023-09-27T17:02:01+01:00,2023-09-27T17:02:01.432+01:00,Drizzle and a gentle breeze,26,16,2023-10-09,,,,,15,59,9,49,19,66,5,41,,,,,,,,,48,Chance of precipitation,07:31,18:28,,,,,2,LOW,L,Low,11,Drizzle,A gentle breeze from the south,S,S,Southerly,16,10,2650225,Edinburgh
2023-09-27T17:02:01+01:00,2023-09-27T17:02:01.432+01:00,Gusty winds and drizzle,74,46,2023-10-10,,,,,15,59,10,49,20,67,5,40,,,,,,,,,36,Chance of precipitation,07:33,18:26,,,,,2,LOW,L,Low,11,Drizzle,Gusty winds from the south west,SW,SW,South Westerly,29,18,2650225,Edinburgh
