issueDate,lastUpdated,report.enhancedWeatherDescription,report.gustSpeedKph,report.gustSpeedMph,report.localDate,report.lowermaxTemperatureC,report.lowermaxTemperatureF,report.lowerminTemperatureC,report.lowerminTemperatureF,report.maxTempC,report.maxTempF,report.minTempC,report.minTempF,report.mostLikelyHighTemperatureC,report.mostLikelyHighTemperatureF,report.mostLikelyLowTemperatureC,report.mostLikelyLowTemperatureF,report.pollenIndex,report.pollenIndexBand,report.pollenIndexIconText,report.pollenIndexText,report.pollutionIndex,report.pollutionIndexBand,report.pollutionIndexIconText,report.pollutionIndexText,report.precipitationProbabilityInPercent,report.precipitationProbabilityText,report.sunrise,report.sunset,report.uppermaxTemperatureC,report.uppermaxTemperatureF,report.upperminTemperatureC,report.upperminTemperatureF,report.uvIndex,report.uvIndexBand,report.uvIndexIconText,report.uvIndexText,report.weatherType,report.weatherTypeText,report.windDescription,report.windDirection,report.windDirectionAbbreviation,report.windDirectionFull,report.windSpeedKph,report.windSpeedMph,location_id,location_name
2024-03-17T21:41:00+00:00,2024-03-18T08:01:09.295Z,Sunny intervals and a moderate breeze,46,28,2024-03-18,,,,,13,55,8,47,14,57,7,45,,,,,3.0,LOW,L,Low,0,Precipitation is not expected,06:19,18:24,,,,,4,MODERATE,M,Moderate,3,Sunny Intervals,A moderate breeze from the south west,SW,SW,South Westerly,23,14,2650225,Edinburgh
2024-03-17T21:41:00+00:00,2024-03-18T08:01:09.295Z,Sunny intervals and a moderate breeze,46,29,2024-03-19,,,,,12,53,3,38,13,56,3,37,,,,,3.0,LOW,L,Low,25,Low chance of precipitation,06:16,18:26,,,,,3,MODERATE,M,Moderate,3,Sunny Intervals,A moderate breeze from the west,W,W,Westerly,27,17,2650225,Edinburgh
2024-03-17T21:41:00+00:00,2024-03-18T08:01:09.295Z,Light rain and light winds,16,10,2024-03-20,,,,,9,49,4,39,11,52,3,37,,,,,2.0,LOW,L,Low,51,Chance of precipitation,06:13,18:28,,,,,3,MODERATE,M,Moderate,12,Light Rain,Light winds from the north,N,N,Northerly,7,5,2650225,Edinburgh
2024-03-17T21:41:00+00:00,2024-03-18T08:01:09.295Z,Gusty winds and rain,71,44,2024-03-21,,,,,12,54,6,43,13,56,5,41,,,,,2.0,LOW,L,Low,53,Chance of precipitation,06:11,18:30,,,,,1,LOW,L,Low,12,Light Rain,Gusty winds from the south west,SW,SW,South Westerly,35,22,2650225,Edinburgh
2024-03-17T21:41:00+00:00,2024-03-18T08:01:09.295Z,Gusty winds and drizzle,67,42,2024-03-22,,,,,10,49,3,38,11,51,2,35,,,,,3.0,LOW,L,Low,47,Chance of precipitation,06:08,18:32,,,,,2,LOW,L,Low,11,Drizzle,Gusty winds from the west,W,W,Westerly,36,22,2650225,Edinburgh
2024-03-17T21:41:00+00:00,2024-03-18T08:01:09.295Z,Light rain showers and a moderate breeze,54,33,2024-03-23,,,,,9,49,0,33,11,51,-1,30,,,,,,,,,36,Chance of precipitation,06:06,18:34,,,,,3,MODERATE,M,Moderate,10,Light Rain Showers,A moderate breeze from the north west,NW,NW,North Westerly,27,17,2650225,Edinburgh
2024-03-17T21:41:00+00:00,2024-03-18T08:01:09.295Z,Sunny intervals and a gentle breeze,25,15,2024-03-24,,,,,9,48,3,37,10,51,1,33,,,,,,,,,20,Low chance of precipitation,06:03,18:36,,,,,3,MODERATE,M,Moderate,3,Sunny Intervals,A gentle breeze from the west,W,W,Westerly,15,9,2650225,Edinburgh
2024-03-17T21:41:00+00:00,2024-03-18T08:01:09.295Z,Light rain and a moderate breeze,34,21,2024-03-25,,,,,10,49,4,39,11,52,1,34,,,,,,,,,45,Chance of precipitation,06:00,18:38,,,,,2,LOW,L,Low,12,Light Rain,A moderate breeze from the south west,SW,SW,South Westerly,20,13,2650225,Edinburgh
2024-03-18T08:01:09+00:00,2024-03-18T08:01:09.295Z,Light rain and a gentle breeze,29,18,2024-03-26,,,,,9,49,4,39,12,53,2,35,,,,,,,,,40,Chance of precipitation,05:58,18:40,,,,,3,MODERATE,M,Moderate,12,Light Rain,A gentle breeze from the south west,SW,SW,South Westerly,17,11,2650225,Edinburgh
2024-03-18T08:01:09+00:00,2024-03-18T08:01:09.295Z,Drizzle and a moderate breeze,47,29,2024-03-27,,,,,10,50,5,41,13,55,2,36,,,,,,,,,40,Chance of precipitation,05:55,18:42,,,,,1,LOW,L,Low,11,Drizzle,A moderate breeze from the south east,SE,SE,South Easterly,21,13,2650225,Edinburgh
2024-03-18T08:01:09+00:00,2024-03-18T08:01:09.295Z,Light rain showers and a gentle breeze,48,30,2024-03-28,,,,,10,50,5,41,13,56,2,35,,,,,,,,,34,Chance of precipitation,05:52,18:44,,,,,1,LOW,L,Low,10,Light Rain Showers,A gentle breeze from the south east,SE,SE,South Easterly,19,12,2650225,Edinburgh
2024-03-18T08:01:09+00:00,2024-03-18T08:01:09.295Z,Light cloud and a gentle breeze,39,24,2024-03-29,,,,,11,51,4,39,14,58,0,32,,,,,,,,,13,Low chance of precipitation,05:50,18:46,,,,,3,MODERATE,M,Moderate,7,Light Cloud,A gentle breeze from the south east,SE,SE,South Easterly,16,10,2650225,Edinburgh
2024-03-18T08:01:09+00:00,2024-03-18T08:01:09.295Z,Light rain showers and a gentle breeze,37,23,2024-03-30,,,,,11,51,5,42,15,58,1,35,,,,,,,,,25,Low chance of precipitation,05:47,18:48,,,,,2,LOW,L,Low,10,Light Rain Showers,A gentle breeze from the south east,SE,SE,South Easterly,15,9,2650225,Edinburgh
2024-03-18T08:01:09+00:00,2024-03-18T08:01:09.295Z,Light rain and a gentle breeze,45,28,2024-03-31,,,,,11,51,5,41,15,59,0,33,,,,,,,,,70,Chance of precipitation,06:45,19:50,,,,,1,LOW,L,Low,12,Light Rain,A gentle breeze from the east,E,E,Easterly,18,11,2650225,Edinburgh
