issueDate,lastUpdated,report.enhancedWeatherDescription,report.gustSpeedKph,report.gustSpeedMph,report.localDate,report.lowermaxTemperatureC,report.lowermaxTemperatureF,report.lowerminTemperatureC,report.lowerminTemperatureF,report.maxTempC,report.maxTempF,report.minTempC,report.minTempF,report.mostLikelyHighTemperatureC,report.mostLikelyHighTemperatureF,report.mostLikelyLowTemperatureC,report.mostLikelyLowTemperatureF,report.pollenIndex,report.pollenIndexBand,report.pollenIndexIconText,report.pollenIndexText,report.pollutionIndex,report.pollutionIndexBand,report.pollutionIndexIconText,report.pollutionIndexText,report.precipitationProbabilityInPercent,report.precipitationProbabilityText,report.sunrise,report.sunset,report.uppermaxTemperatureC,report.uppermaxTemperatureF,report.upperminTemperatureC,report.upperminTemperatureF,report.uvIndex,report.uvIndexBand,report.uvIndexIconText,report.uvIndexText,report.weatherType,report.weatherTypeText,report.windDescription,report.windDirection,report.windDirectionAbbreviation,report.windDirectionFull,report.windSpeedKph,report.windSpeedMph,location_id,location_name
2024-11-25T21:45:00+00:00,2024-11-26T00:55:29.943Z,Partly cloudy and a moderate breeze,45,28,2024-11-25,,,,,6,43,4,39,8,47,2,36,,,,,2.0,LOW,L,Low,17,Low chance of precipitation,08:10,15:49,,,,,0,LOW,L,Low,2,Partly Cloudy,A moderate breeze from the west,W,W,Westerly,22,14,2650225,Edinburgh
2024-11-25T21:45:00+00:00,2024-11-26T00:55:29.943Z,Sunny intervals and light winds,17,11,2024-11-26,,,,,6,43,1,33,8,47,-1,29,,,,,2.0,LOW,L,Low,5,Low chance of precipitation,08:12,15:48,,,,,1,LOW,L,Low,3,Sunny Intervals,Light winds from the west,W,W,Westerly,10,6,2650225,Edinburgh
2024-11-25T21:45:00+00:00,2024-11-26T00:55:29.943Z,Sunny intervals and light winds,16,10,2024-11-27,,,,,4,39,-3,26,5,42,-5,23,,,,,2.0,LOW,L,Low,18,Low chance of precipitation,08:13,15:47,,,,,1,LOW,L,Low,3,Sunny Intervals,Light winds from the north,N,N,Northerly,8,5,2650225,Edinburgh
2024-11-25T21:45:00+00:00,2024-11-26T00:55:29.943Z,Sunny and light winds,16,10,2024-11-28,,,,,4,40,1,34,6,42,-1,30,,,,,2.0,LOW,L,Low,0,Precipitation is not expected,08:15,15:46,,,,,1,LOW,L,Low,1,Sunny,Light winds from the south east,SE,SE,South Easterly,9,6,2650225,Edinburgh
2024-11-25T21:45:00+00:00,2024-11-26T00:55:29.943Z,Light rain and light winds,24,15,2024-11-29,,,,,9,47,7,44,10,51,4,40,,,,,2.0,LOW,L,Low,56,Chance of precipitation,08:17,15:45,,,,,1,LOW,L,Low,12,Light Rain,Light winds from the south,S,S,Southerly,12,7,2650225,Edinburgh
2024-11-25T21:45:00+00:00,2024-11-26T00:55:29.943Z,Light cloud and a gentle breeze,37,23,2024-11-30,,,,,12,54,10,49,15,59,8,46,,,,,,,,,20,Low chance of precipitation,08:19,15:44,,,,,1,LOW,L,Low,7,Light Cloud,A gentle breeze from the south,S,S,Southerly,19,12,2650225,Edinburgh
2024-11-25T21:45:00+00:00,2024-11-26T00:55:29.943Z,Light rain and a moderate breeze,48,30,2024-12-01,,,,,12,54,7,44,14,57,5,41,,,,,,,,,64,Chance of precipitation,08:20,15:43,,,,,1,LOW,L,Low,12,Light Rain,A moderate breeze from the south west,SW,SW,South Westerly,20,13,2650225,Edinburgh
2024-11-26T00:55:29+00:00,2024-11-26T00:55:29.943Z,Drizzle and a gentle breeze,35,22,2024-12-02,,,,,8,47,3,37,10,51,-1,31,,,,,,,,,66,Chance of precipitation,08:22,15:43,,,,,1,LOW,L,Low,11,Drizzle,A gentle breeze from the west,W,W,Westerly,16,10,2650225,Edinburgh
2024-11-26T00:55:29+00:00,2024-11-26T00:55:29.943Z,Light rain and a gentle breeze,35,22,2024-12-03,,,,,9,47,5,41,12,54,3,37,,,,,,,,,42,Chance of precipitation,08:23,15:42,,,,,1,LOW,L,Low,12,Light Rain,A gentle breeze from the south west,SW,SW,South Westerly,18,11,2650225,Edinburgh
2024-11-26T00:55:29+00:00,2024-11-26T00:55:29.943Z,Sunny and a gentle breeze,35,22,2024-12-04,,,,,8,47,5,40,11,53,1,35,,,,,,,,,45,Chance of precipitation,08:25,15:41,,,,,1,LOW,L,Low,1,Sunny,A gentle breeze from the south west,SW,SW,South Westerly,17,11,2650225,Edinburgh
2024-11-26T00:55:29+00:00,2024-11-26T00:55:29.943Z,Light rain and a moderate breeze,62,38,2024-12-05,,,,,9,48,5,40,13,55,1,34,,,,,,,,,63,Chance of precipitation,08:26,15:40,,,,,1,LOW,L,Low,12,Light Rain,A moderate breeze from the south west,SW,SW,South Westerly,24,15,2650225,Edinburgh
2024-11-26T00:55:29+00:00,2024-11-26T00:55:29.943Z,Sunny and a moderate breeze,49,31,2024-12-06,,,,,8,47,5,41,12,54,1,33,,,,,,,,,37,Chance of precipitation,08:28,15:40,,,,,1,LOW,L,Low,1,Sunny,A moderate breeze from the south west,SW,SW,South Westerly,20,13,2650225,Edinburgh
2024-11-26T00:55:29+00:00,2024-11-26T00:55:29.943Z,Light rain showers and a gentle breeze,44,27,2024-12-07,,,,,7,45,2,36,12,53,-2,28,,,,,,,,,42,Chance of precipitation,08:29,15:39,,,,,1,LOW,L,Low,10,Light Rain Showers,A gentle breeze from the west,W,W,Westerly,19,12,2650225,Edinburgh
2024-11-26T00:55:29+00:00,2024-11-26T00:55:29.943Z,Sunny and a gentle breeze,34,21,2024-12-08,,,,,8,46,4,39,13,55,-1,30,,,,,,,,,20,Low chance of precipitation,08:31,15:39,,,,,1,LOW,L,Low,1,Sunny,A gentle breeze from the south west,SW,SW,South Westerly,19,12,2650225,Edinburgh
