issueDate,lastUpdated,report.enhancedWeatherDescription,report.gustSpeedKph,report.gustSpeedMph,report.localDate,report.lowermaxTemperatureC,report.lowermaxTemperatureF,report.lowerminTemperatureC,report.lowerminTemperatureF,report.maxTempC,report.maxTempF,report.minTempC,report.minTempF,report.mostLikelyHighTemperatureC,report.mostLikelyHighTemperatureF,report.mostLikelyLowTemperatureC,report.mostLikelyLowTemperatureF,report.pollenIndex,report.pollenIndexBand,report.pollenIndexIconText,report.pollenIndexText,report.pollutionIndex,report.pollutionIndexBand,report.pollutionIndexIconText,report.pollutionIndexText,report.precipitationProbabilityInPercent,report.precipitationProbabilityText,report.sunrise,report.sunset,report.uppermaxTemperatureC,report.uppermaxTemperatureF,report.upperminTemperatureC,report.upperminTemperatureF,report.uvIndex,report.uvIndexBand,report.uvIndexIconText,report.uvIndexText,report.weatherType,report.weatherTypeText,report.windDescription,report.windDirection,report.windDirectionAbbreviation,report.windDirectionFull,report.windSpeedKph,report.windSpeedMph,location_id,location_name
2023-09-06T10:52:00+01:00,2023-09-06T17:00:42.529+01:00,Sunny and light winds,18,11,2023-09-06,,,,,21,69,12,53,22,72,9,48,4.0,MODERATE,M,Moderate,3.0,LOW,L,Low,0,Precipitation is not expected,06:26,19:55,,,,,4,MODERATE,M,Moderate,1,Sunny,Light winds from the north east,NE,NE,North Easterly,10,6,2650225,Edinburgh
2023-09-06T10:52:00+01:00,2023-09-06T17:00:42.529+01:00,Sunny intervals and light winds,18,11,2023-09-07,,,,,23,74,14,58,27,80,12,54,4.0,MODERATE,M,Moderate,2.0,LOW,L,Low,0,Precipitation is not expected,06:28,19:53,,,,,5,MODERATE,M,Moderate,3,Sunny Intervals,Light winds from the north east,NE,NE,North Easterly,10,6,2650225,Edinburgh
2023-09-06T10:52:00+01:00,2023-09-06T17:00:42.529+01:00,Sunny and light winds,11,7,2023-09-08,,,,,26,79,15,58,29,85,13,55,4.0,MODERATE,M,Moderate,4.0,MODERATE,M,Moderate,4,Low chance of precipitation,06:30,19:50,,,,,5,MODERATE,M,Moderate,1,Sunny,Light winds from the west,W,W,Westerly,8,5,2650225,Edinburgh
2023-09-06T10:52:00+01:00,2023-09-06T17:00:42.529+01:00,Sunny intervals and a gentle breeze,26,16,2023-09-09,,,,,25,76,14,58,26,79,13,55,4.0,MODERATE,M,Moderate,3.0,LOW,L,Low,14,Low chance of precipitation,06:32,19:47,,,,,5,MODERATE,M,Moderate,3,Sunny Intervals,A gentle breeze from the south west,SW,SW,South Westerly,18,11,2650225,Edinburgh
2023-09-06T10:52:00+01:00,2023-09-06T17:00:42.529+01:00,Thundery showers and light winds,18,11,2023-09-10,,,,,23,73,15,59,25,78,13,56,4.0,MODERATE,M,Moderate,2.0,LOW,L,Low,29,Low chance of precipitation,06:34,19:45,,,,,4,MODERATE,M,Moderate,29,Thundery Showers,Light winds from the south west,SW,SW,South Westerly,10,6,2650225,Edinburgh
2023-09-06T10:52:00+01:00,2023-09-06T17:00:42.529+01:00,Light rain and a gentle breeze,23,14,2023-09-11,,,,,19,67,12,53,23,73,8,47,,,,,,,,,52,Chance of precipitation,06:36,19:42,,,,,3,MODERATE,M,Moderate,12,Light Rain,A gentle breeze from the south west,SW,SW,South Westerly,15,9,2650225,Edinburgh
2023-09-06T10:52:00+01:00,2023-09-06T17:00:42.529+01:00,Light rain and a gentle breeze,19,12,2023-09-12,,,,,18,65,9,48,23,74,4,40,,,,,,,,,47,Chance of precipitation,06:38,19:39,,,,,4,MODERATE,M,Moderate,12,Light Rain,A gentle breeze from the west,W,W,Westerly,16,10,2650225,Edinburgh
2023-09-06T10:52:00+01:00,2023-09-06T17:00:42.529+01:00,Drizzle and a gentle breeze,34,21,2023-09-13,,,,,17,63,10,50,20,68,6,43,,,,,,,,,35,Chance of precipitation,06:40,19:37,,,,,3,MODERATE,M,Moderate,11,Drizzle,A gentle breeze from the south west,SW,SW,South Westerly,19,12,2650225,Edinburgh
2023-09-06T17:00:42+01:00,2023-09-06T17:00:42.529+01:00,Light rain and a gentle breeze,22,14,2023-09-14,,,,,17,63,9,48,19,67,7,44,,,,,,,,,31,Chance of precipitation,06:42,19:34,,,,,4,MODERATE,M,Moderate,12,Light Rain,A gentle breeze from the west,W,W,Westerly,19,12,2650225,Edinburgh
2023-09-06T17:00:42+01:00,2023-09-06T17:00:42.529+01:00,Light rain showers and a gentle breeze,26,16,2023-09-15,,,,,18,64,11,51,20,68,8,46,,,,,,,,,0,Precipitation is not expected,06:44,19:31,,,,,3,MODERATE,M,Moderate,10,Light Rain Showers,A gentle breeze from the south west,SW,SW,South Westerly,14,9,2650225,Edinburgh
2023-09-06T17:00:42+01:00,2023-09-06T17:00:42.529+01:00,Sunny intervals and a moderate breeze,34,21,2023-09-16,,,,,18,64,9,48,21,69,6,42,,,,,,,,,25,Low chance of precipitation,06:45,19:29,,,,,3,MODERATE,M,Moderate,3,Sunny Intervals,A moderate breeze from the south west,SW,SW,South Westerly,20,13,2650225,Edinburgh
2023-09-06T17:00:42+01:00,2023-09-06T17:00:42.529+01:00,Drizzle and a gentle breeze,42,26,2023-09-17,,,,,17,64,11,51,21,70,7,44,,,,,,,,,39,Chance of precipitation,06:47,19:26,,,,,4,MODERATE,M,Moderate,11,Drizzle,A gentle breeze from the south west,SW,SW,South Westerly,19,12,2650225,Edinburgh
2023-09-06T17:00:42+01:00,2023-09-06T17:00:42.529+01:00,Gusty winds and light rain showers,67,42,2023-09-18,,,,,17,64,11,52,22,71,7,44,,,,,,,,,52,Chance of precipitation,06:49,19:23,,,,,4,MODERATE,M,Moderate,10,Light Rain Showers,Gusty winds from the south west,SW,SW,South Westerly,22,14,2650225,Edinburgh
2023-09-06T17:00:42+01:00,2023-09-06T17:00:42.529+01:00,Light rain showers and a moderate breeze,62,38,2023-09-19,,,,,15,60,9,48,20,68,4,39,,,,,,,,,62,Chance of precipitation,06:51,19:21,,,,,3,MODERATE,M,Moderate,10,Light Rain Showers,A moderate breeze from the south west,SW,SW,South Westerly,22,14,2650225,Edinburgh
