issueDate,lastUpdated,report.enhancedWeatherDescription,report.gustSpeedKph,report.gustSpeedMph,report.localDate,report.lowermaxTemperatureC,report.lowermaxTemperatureF,report.lowerminTemperatureC,report.lowerminTemperatureF,report.maxTempC,report.maxTempF,report.minTempC,report.minTempF,report.mostLikelyHighTemperatureC,report.mostLikelyHighTemperatureF,report.mostLikelyLowTemperatureC,report.mostLikelyLowTemperatureF,report.pollenIndex,report.pollenIndexBand,report.pollenIndexIconText,report.pollenIndexText,report.pollutionIndex,report.pollutionIndexBand,report.pollutionIndexIconText,report.pollutionIndexText,report.precipitationProbabilityInPercent,report.precipitationProbabilityText,report.sunrise,report.sunset,report.uppermaxTemperatureC,report.uppermaxTemperatureF,report.upperminTemperatureC,report.upperminTemperatureF,report.uvIndex,report.uvIndexBand,report.uvIndexIconText,report.uvIndexText,report.weatherType,report.weatherTypeText,report.windDescription,report.windDirection,report.windDirectionAbbreviation,report.windDirectionFull,report.windSpeedKph,report.windSpeedMph,location_id,location_name
2024-06-13T10:45:00+01:00,2024-06-13T17:01:40.186+01:00,Light rain showers and a gentle breeze,39,24,2024-06-13,,,,,15,58,10,50,16,60,9,48,4.0,MODERATE,M,Moderate,3.0,LOW,L,Low,90,High chance of precipitation,04:26,22:00,,,,,1,LOW,L,Low,9,Light Rain Showers,A gentle breeze from the south east,SE,SE,South Easterly,18,11,2650225,Edinburgh
2024-06-13T10:45:00+01:00,2024-06-13T17:01:40.186+01:00,Thundery showers and a gentle breeze,31,19,2024-06-14,,,,,15,58,5,42,16,60,4,40,4.0,MODERATE,M,Moderate,3.0,LOW,L,Low,78,High chance of precipitation,04:26,22:00,,,,,3,MODERATE,M,Moderate,29,Thundery Showers,A gentle breeze from the south west,SW,SW,South Westerly,14,9,2650225,Edinburgh
2024-06-13T10:45:00+01:00,2024-06-13T17:01:40.186+01:00,Light rain showers and light winds,17,11,2024-06-15,,,,,14,58,9,49,16,60,8,47,4.0,MODERATE,M,Moderate,3.0,LOW,L,Low,70,Chance of precipitation,04:26,22:01,,,,,4,MODERATE,M,Moderate,10,Light Rain Showers,Light winds from the north east,NE,NE,North Easterly,8,5,2650225,Edinburgh
2024-06-13T10:45:00+01:00,2024-06-13T17:01:40.186+01:00,Light rain and light winds,18,11,2024-06-16,,,,,15,59,9,47,16,61,7,45,4.0,MODERATE,M,Moderate,3.0,LOW,L,Low,70,Chance of precipitation,04:26,22:01,,,,,4,MODERATE,M,Moderate,12,Light Rain,Light winds from the west,W,W,Westerly,10,6,2650225,Edinburgh
2024-06-13T10:45:00+01:00,2024-06-13T17:01:40.186+01:00,Light rain showers and light winds,21,13,2024-06-17,,,,,17,62,9,48,18,65,8,46,4.0,MODERATE,M,Moderate,3.0,LOW,L,Low,62,Chance of precipitation,04:26,22:02,,,,,4,MODERATE,M,Moderate,10,Light Rain Showers,Light winds from the north west,NW,NW,North Westerly,9,5,2650225,Edinburgh
2024-06-13T10:45:00+01:00,2024-06-13T17:01:40.186+01:00,Drizzle and a gentle breeze,22,14,2024-06-18,,,,,16,61,9,47,18,65,7,45,,,,,,,,,56,Chance of precipitation,04:26,22:02,,,,,4,MODERATE,M,Moderate,11,Drizzle,A gentle breeze from the north west,NW,NW,North Westerly,12,8,2650225,Edinburgh
2024-06-13T10:45:00+01:00,2024-06-13T17:01:40.186+01:00,Sunny intervals and a gentle breeze,24,15,2024-06-19,,,,,16,60,9,48,17,63,7,44,,,,,,,,,30,Low chance of precipitation,04:26,22:02,,,,,5,MODERATE,M,Moderate,3,Sunny Intervals,A gentle breeze from the north west,NW,NW,North Westerly,18,11,2650225,Edinburgh
2024-06-13T10:45:00+01:00,2024-06-13T17:01:40.186+01:00,Drizzle and a gentle breeze,23,14,2024-06-20,,,,,17,62,9,48,19,65,7,45,,,,,,,,,36,Chance of precipitation,04:26,22:03,,,,,4,MODERATE,M,Moderate,11,Drizzle,A gentle breeze from the west,W,W,Westerly,16,10,2650225,Edinburgh
2024-06-13T17:01:40+01:00,2024-06-13T17:01:40.186+01:00,Light rain and a gentle breeze,26,16,2024-06-21,,,,,18,64,12,53,21,69,9,48,,,,,,,,,45,Chance of precipitation,04:26,22:03,,,,,5,MODERATE,M,Moderate,12,Light Rain,A gentle breeze from the south west,SW,SW,South Westerly,17,11,2650225,Edinburgh
2024-06-13T17:01:40+01:00,2024-06-13T17:01:40.186+01:00,Light rain and a gentle breeze,22,14,2024-06-22,,,,,19,66,11,53,22,71,8,47,,,,,,,,,45,Chance of precipitation,04:27,22:03,,,,,6,HIGH,H,High,12,Light Rain,A gentle breeze from the south west,SW,SW,South Westerly,19,12,2650225,Edinburgh
2024-06-13T17:01:40+01:00,2024-06-13T17:01:40.186+01:00,Sunny and a moderate breeze,28,18,2024-06-23,,,,,19,66,11,51,22,72,7,45,,,,,,,,,39,Chance of precipitation,04:27,22:03,,,,,6,HIGH,H,High,1,Sunny,A moderate breeze from the west,W,W,Westerly,21,13,2650225,Edinburgh
2024-06-13T17:01:40+01:00,2024-06-13T17:01:40.186+01:00,Sunny and a gentle breeze,30,19,2024-06-24,,,,,19,66,11,51,23,73,7,44,,,,,,,,,0,Precipitation is not expected,04:27,22:03,,,,,6,HIGH,H,High,1,Sunny,A gentle breeze from the west,W,W,Westerly,18,11,2650225,Edinburgh
2024-06-13T17:01:40+01:00,2024-06-13T17:01:40.186+01:00,Sunny and a gentle breeze,31,19,2024-06-25,,,,,19,66,11,52,23,73,7,44,,,,,,,,,17,Low chance of precipitation,04:28,22:03,,,,,6,HIGH,H,High,1,Sunny,A gentle breeze from the west,W,W,Westerly,18,11,2650225,Edinburgh
2024-06-13T17:01:40+01:00,2024-06-13T17:01:40.186+01:00,Sunny intervals and light winds,16,10,2024-06-26,,,,,19,67,11,51,24,75,6,43,,,,,,,,,0,Precipitation is not expected,04:28,22:03,,,,,5,MODERATE,M,Moderate,3,Sunny Intervals,Light winds from the north west,NW,NW,North Westerly,9,6,2650225,Edinburgh
