issueDate,lastUpdated,report.enhancedWeatherDescription,report.gustSpeedKph,report.gustSpeedMph,report.localDate,report.lowermaxTemperatureC,report.lowermaxTemperatureF,report.lowerminTemperatureC,report.lowerminTemperatureF,report.maxTempC,report.maxTempF,report.minTempC,report.minTempF,report.mostLikelyHighTemperatureC,report.mostLikelyHighTemperatureF,report.mostLikelyLowTemperatureC,report.mostLikelyLowTemperatureF,report.pollenIndex,report.pollenIndexBand,report.pollenIndexIconText,report.pollenIndexText,report.pollutionIndex,report.pollutionIndexBand,report.pollutionIndexIconText,report.pollutionIndexText,report.precipitationProbabilityInPercent,report.precipitationProbabilityText,report.sunrise,report.sunset,report.uppermaxTemperatureC,report.uppermaxTemperatureF,report.upperminTemperatureC,report.upperminTemperatureF,report.uvIndex,report.uvIndexBand,report.uvIndexIconText,report.uvIndexText,report.weatherType,report.weatherTypeText,report.windDescription,report.windDirection,report.windDirectionAbbreviation,report.windDirectionFull,report.windSpeedKph,report.windSpeedMph,location_id,location_name
2024-03-07T21:45:00+00:00,2024-03-08T00:00:00.074Z,Thick cloud and a gentle breeze,36,23,2024-03-07,,,,,7,45,4,39,8,47,3,37,,,,,3.0,LOW,L,Low,11,Low chance of precipitation,06:47,18:01,,,,,0,LOW,L,Low,37,Thick Cloud,A gentle breeze from the east,E,E,Easterly,18,11,2650225,Edinburgh
2024-03-07T21:45:00+00:00,2024-03-08T00:00:00.074Z,Light rain showers and a moderate breeze,52,32,2024-03-08,,,,,7,45,4,39,8,47,3,38,,,,,3.0,LOW,L,Low,32,Chance of precipitation,06:45,18:03,,,,,1,LOW,L,Low,10,Light Rain Showers,A moderate breeze from the east,E,E,Easterly,29,18,2650225,Edinburgh
2024-03-07T21:45:00+00:00,2024-03-08T00:00:00.074Z,Drizzle and a fresh breeze,54,34,2024-03-09,,,,,7,45,5,40,8,46,4,39,,,,,3.0,LOW,L,Low,50,Chance of precipitation,06:42,18:05,,,,,1,LOW,L,Low,11,Drizzle,A fresh breeze from the east,E,E,Easterly,30,19,2650225,Edinburgh
2024-03-07T21:45:00+00:00,2024-03-08T00:00:00.074Z,Light rain showers and a moderate breeze,49,31,2024-03-10,,,,,7,45,4,39,8,46,3,37,,,,,3.0,LOW,L,Low,70,Chance of precipitation,06:40,18:07,,,,,1,LOW,L,Low,10,Light Rain Showers,A moderate breeze from the east,E,E,Easterly,28,18,2650225,Edinburgh
2024-03-07T21:45:00+00:00,2024-03-08T00:00:00.074Z,Light rain and a moderate breeze,37,23,2024-03-11,,,,,7,45,4,38,8,47,2,36,,,,,3.0,LOW,L,Low,70,Chance of precipitation,06:37,18:09,,,,,1,LOW,L,Low,12,Light Rain,A moderate breeze from the east,E,E,Easterly,22,14,2650225,Edinburgh
2024-03-07T21:45:00+00:00,2024-03-08T00:00:00.074Z,Light rain and a gentle breeze,22,14,2024-03-12,,,,,8,47,4,38,9,49,0,32,,,,,,,,,41,Chance of precipitation,06:34,18:11,,,,,1,LOW,L,Low,12,Light Rain,A gentle breeze from the east,E,E,Easterly,14,9,2650225,Edinburgh
2024-03-07T21:45:00+00:00,2024-03-08T00:00:00.074Z,Drizzle and a gentle breeze,44,28,2024-03-13,,,,,10,49,5,41,12,53,3,37,,,,,,,,,41,Chance of precipitation,06:32,18:14,,,,,2,LOW,L,Low,11,Drizzle,A gentle breeze from the south,S,S,Southerly,19,12,2650225,Edinburgh
2024-03-08T00:00:00+00:00,2024-03-08T00:00:00.074Z,Light rain and a moderate breeze,48,30,2024-03-14,,,,,10,49,4,40,12,53,3,38,,,,,,,,,35,Chance of precipitation,06:29,18:16,,,,,1,LOW,L,Low,12,Light Rain,A moderate breeze from the south,S,S,Southerly,21,13,2650225,Edinburgh
2024-03-08T00:00:00+00:00,2024-03-08T00:00:00.074Z,Drizzle and a gentle breeze,47,29,2024-03-15,,,,,11,51,3,37,12,54,1,34,,,,,,,,,31,Chance of precipitation,06:27,18:18,,,,,2,LOW,L,Low,11,Drizzle,A gentle breeze from the south east,SE,SE,South Easterly,20,12,2650225,Edinburgh
2024-03-08T00:00:00+00:00,2024-03-08T00:00:00.074Z,Sunny intervals and a gentle breeze,26,16,2024-03-16,,,,,11,51,4,40,13,55,2,35,,,,,,,,,30,Low chance of precipitation,06:24,18:20,,,,,3,MODERATE,M,Moderate,3,Sunny Intervals,A gentle breeze from the south east,SE,SE,South Easterly,15,9,2650225,Edinburgh
2024-03-08T00:00:00+00:00,2024-03-08T00:00:00.074Z,Light rain and light winds,27,17,2024-03-17,,,,,10,51,5,41,13,55,2,36,,,,,,,,,70,Chance of precipitation,06:21,18:22,,,,,1,LOW,L,Low,12,Light Rain,Light winds from the south east,SE,SE,South Easterly,10,6,2650225,Edinburgh
2024-03-08T00:00:00+00:00,2024-03-08T00:00:00.074Z,Light rain and light winds,24,15,2024-03-18,,,,,10,50,5,41,13,55,2,35,,,,,,,,,70,Chance of precipitation,06:19,18:24,,,,,1,LOW,L,Low,12,Light Rain,Light winds from the south west,SW,SW,South Westerly,10,6,2650225,Edinburgh
2024-03-08T00:00:00+00:00,2024-03-08T00:00:00.074Z,Light rain and a gentle breeze,32,20,2024-03-19,,,,,10,50,3,37,13,56,-1,30,,,,,,,,,56,Chance of precipitation,06:16,18:26,,,,,2,LOW,L,Low,12,Light Rain,A gentle breeze from the east,E,E,Easterly,14,9,2650225,Edinburgh
2024-03-08T00:00:00+00:00,2024-03-08T00:00:00.074Z,Sunny intervals and light winds,20,12,2024-03-20,,,,,10,51,3,37,14,58,-1,29,,,,,,,,,22,Low chance of precipitation,06:13,18:28,,,,,4,MODERATE,M,Moderate,3,Sunny Intervals,Light winds from the south east,SE,SE,South Easterly,11,7,2650225,Edinburgh
