issueDate,lastUpdated,report.enhancedWeatherDescription,report.gustSpeedKph,report.gustSpeedMph,report.localDate,report.lowermaxTemperatureC,report.lowermaxTemperatureF,report.lowerminTemperatureC,report.lowerminTemperatureF,report.maxTempC,report.maxTempF,report.minTempC,report.minTempF,report.mostLikelyHighTemperatureC,report.mostLikelyHighTemperatureF,report.mostLikelyLowTemperatureC,report.mostLikelyLowTemperatureF,report.pollenIndex,report.pollenIndexBand,report.pollenIndexIconText,report.pollenIndexText,report.pollutionIndex,report.pollutionIndexBand,report.pollutionIndexIconText,report.pollutionIndexText,report.precipitationProbabilityInPercent,report.precipitationProbabilityText,report.sunrise,report.sunset,report.uppermaxTemperatureC,report.uppermaxTemperatureF,report.upperminTemperatureC,report.upperminTemperatureF,report.uvIndex,report.uvIndexBand,report.uvIndexIconText,report.uvIndexText,report.weatherType,report.weatherTypeText,report.windDescription,report.windDirection,report.windDirectionAbbreviation,report.windDirectionFull,report.windSpeedKph,report.windSpeedMph,location_id,location_name
2024-02-04T09:46:00+00:00,2024-02-04T16:01:02.265Z,Light rain and a moderate breeze,47,29,2024-02-04,,,,,9,48,9,48,10,49,8,46,,,,,3.0,LOW,L,Low,80,High chance of precipitation,08:03,16:52,,,,,1,LOW,L,Low,12,Light Rain,A moderate breeze from the west,W,W,Westerly,24,15,2650225,Edinburgh
2024-02-04T09:46:00+00:00,2024-02-04T16:01:02.265Z,Strong winds and rain,81,50,2024-02-05,,,,,11,51,7,44,11,53,5,41,,,,,2.0,LOW,L,Low,62,Chance of precipitation,08:01,16:54,,,,,1,LOW,L,Low,12,Light Rain,Strong winds from the south west,SW,SW,South Westerly,41,26,2650225,Edinburgh
2024-02-04T09:46:00+00:00,2024-02-04T16:01:02.265Z,Light rain and a moderate breeze,48,30,2024-02-06,,,,,7,45,0,32,8,46,-1,30,,,,,2.0,LOW,L,Low,53,Chance of precipitation,07:58,16:56,,,,,2,LOW,L,Low,12,Light Rain,A moderate breeze from the west,W,W,Westerly,22,14,2650225,Edinburgh
2024-02-04T09:46:00+00:00,2024-02-04T16:01:02.265Z,Sunny intervals and light winds,27,17,2024-02-07,,,,,5,41,0,31,6,42,-1,29,,,,,2.0,LOW,L,Low,11,Low chance of precipitation,07:56,16:59,,,,,2,LOW,L,Low,3,Sunny Intervals,Light winds from the south west,SW,SW,South Westerly,11,7,2650225,Edinburgh
2024-02-04T09:46:00+00:00,2024-02-04T16:01:02.265Z,Sleet and a moderate breeze,43,27,2024-02-08,,,,,4,39,2,35,5,41,0,33,,,,,2.0,LOW,L,Low,70,Chance of precipitation,07:54,17:01,,,,,1,LOW,L,Low,18,Sleet,A moderate breeze from the east,E,E,Easterly,24,15,2650225,Edinburgh
2024-02-04T09:46:00+00:00,2024-02-04T16:01:02.265Z,Light rain showers and a fresh breeze,56,35,2024-02-09,,,,,4,40,1,35,5,41,1,34,,,,,,,,,70,Chance of precipitation,07:52,17:03,,,,,1,LOW,L,Low,10,Light Rain Showers,A fresh breeze from the north east,NE,NE,North Easterly,30,19,2650225,Edinburgh
2024-02-04T09:46:00+00:00,2024-02-04T16:01:02.265Z,Sleet showers and a moderate breeze,52,33,2024-02-10,,,,,4,39,-1,30,5,40,-2,28,,,,,,,,,70,Chance of precipitation,07:50,17:05,,,,,2,LOW,L,Low,17,Sleet Showers,A moderate breeze from the north east,NE,NE,North Easterly,23,14,2650225,Edinburgh
2024-02-04T09:46:00+00:00,2024-02-04T16:01:02.265Z,Sleet showers and a gentle breeze,42,26,2024-02-11,,,,,4,39,-1,30,5,41,-2,28,,,,,,,,,47,Chance of precipitation,07:48,17:07,,,,,2,LOW,L,Low,17,Sleet Showers,A gentle breeze from the north,N,N,Northerly,18,11,2650225,Edinburgh
2024-02-04T16:01:02+00:00,2024-02-04T16:01:02.265Z,Sunny intervals and a gentle breeze,26,16,2024-02-12,,,,,5,40,-2,28,6,42,-3,26,,,,,,,,,30,Low chance of precipitation,07:46,17:10,,,,,2,LOW,L,Low,3,Sunny Intervals,A gentle breeze from the north west,NW,NW,North Westerly,16,10,2650225,Edinburgh
2024-02-04T16:01:02+00:00,2024-02-04T16:01:02.265Z,Sunny intervals and light winds,17,11,2024-02-13,,,,,5,41,0,31,6,43,-2,29,,,,,,,,,38,Chance of precipitation,07:43,17:12,,,,,2,LOW,L,Low,3,Sunny Intervals,Light winds from the west,W,W,Westerly,10,6,2650225,Edinburgh
2024-02-04T16:01:02+00:00,2024-02-04T16:01:02.265Z,Sleet showers and light winds,11,7,2024-02-14,,,,,6,42,-1,31,7,45,-2,28,,,,,,,,,42,Chance of precipitation,07:41,17:14,,,,,1,LOW,L,Low,17,Sleet Showers,Light winds from the south west,SW,SW,South Westerly,10,6,2650225,Edinburgh
2024-02-04T16:01:02+00:00,2024-02-04T16:01:02.265Z,Sunny and light winds,10,6,2024-02-15,,,,,7,44,1,35,9,47,-1,31,,,,,,,,,29,Low chance of precipitation,07:39,17:16,,,,,2,LOW,L,Low,1,Sunny,Light winds from the south west,SW,SW,South Westerly,7,5,2650225,Edinburgh
2024-02-04T16:01:02+00:00,2024-02-04T16:01:02.265Z,Light rain and light winds,30,19,2024-02-16,,,,,7,45,3,37,9,49,1,33,,,,,,,,,65,Chance of precipitation,07:37,17:18,,,,,1,LOW,L,Low,12,Light Rain,Light winds from the south west,SW,SW,South Westerly,12,7,2650225,Edinburgh
2024-02-04T16:01:02+00:00,2024-02-04T16:01:02.265Z,Drizzle and light winds,27,17,2024-02-17,,,,,7,45,3,37,10,50,0,31,,,,,,,,,59,Chance of precipitation,07:34,17:21,,,,,2,LOW,L,Low,11,Drizzle,Light winds from the south west,SW,SW,South Westerly,11,7,2650225,Edinburgh
