issueDate,lastUpdated,report.enhancedWeatherDescription,report.gustSpeedKph,report.gustSpeedMph,report.localDate,report.lowermaxTemperatureC,report.lowermaxTemperatureF,report.lowerminTemperatureC,report.lowerminTemperatureF,report.maxTempC,report.maxTempF,report.minTempC,report.minTempF,report.mostLikelyHighTemperatureC,report.mostLikelyHighTemperatureF,report.mostLikelyLowTemperatureC,report.mostLikelyLowTemperatureF,report.pollenIndex,report.pollenIndexBand,report.pollenIndexIconText,report.pollenIndexText,report.pollutionIndex,report.pollutionIndexBand,report.pollutionIndexIconText,report.pollutionIndexText,report.precipitationProbabilityInPercent,report.precipitationProbabilityText,report.sunrise,report.sunset,report.uppermaxTemperatureC,report.uppermaxTemperatureF,report.upperminTemperatureC,report.upperminTemperatureF,report.uvIndex,report.uvIndexBand,report.uvIndexIconText,report.uvIndexText,report.weatherType,report.weatherTypeText,report.windDescription,report.windDirection,report.windDirectionAbbreviation,report.windDirectionFull,report.windSpeedKph,report.windSpeedMph,location_id,location_name
2024-10-03T22:45:00+01:00,2024-10-04T09:00:05.741+01:00,Sunny intervals and a gentle breeze,35,22,2024-10-04,,,,,14,57,11,51,15,59,9,49,,,,,2.0,LOW,L,Low,38,Chance of precipitation,07:23,18:39,,,,,2,LOW,L,Low,3,Sunny Intervals,A gentle breeze from the south,S,S,Southerly,18,11,2650225,Edinburgh
2024-10-03T22:45:00+01:00,2024-10-04T09:00:05.741+01:00,Sunny intervals and a gentle breeze,29,18,2024-10-05,,,,,15,59,9,47,17,62,8,46,,,,,3.0,LOW,L,Low,15,Low chance of precipitation,07:25,18:36,,,,,3,MODERATE,M,Moderate,3,Sunny Intervals,A gentle breeze from the south,S,S,Southerly,15,9,2650225,Edinburgh
2024-10-03T22:45:00+01:00,2024-10-04T09:00:05.741+01:00,Light rain and a gentle breeze,30,19,2024-10-06,,,,,14,57,9,47,15,59,7,45,,,,,2.0,LOW,L,Low,62,Chance of precipitation,07:27,18:33,,,,,1,LOW,L,Low,12,Light Rain,A gentle breeze from the south east,SE,SE,South Easterly,14,9,2650225,Edinburgh
2024-10-03T22:45:00+01:00,2024-10-04T09:00:05.741+01:00,Light rain showers and a gentle breeze,27,17,2024-10-07,,,,,14,58,8,46,15,59,6,43,,,,,2.0,LOW,L,Low,34,Chance of precipitation,07:29,18:31,,,,,2,LOW,L,Low,10,Light Rain Showers,A gentle breeze from the south west,SW,SW,South Westerly,13,8,2650225,Edinburgh
2024-10-03T22:45:00+01:00,2024-10-04T09:00:05.741+01:00,Light rain and a gentle breeze,21,13,2024-10-08,,,,,14,57,9,48,15,58,8,46,,,,,2.0,LOW,L,Low,66,Chance of precipitation,07:31,18:28,,,,,2,LOW,L,Low,12,Light Rain,A gentle breeze from the north east,NE,NE,North Easterly,13,8,2650225,Edinburgh
2024-10-03T22:45:00+01:00,2024-10-04T09:00:05.741+01:00,Light rain and a moderate breeze,45,28,2024-10-09,,,,,12,53,7,45,14,57,5,42,,,,,,,,,70,Chance of precipitation,07:33,18:26,,,,,2,LOW,L,Low,12,Light Rain,A moderate breeze from the north east,NE,NE,North Easterly,21,13,2650225,Edinburgh
2024-10-03T22:45:00+01:00,2024-10-04T09:00:05.741+01:00,Light rain and a moderate breeze,60,37,2024-10-10,,,,,9,49,5,41,11,52,2,36,,,,,,,,,70,Chance of precipitation,07:35,18:23,,,,,1,LOW,L,Low,12,Light Rain,A moderate breeze from the north east,NE,NE,North Easterly,29,18,2650225,Edinburgh
2024-10-03T22:45:00+01:00,2024-10-04T09:00:05.741+01:00,Drizzle and a moderate breeze,54,34,2024-10-11,,,,,9,48,3,38,11,51,1,33,,,,,,,,,54,Chance of precipitation,07:37,18:21,,,,,3,MODERATE,M,Moderate,11,Drizzle,A moderate breeze from the north,N,N,Northerly,23,14,2650225,Edinburgh
2024-10-04T09:00:05+01:00,2024-10-04T09:00:05.741+01:00,Sunny intervals and a moderate breeze,34,21,2024-10-12,,,,,10,50,3,37,12,53,0,33,,,,,,,,,42,Chance of precipitation,07:39,18:18,,,,,2,LOW,L,Low,3,Sunny Intervals,A moderate breeze from the north west,NW,NW,North Westerly,21,13,2650225,Edinburgh
2024-10-04T09:00:05+01:00,2024-10-04T09:00:05.741+01:00,Sunny and a gentle breeze,18,11,2024-10-13,,,,,9,49,2,36,12,53,-1,31,,,,,,,,,41,Chance of precipitation,07:41,18:16,,,,,3,MODERATE,M,Moderate,1,Sunny,A gentle breeze from the north,N,N,Northerly,16,10,2650225,Edinburgh
2024-10-04T09:00:05+01:00,2024-10-04T09:00:05.741+01:00,Sunny and light winds,18,11,2024-10-14,,,,,10,50,3,37,13,55,0,32,,,,,,,,,30,Low chance of precipitation,07:43,18:13,,,,,3,MODERATE,M,Moderate,1,Sunny,Light winds from the east,E,E,Easterly,12,7,2650225,Edinburgh
2024-10-04T09:00:05+01:00,2024-10-04T09:00:05.741+01:00,Sunny intervals and light winds,24,15,2024-10-15,,,,,11,51,6,42,14,57,3,37,,,,,,,,,27,Low chance of precipitation,07:45,18:11,,,,,3,MODERATE,M,Moderate,3,Sunny Intervals,Light winds from the north east,NE,NE,North Easterly,10,6,2650225,Edinburgh
2024-10-04T09:00:05+01:00,2024-10-04T09:00:05.741+01:00,Light rain and light winds,27,17,2024-10-16,,,,,11,51,6,43,14,58,2,36,,,,,,,,,48,Chance of precipitation,07:47,18:08,,,,,2,LOW,L,Low,12,Light Rain,Light winds from the north east,NE,NE,North Easterly,10,6,2650225,Edinburgh
2024-10-04T09:00:05+01:00,2024-10-04T09:00:05.741+01:00,Light rain and light winds,15,9,2024-10-17,,,,,10,51,7,44,14,58,3,37,,,,,,,,,50,Chance of precipitation,07:49,18:06,,,,,1,LOW,L,Low,12,Light Rain,Light winds from the north east,NE,NE,North Easterly,10,6,2650225,Edinburgh
