issueDate,lastUpdated,report.enhancedWeatherDescription,report.gustSpeedKph,report.gustSpeedMph,report.localDate,report.lowermaxTemperatureC,report.lowermaxTemperatureF,report.lowerminTemperatureC,report.lowerminTemperatureF,report.maxTempC,report.maxTempF,report.minTempC,report.minTempF,report.mostLikelyHighTemperatureC,report.mostLikelyHighTemperatureF,report.mostLikelyLowTemperatureC,report.mostLikelyLowTemperatureF,report.pollenIndex,report.pollenIndexBand,report.pollenIndexIconText,report.pollenIndexText,report.pollutionIndex,report.pollutionIndexBand,report.pollutionIndexIconText,report.pollutionIndexText,report.precipitationProbabilityInPercent,report.precipitationProbabilityText,report.sunrise,report.sunset,report.uppermaxTemperatureC,report.uppermaxTemperatureF,report.upperminTemperatureC,report.upperminTemperatureF,report.uvIndex,report.uvIndexBand,report.uvIndexIconText,report.uvIndexText,report.weatherType,report.weatherTypeText,report.windDescription,report.windDirection,report.windDirectionAbbreviation,report.windDirectionFull,report.windSpeedKph,report.windSpeedMph,location_id,location_name
2023-04-03T22:55:00+01:00,2023-04-04T01:00:52.938+01:00,A clear sky and light winds,12,8,2023-04-03,,,,,12,53,2,36,13,55,0,33,1.0,LOW,L,Low,3.0,LOW,L,Low,0,Precipitation is not expected,06:39,19:54,,,,,0,LOW,L,Low,0,Clear Sky,Light winds from the south,S,S,Southerly,7,4,2650225,Edinburgh
2023-04-03T22:55:00+01:00,2023-04-04T01:00:52.938+01:00,Sunny intervals and a gentle breeze,34,21,2023-04-04,,,,,12,53,5,41,13,55,4,39,1.0,LOW,L,Low,3.0,LOW,L,Low,0,Precipitation is not expected,06:37,19:56,,,,,3,MODERATE,M,Moderate,3,Sunny Intervals,A gentle breeze from the south west,SW,SW,South Westerly,19,12,2650225,Edinburgh
2023-04-03T22:55:00+01:00,2023-04-04T01:00:52.938+01:00,Light rain and a gentle breeze,32,20,2023-04-05,,,,,11,51,6,43,12,53,5,41,1.0,LOW,L,Low,3.0,LOW,L,Low,70,Chance of precipitation,06:34,19:58,,,,,1,LOW,L,Low,12,Light Rain,A gentle breeze from the south,S,S,Southerly,14,9,2650225,Edinburgh
2023-04-03T22:55:00+01:00,2023-04-04T01:00:52.938+01:00,Light rain showers and a moderate breeze,42,26,2023-04-06,,,,,10,51,2,36,13,55,0,32,1.0,LOW,L,Low,3.0,LOW,L,Low,68,Chance of precipitation,06:31,20:00,,,,,3,MODERATE,M,Moderate,10,Light Rain Showers,A moderate breeze from the west,W,W,Westerly,22,14,2650225,Edinburgh
2023-04-03T22:55:00+01:00,2023-04-04T01:00:52.938+01:00,Sunny intervals and light winds,16,10,2023-04-07,,,,,10,51,1,34,13,55,-2,28,1.0,LOW,L,Low,3.0,LOW,L,Low,10,Low chance of precipitation,06:29,20:02,,,,,4,MODERATE,M,Moderate,3,Sunny Intervals,Light winds from the north east,NE,NE,North Easterly,10,6,2650225,Edinburgh
2023-04-03T22:55:00+01:00,2023-04-04T01:00:52.938+01:00,Sunny and a gentle breeze,23,15,2023-04-08,,,,,13,55,4,38,15,58,2,35,,,,,,,,,0,Precipitation is not expected,06:26,20:04,,,,,4,MODERATE,M,Moderate,1,Sunny,A gentle breeze from the south east,SE,SE,South Easterly,14,9,2650225,Edinburgh
2023-04-03T22:55:00+01:00,2023-04-04T01:00:52.938+01:00,Sunny intervals and a gentle breeze,35,22,2023-04-09,,,,,13,55,7,45,15,59,5,41,,,,,,,,,24,Low chance of precipitation,06:24,20:06,,,,,3,MODERATE,M,Moderate,3,Sunny Intervals,A gentle breeze from the south east,SE,SE,South Easterly,13,8,2650225,Edinburgh
2023-04-03T22:55:00+01:00,2023-04-04T01:00:52.938+01:00,Light rain and a gentle breeze,41,25,2023-04-10,,,,,12,54,5,40,13,56,4,39,,,,,,,,,70,Chance of precipitation,06:21,20:08,,,,,3,MODERATE,M,Moderate,12,Light Rain,A gentle breeze from the south west,SW,SW,South Westerly,19,12,2650225,Edinburgh
2023-04-04T01:00:52+01:00,2023-04-04T01:00:52.938+01:00,Drizzle and a gentle breeze,36,22,2023-04-11,,,,,12,54,4,40,14,57,3,38,,,,,,,,,36,Chance of precipitation,06:19,20:11,,,,,4,MODERATE,M,Moderate,11,Drizzle,A gentle breeze from the south west,SW,SW,South Westerly,18,11,2650225,Edinburgh
2023-04-04T01:00:52+01:00,2023-04-04T01:00:52.938+01:00,Light rain showers and a gentle breeze,33,20,2023-04-12,,,,,12,54,4,39,14,57,2,35,,,,,,,,,57,Chance of precipitation,06:16,20:13,,,,,2,LOW,L,Low,10,Light Rain Showers,A gentle breeze from the south west,SW,SW,South Westerly,16,10,2650225,Edinburgh
2023-04-04T01:00:52+01:00,2023-04-04T01:00:52.938+01:00,Light rain showers and a gentle breeze,42,26,2023-04-13,,,,,11,51,5,42,13,55,3,37,,,,,,,,,31,Chance of precipitation,06:13,20:15,,,,,3,MODERATE,M,Moderate,10,Light Rain Showers,A gentle breeze from the east,E,E,Easterly,15,9,2650225,Edinburgh
2023-04-04T01:00:52+01:00,2023-04-04T01:00:52.938+01:00,Light rain and a gentle breeze,49,30,2023-04-14,,,,,11,51,5,41,13,56,2,35,,,,,,,,,70,Chance of precipitation,06:11,20:17,,,,,2,LOW,L,Low,12,Light Rain,A gentle breeze from the east,E,E,Easterly,15,9,2650225,Edinburgh
2023-04-04T01:00:52+01:00,2023-04-04T01:00:52.938+01:00,Light rain and light winds,40,25,2023-04-15,,,,,12,53,4,38,16,60,0,31,,,,,,,,,47,Chance of precipitation,06:08,20:19,,,,,4,MODERATE,M,Moderate,12,Light Rain,Light winds from the east,E,E,Easterly,12,7,2650225,Edinburgh
2023-04-04T01:00:52+01:00,2023-04-04T01:00:52.938+01:00,Light rain and a gentle breeze,33,21,2023-04-16,,,,,13,54,4,40,17,62,0,31,,,,,,,,,50,Chance of precipitation,06:06,20:21,,,,,4,MODERATE,M,Moderate,12,Light Rain,A gentle breeze from the east,E,E,Easterly,13,8,2650225,Edinburgh
