issueDate,lastUpdated,report.enhancedWeatherDescription,report.gustSpeedKph,report.gustSpeedMph,report.localDate,report.lowermaxTemperatureC,report.lowermaxTemperatureF,report.lowerminTemperatureC,report.lowerminTemperatureF,report.maxTempC,report.maxTempF,report.minTempC,report.minTempF,report.mostLikelyHighTemperatureC,report.mostLikelyHighTemperatureF,report.mostLikelyLowTemperatureC,report.mostLikelyLowTemperatureF,report.pollenIndex,report.pollenIndexBand,report.pollenIndexIconText,report.pollenIndexText,report.pollutionIndex,report.pollutionIndexBand,report.pollutionIndexIconText,report.pollutionIndexText,report.precipitationProbabilityInPercent,report.precipitationProbabilityText,report.sunrise,report.sunset,report.uppermaxTemperatureC,report.uppermaxTemperatureF,report.upperminTemperatureC,report.upperminTemperatureF,report.uvIndex,report.uvIndexBand,report.uvIndexIconText,report.uvIndexText,report.weatherType,report.weatherTypeText,report.windDescription,report.windDirection,report.windDirectionAbbreviation,report.windDirectionFull,report.windSpeedKph,report.windSpeedMph,location_id,location_name
2024-07-29T22:41:00+01:00,2024-07-30T01:01:37.396+01:00,Partly cloudy and a gentle breeze,28,18,2024-07-29,,,,,20,67,14,57,21,69,12,54,4.0,MODERATE,M,Moderate,2.0,LOW,L,Low,0,Precipitation is not expected,05:13,21:25,,,,,0,LOW,L,Low,2,Partly Cloudy,A gentle breeze from the south west,SW,SW,South Westerly,14,9,2650225,Edinburgh
2024-07-29T22:41:00+01:00,2024-07-30T01:01:37.396+01:00,Sunny intervals and a moderate breeze,36,22,2024-07-30,,,,,20,67,7,45,21,69,6,43,4.0,MODERATE,M,Moderate,2.0,LOW,L,Low,0,Precipitation is not expected,05:14,21:23,,,,,6,HIGH,H,High,3,Sunny Intervals,A moderate breeze from the west,W,W,Westerly,22,14,2650225,Edinburgh
2024-07-29T22:41:00+01:00,2024-07-30T01:01:37.396+01:00,Sunny and light winds,19,12,2024-07-31,,,,,19,67,11,52,20,69,10,50,4.0,MODERATE,M,Moderate,3.0,LOW,L,Low,0,Precipitation is not expected,05:16,21:21,,,,,6,HIGH,H,High,1,Sunny,Light winds from the north east,NE,NE,North Easterly,9,6,2650225,Edinburgh
2024-07-29T22:41:00+01:00,2024-07-30T01:01:37.396+01:00,Sunny intervals and light winds,22,14,2024-08-01,,,,,22,71,13,55,23,73,11,53,4.0,MODERATE,M,Moderate,3.0,LOW,L,Low,22,Low chance of precipitation,05:18,21:19,,,,,5,MODERATE,M,Moderate,3,Sunny Intervals,Light winds from the west,W,W,Westerly,12,7,2650225,Edinburgh
2024-07-29T22:41:00+01:00,2024-07-30T01:01:37.396+01:00,Light rain and a moderate breeze,44,27,2024-08-02,,,,,21,70,12,53,22,72,10,51,4.0,MODERATE,M,Moderate,2.0,LOW,L,Low,61,Chance of precipitation,05:20,21:17,,,,,4,MODERATE,M,Moderate,12,Light Rain,A moderate breeze from the south,S,S,Southerly,24,15,2650225,Edinburgh
2024-07-29T22:41:00+01:00,2024-07-30T01:01:37.396+01:00,Sunny intervals and a moderate breeze,37,23,2024-08-03,,,,,18,65,10,50,19,66,9,48,,,,,,,,,24,Low chance of precipitation,05:22,21:15,,,,,5,MODERATE,M,Moderate,3,Sunny Intervals,A moderate breeze from the south west,SW,SW,South Westerly,22,14,2650225,Edinburgh
2024-07-29T22:41:00+01:00,2024-07-30T01:01:37.396+01:00,Light rain and a gentle breeze,33,21,2024-08-04,,,,,17,63,13,55,19,66,11,52,,,,,,,,,69,Chance of precipitation,05:24,21:13,,,,,2,LOW,L,Low,12,Light Rain,A gentle breeze from the south west,SW,SW,South Westerly,17,11,2650225,Edinburgh
2024-07-29T22:41:00+01:00,2024-07-30T01:01:37.396+01:00,Light rain and a moderate breeze,48,30,2024-08-05,,,,,19,66,11,53,20,68,9,48,,,,,,,,,70,Chance of precipitation,05:26,21:11,,,,,3,MODERATE,M,Moderate,12,Light Rain,A moderate breeze from the south west,SW,SW,South Westerly,23,14,2650225,Edinburgh
2024-07-30T01:01:37+01:00,2024-07-30T01:01:37.396+01:00,Light rain showers and a moderate breeze,49,30,2024-08-06,,,,,17,63,9,49,20,67,7,45,,,,,,,,,53,Chance of precipitation,05:28,21:08,,,,,4,MODERATE,M,Moderate,10,Light Rain Showers,A moderate breeze from the south west,SW,SW,South Westerly,21,13,2650225,Edinburgh
2024-07-30T01:01:37+01:00,2024-07-30T01:01:37.396+01:00,Light cloud and a moderate breeze,44,27,2024-08-07,,,,,17,63,11,51,19,67,9,48,,,,,,,,,47,Chance of precipitation,05:30,21:06,,,,,2,LOW,L,Low,7,Light Cloud,A moderate breeze from the west,W,W,Westerly,22,14,2650225,Edinburgh
2024-07-30T01:01:37+01:00,2024-07-30T01:01:37.396+01:00,Drizzle and a moderate breeze,57,35,2024-08-08,,,,,18,64,10,50,20,68,8,46,,,,,,,,,51,Chance of precipitation,05:31,21:04,,,,,2,LOW,L,Low,11,Drizzle,A moderate breeze from the south west,SW,SW,South Westerly,23,14,2650225,Edinburgh
2024-07-30T01:01:37+01:00,2024-07-30T01:01:37.396+01:00,Sunny intervals and a moderate breeze,40,25,2024-08-09,,,,,18,64,9,49,20,69,7,44,,,,,,,,,11,Low chance of precipitation,05:33,21:02,,,,,4,MODERATE,M,Moderate,3,Sunny Intervals,A moderate breeze from the west,W,W,Westerly,21,13,2650225,Edinburgh
