issueDate,lastUpdated,report.enhancedWeatherDescription,report.gustSpeedKph,report.gustSpeedMph,report.localDate,report.lowermaxTemperatureC,report.lowermaxTemperatureF,report.lowerminTemperatureC,report.lowerminTemperatureF,report.maxTempC,report.maxTempF,report.minTempC,report.minTempF,report.mostLikelyHighTemperatureC,report.mostLikelyHighTemperatureF,report.mostLikelyLowTemperatureC,report.mostLikelyLowTemperatureF,report.pollenIndex,report.pollenIndexBand,report.pollenIndexIconText,report.pollenIndexText,report.pollutionIndex,report.pollutionIndexBand,report.pollutionIndexIconText,report.pollutionIndexText,report.precipitationProbabilityInPercent,report.precipitationProbabilityText,report.sunrise,report.sunset,report.uppermaxTemperatureC,report.uppermaxTemperatureF,report.upperminTemperatureC,report.upperminTemperatureF,report.uvIndex,report.uvIndexBand,report.uvIndexIconText,report.uvIndexText,report.weatherType,report.weatherTypeText,report.windDescription,report.windDirection,report.windDirectionAbbreviation,report.windDirectionFull,report.windSpeedKph,report.windSpeedMph,location_id,location_name
2023-12-13T09:50:00+00:00,2023-12-13T16:00:25.35Z,Sunny intervals and light winds,11,7,2023-12-13,,,,,4,40,1,35,5,42,1,33,,,,,2.0,LOW,L,Low,16,Low chance of precipitation,08:35,15:38,,,,,0,LOW,L,Low,3,Sunny Intervals,Light winds from the north east,NE,NE,North Easterly,6,4,2650225,Edinburgh
2023-12-13T09:50:00+00:00,2023-12-13T16:00:25.35Z,Sunny intervals and a moderate breeze,41,25,2023-12-14,,,,,8,47,4,39,9,48,3,38,,,,,2.0,LOW,L,Low,0,Precipitation is not expected,08:36,15:38,,,,,1,LOW,L,Low,3,Sunny Intervals,A moderate breeze from the south west,SW,SW,South Westerly,22,14,2650225,Edinburgh
2023-12-13T09:50:00+00:00,2023-12-13T16:00:25.35Z,Light cloud and a moderate breeze,53,33,2023-12-15,,,,,11,51,9,49,11,52,9,47,,,,,2.0,LOW,L,Low,23,Low chance of precipitation,08:37,15:38,,,,,1,LOW,L,Low,7,Light Cloud,A moderate breeze from the south west,SW,SW,South Westerly,29,18,2650225,Edinburgh
2023-12-13T09:50:00+00:00,2023-12-13T16:00:25.35Z,Gusty winds and light cloud,70,43,2023-12-16,,,,,12,53,9,49,13,55,9,48,,,,,2.0,LOW,L,Low,22,Low chance of precipitation,08:38,15:38,,,,,1,LOW,L,Low,7,Light Cloud,Gusty winds from the south west,SW,SW,South Westerly,32,20,2650225,Edinburgh
2023-12-13T09:50:00+00:00,2023-12-13T16:00:25.35Z,Gusty winds and rain,72,45,2023-12-17,,,,,12,53,9,47,13,55,7,44,,,,,2.0,LOW,L,Low,56,Chance of precipitation,08:39,15:38,,,,,1,LOW,L,Low,12,Light Rain,Gusty winds from the south west,SW,SW,South Westerly,30,19,2650225,Edinburgh
2023-12-13T09:50:00+00:00,2023-12-13T16:00:25.35Z,Gusty winds and rain,70,43,2023-12-18,,,,,11,53,4,39,13,56,3,38,,,,,,,,,57,Chance of precipitation,08:40,15:38,,,,,1,LOW,L,Low,12,Light Rain,Gusty winds from the south west,SW,SW,South Westerly,30,19,2650225,Edinburgh
2023-12-13T09:50:00+00:00,2023-12-13T16:00:25.35Z,Gusty winds and drizzle,78,48,2023-12-19,,,,,7,45,3,38,8,47,1,35,,,,,,,,,49,Chance of precipitation,08:41,15:39,,,,,1,LOW,L,Low,11,Drizzle,Gusty winds from the west,W,W,Westerly,31,19,2650225,Edinburgh
2023-12-13T09:50:00+00:00,2023-12-13T16:00:25.35Z,Gusty winds and rain,72,45,2023-12-20,,,,,7,45,3,38,10,50,1,33,,,,,,,,,39,Chance of precipitation,08:41,15:39,,,,,1,LOW,L,Low,12,Light Rain,Gusty winds from the west,W,W,Westerly,29,18,2650225,Edinburgh
2023-12-13T16:00:25+00:00,2023-12-13T16:00:25.35Z,Gusty winds and rain,71,44,2023-12-21,,,,,7,45,3,37,10,50,-1,31,,,,,,,,,49,Chance of precipitation,08:42,15:40,,,,,1,LOW,L,Low,12,Light Rain,Gusty winds from the west,W,W,Westerly,28,17,2650225,Edinburgh
2023-12-13T16:00:25+00:00,2023-12-13T16:00:25.35Z,Gusty winds and light rain,64,40,2023-12-22,,,,,5,42,1,34,9,47,-2,28,,,,,,,,,71,High chance of precipitation,08:42,15:40,,,,,1,LOW,L,Low,12,Light Rain,Gusty winds from the west,W,W,Westerly,26,16,2650225,Edinburgh
2023-12-13T16:00:25+00:00,2023-12-13T16:00:25.35Z,Sunny and a gentle breeze,31,19,2023-12-23,,,,,4,39,-1,29,8,46,-5,23,,,,,,,,,65,Chance of precipitation,08:43,15:41,,,,,1,LOW,L,Low,1,Sunny,A gentle breeze from the west,W,W,Westerly,18,11,2650225,Edinburgh
2023-12-13T16:00:25+00:00,2023-12-13T16:00:25.35Z,Sunny and light winds,13,8,2023-12-24,,,,,4,39,-2,29,8,47,-6,21,,,,,,,,,0,Precipitation is not expected,08:43,15:41,,,,,1,LOW,L,Low,1,Sunny,Light winds from the south west,SW,SW,South Westerly,12,7,2650225,Edinburgh
2023-12-13T16:00:25+00:00,2023-12-13T16:00:25.35Z,Sunny intervals and light winds,16,10,2023-12-25,,,,,3,38,-2,29,8,46,-6,21,,,,,,,,,17,Low chance of precipitation,08:44,15:42,,,,,1,LOW,L,Low,3,Sunny Intervals,Light winds from the west,W,W,Westerly,12,7,2650225,Edinburgh
2023-12-13T16:00:25+00:00,2023-12-13T16:00:25.35Z,Sleet showers and light winds,14,9,2023-12-26,,,,,4,39,-2,29,9,47,-7,19,,,,,,,,,70,Chance of precipitation,08:44,15:43,,,,,1,LOW,L,Low,17,Sleet Showers,Light winds from the south west,SW,SW,South Westerly,10,6,2650225,Edinburgh
