issueDate,lastUpdated,report.enhancedWeatherDescription,report.gustSpeedKph,report.gustSpeedMph,report.localDate,report.lowermaxTemperatureC,report.lowermaxTemperatureF,report.lowerminTemperatureC,report.lowerminTemperatureF,report.maxTempC,report.maxTempF,report.minTempC,report.minTempF,report.mostLikelyHighTemperatureC,report.mostLikelyHighTemperatureF,report.mostLikelyLowTemperatureC,report.mostLikelyLowTemperatureF,report.pollenIndex,report.pollenIndexBand,report.pollenIndexIconText,report.pollenIndexText,report.pollutionIndex,report.pollutionIndexBand,report.pollutionIndexIconText,report.pollutionIndexText,report.precipitationProbabilityInPercent,report.precipitationProbabilityText,report.sunrise,report.sunset,report.uppermaxTemperatureC,report.uppermaxTemperatureF,report.upperminTemperatureC,report.upperminTemperatureF,report.uvIndex,report.uvIndexBand,report.uvIndexIconText,report.uvIndexText,report.weatherType,report.weatherTypeText,report.windDescription,report.windDirection,report.windDirectionAbbreviation,report.windDirectionFull,report.windSpeedKph,report.windSpeedMph,location_id,location_name
2023-11-10T21:54:00+00:00,2023-11-11T08:00:24.557Z,Sunny and light winds,15,9,2023-11-11,,,,,8,46,0,32,11,51,-2,28,,,,,1.0,LOW,L,Low,0,Precipitation is not expected,07:40,16:13,,,,,2,LOW,L,Low,1,Sunny,Light winds from the west,W,W,Westerly,8,5,2650225,Edinburgh
2023-11-10T21:54:00+00:00,2023-11-11T08:00:24.557Z,Sunny intervals and a gentle breeze,30,19,2023-11-12,,,,,7,45,4,39,9,48,3,38,,,,,2.0,LOW,L,Low,18,Low chance of precipitation,07:42,16:11,,,,,2,LOW,L,Low,3,Sunny Intervals,A gentle breeze from the east,E,E,Easterly,13,8,2650225,Edinburgh
2023-11-10T21:54:00+00:00,2023-11-11T08:00:24.557Z,Light rain and light winds,29,18,2023-11-13,,,,,8,47,5,40,10,49,4,39,,,,,2.0,LOW,L,Low,70,Chance of precipitation,07:44,16:09,,,,,1,LOW,L,Low,12,Light Rain,Light winds from the east,E,E,Easterly,11,7,2650225,Edinburgh
2023-11-10T21:54:00+00:00,2023-11-11T08:00:24.557Z,Light rain and light winds,28,17,2023-11-14,,,,,10,50,6,43,11,52,5,41,,,,,1.0,LOW,L,Low,53,Chance of precipitation,07:46,16:07,,,,,1,LOW,L,Low,12,Light Rain,Light winds from the south,S,S,Southerly,11,7,2650225,Edinburgh
2023-11-10T21:54:00+00:00,2023-11-11T08:00:24.557Z,Drizzle and a gentle breeze,45,28,2023-11-15,,,,,10,50,4,39,11,51,3,37,,,,,2.0,LOW,L,Low,34,Chance of precipitation,07:48,16:06,,,,,2,LOW,L,Low,11,Drizzle,A gentle breeze from the south west,SW,SW,South Westerly,19,12,2650225,Edinburgh
2023-11-10T21:54:00+00:00,2023-11-11T08:00:24.557Z,Light rain and a gentle breeze,30,19,2023-11-16,,,,,8,47,2,36,9,49,0,32,,,,,,,,,55,Chance of precipitation,07:50,16:04,,,,,1,LOW,L,Low,12,Light Rain,A gentle breeze from the west,W,W,Westerly,16,10,2650225,Edinburgh
2023-11-10T21:54:00+00:00,2023-11-11T08:00:24.557Z,Sunny and a gentle breeze,19,12,2023-11-17,,,,,8,46,2,36,10,50,-2,29,,,,,,,,,16,Low chance of precipitation,07:52,16:02,,,,,1,LOW,L,Low,1,Sunny,A gentle breeze from the west,W,W,Westerly,15,9,2650225,Edinburgh
2023-11-10T21:54:00+00:00,2023-11-11T08:00:24.557Z,Light rain and a gentle breeze,48,30,2023-11-18,,,,,8,47,7,44,12,54,5,41,,,,,,,,,52,Chance of precipitation,07:54,16:01,,,,,1,LOW,L,Low,12,Light Rain,A gentle breeze from the south,S,S,Southerly,19,12,2650225,Edinburgh
2023-11-11T08:00:24+00:00,2023-11-11T08:00:24.557Z,Light rain and a moderate breeze,48,30,2023-11-19,,,,,10,51,5,41,13,56,2,36,,,,,,,,,67,Chance of precipitation,07:56,15:59,,,,,1,LOW,L,Low,12,Light Rain,A moderate breeze from the south west,SW,SW,South Westerly,23,14,2650225,Edinburgh
2023-11-11T08:00:24+00:00,2023-11-11T08:00:24.557Z,Light rain showers and a moderate breeze,44,27,2023-11-20,,,,,10,50,6,43,14,58,1,34,,,,,,,,,37,Chance of precipitation,07:58,15:58,,,,,1,LOW,L,Low,10,Light Rain Showers,A moderate breeze from the south west,SW,SW,South Westerly,24,15,2650225,Edinburgh
2023-11-11T08:00:24+00:00,2023-11-11T08:00:24.557Z,Drizzle and a moderate breeze,59,37,2023-11-21,,,,,9,49,5,42,14,58,0,32,,,,,,,,,34,Chance of precipitation,08:00,15:56,,,,,1,LOW,L,Low,11,Drizzle,A moderate breeze from the west,W,W,Westerly,23,15,2650225,Edinburgh
2023-11-11T08:00:24+00:00,2023-11-11T08:00:24.557Z,Light rain and a moderate breeze,55,34,2023-11-22,,,,,9,49,5,40,15,59,-1,29,,,,,,,,,42,Chance of precipitation,08:02,15:55,,,,,1,LOW,L,Low,12,Light Rain,A moderate breeze from the west,W,W,Westerly,22,14,2650225,Edinburgh
2023-11-11T08:00:24+00:00,2023-11-11T08:00:24.557Z,Sunny and a gentle breeze,42,26,2023-11-23,,,,,9,49,4,38,16,60,-3,27,,,,,,,,,17,Low chance of precipitation,08:04,15:53,,,,,1,LOW,L,Low,1,Sunny,A gentle breeze from the west,W,W,Westerly,19,12,2650225,Edinburgh
2023-11-11T08:00:24+00:00,2023-11-11T08:00:24.557Z,Sunny and a gentle breeze,28,17,2023-11-24,,,,,9,49,4,40,16,61,-3,27,,,,,,,,,0,Precipitation is not expected,08:06,15:52,,,,,1,LOW,L,Low,1,Sunny,A gentle breeze from the south west,SW,SW,South Westerly,17,11,2650225,Edinburgh
