issueDate,lastUpdated,report.enhancedWeatherDescription,report.gustSpeedKph,report.gustSpeedMph,report.localDate,report.lowermaxTemperatureC,report.lowermaxTemperatureF,report.lowerminTemperatureC,report.lowerminTemperatureF,report.maxTempC,report.maxTempF,report.minTempC,report.minTempF,report.mostLikelyHighTemperatureC,report.mostLikelyHighTemperatureF,report.mostLikelyLowTemperatureC,report.mostLikelyLowTemperatureF,report.pollenIndex,report.pollenIndexBand,report.pollenIndexIconText,report.pollenIndexText,report.pollutionIndex,report.pollutionIndexBand,report.pollutionIndexIconText,report.pollutionIndexText,report.precipitationProbabilityInPercent,report.precipitationProbabilityText,report.sunrise,report.sunset,report.uppermaxTemperatureC,report.uppermaxTemperatureF,report.upperminTemperatureC,report.upperminTemperatureF,report.uvIndex,report.uvIndexBand,report.uvIndexIconText,report.uvIndexText,report.weatherType,report.weatherTypeText,report.windDescription,report.windDirection,report.windDirectionAbbreviation,report.windDirectionFull,report.windSpeedKph,report.windSpeedMph,location_id,location_name
2024-09-19T10:46:00+01:00,2024-09-19T17:00:19.068+01:00,Sunny and light winds,22,14,2024-09-19,,,,,15,59,8,46,17,63,6,43,,,,,2.0,LOW,L,Low,0,Precipitation is not expected,06:53,19:18,,,,,4,MODERATE,M,Moderate,1,Sunny,Light winds from the north east,NE,NE,North Easterly,11,7,2650225,Edinburgh
2024-09-19T10:46:00+01:00,2024-09-19T17:00:19.068+01:00,Light cloud and a gentle breeze,30,19,2024-09-20,,,,,16,60,11,53,17,62,11,51,,,,,3.0,LOW,L,Low,39,Chance of precipitation,06:55,19:15,,,,,2,LOW,L,Low,7,Light Cloud,A gentle breeze from the north east,NE,NE,North Easterly,17,11,2650225,Edinburgh
2024-09-19T10:46:00+01:00,2024-09-19T17:00:19.068+01:00,Drizzle and a moderate breeze,33,20,2024-09-21,,,,,15,59,11,52,16,60,10,50,,,,,2.0,LOW,L,Low,76,High chance of precipitation,06:57,19:13,,,,,2,LOW,L,Low,11,Drizzle,A moderate breeze from the north east,NE,NE,North Easterly,21,13,2650225,Edinburgh
2024-09-19T10:46:00+01:00,2024-09-19T17:00:19.068+01:00,Light cloud and a gentle breeze,31,19,2024-09-22,,,,,14,57,9,49,15,59,8,47,,,,,3.0,LOW,L,Low,56,Chance of precipitation,06:59,19:10,,,,,2,LOW,L,Low,7,Light Cloud,A gentle breeze from the north east,NE,NE,North Easterly,19,12,2650225,Edinburgh
2024-09-19T10:46:00+01:00,2024-09-19T17:00:19.068+01:00,Light cloud and light winds,18,11,2024-09-23,,,,,14,57,7,45,16,61,5,41,,,,,3.0,LOW,L,Low,31,Chance of precipitation,07:01,19:08,,,,,2,LOW,L,Low,7,Light Cloud,Light winds from the north east,NE,NE,North Easterly,11,7,2650225,Edinburgh
2024-09-19T10:46:00+01:00,2024-09-19T17:00:19.068+01:00,Light rain and light winds,19,12,2024-09-24,,,,,12,53,5,40,14,57,1,35,,,,,,,,,70,Chance of precipitation,07:03,19:05,,,,,2,LOW,L,Low,12,Light Rain,Light winds from the north,N,N,Northerly,9,6,2650225,Edinburgh
2024-09-19T10:46:00+01:00,2024-09-19T17:00:19.068+01:00,Light rain and a gentle breeze,18,11,2024-09-25,,,,,12,53,6,43,13,55,4,39,,,,,,,,,37,Chance of precipitation,07:05,19:02,,,,,3,MODERATE,M,Moderate,12,Light Rain,A gentle breeze from the north east,NE,NE,North Easterly,14,9,2650225,Edinburgh
2024-09-19T10:46:00+01:00,2024-09-19T17:00:19.068+01:00,Light rain and a gentle breeze,34,21,2024-09-26,,,,,11,51,5,42,12,54,3,38,,,,,,,,,70,Chance of precipitation,07:07,19:00,,,,,2,LOW,L,Low,12,Light Rain,A gentle breeze from the north,N,N,Northerly,18,11,2650225,Edinburgh
2024-09-19T17:00:19+01:00,2024-09-19T17:00:19.068+01:00,Light rain showers and a moderate breeze,42,26,2024-09-27,,,,,12,53,4,40,14,57,2,36,,,,,,,,,52,Chance of precipitation,07:09,18:57,,,,,3,MODERATE,M,Moderate,10,Light Rain Showers,A moderate breeze from the west,W,W,Westerly,22,14,2650225,Edinburgh
2024-09-19T17:00:19+01:00,2024-09-19T17:00:19.068+01:00,Sunny intervals and a gentle breeze,41,26,2024-09-28,,,,,11,52,5,41,13,56,3,37,,,,,,,,,24,Low chance of precipitation,07:11,18:54,,,,,3,MODERATE,M,Moderate,3,Sunny Intervals,A gentle breeze from the west,W,W,Westerly,20,12,2650225,Edinburgh
2024-09-19T17:00:19+01:00,2024-09-19T17:00:19.068+01:00,Light cloud and a gentle breeze,47,29,2024-09-29,,,,,12,53,7,44,14,58,4,39,,,,,,,,,48,Chance of precipitation,07:13,18:52,,,,,2,LOW,L,Low,7,Light Cloud,A gentle breeze from the south west,SW,SW,South Westerly,18,11,2650225,Edinburgh
2024-09-19T17:00:19+01:00,2024-09-19T17:00:19.068+01:00,Light rain showers and a gentle breeze,43,27,2024-09-30,,,,,12,54,6,42,15,59,2,36,,,,,,,,,70,Chance of precipitation,07:15,18:49,,,,,1,LOW,L,Low,10,Light Rain Showers,A gentle breeze from the south west,SW,SW,South Westerly,17,11,2650225,Edinburgh
2024-09-19T17:00:19+01:00,2024-09-19T17:00:19.068+01:00,Sunny intervals and a gentle breeze,15,9,2024-10-01,,,,,12,54,6,43,15,60,2,36,,,,,,,,,18,Low chance of precipitation,07:17,18:46,,,,,2,LOW,L,Low,3,Sunny Intervals,A gentle breeze from the south west,SW,SW,South Westerly,13,8,2650225,Edinburgh
2024-09-19T17:00:19+01:00,2024-09-19T17:00:19.068+01:00,Light rain and a gentle breeze,29,18,2024-10-02,,,,,13,55,6,43,17,62,2,36,,,,,,,,,66,Chance of precipitation,07:19,18:44,,,,,2,LOW,L,Low,12,Light Rain,A gentle breeze from the south west,SW,SW,South Westerly,18,11,2650225,Edinburgh
