issueDate,lastUpdated,report.enhancedWeatherDescription,report.gustSpeedKph,report.gustSpeedMph,report.localDate,report.lowermaxTemperatureC,report.lowermaxTemperatureF,report.lowerminTemperatureC,report.lowerminTemperatureF,report.maxTempC,report.maxTempF,report.minTempC,report.minTempF,report.mostLikelyHighTemperatureC,report.mostLikelyHighTemperatureF,report.mostLikelyLowTemperatureC,report.mostLikelyLowTemperatureF,report.pollenIndex,report.pollenIndexBand,report.pollenIndexIconText,report.pollenIndexText,report.pollutionIndex,report.pollutionIndexBand,report.pollutionIndexIconText,report.pollutionIndexText,report.precipitationProbabilityInPercent,report.precipitationProbabilityText,report.sunrise,report.sunset,report.uppermaxTemperatureC,report.uppermaxTemperatureF,report.upperminTemperatureC,report.upperminTemperatureF,report.uvIndex,report.uvIndexBand,report.uvIndexIconText,report.uvIndexText,report.weatherType,report.weatherTypeText,report.windDescription,report.windDirection,report.windDirectionAbbreviation,report.windDirectionFull,report.windSpeedKph,report.windSpeedMph,location_id,location_name
2024-12-05T09:45:00+00:00,2024-12-05T16:01:01.425Z,Light rain showers and a moderate breeze,53,33,2024-12-05,,,,,8,47,2,35,9,48,0,33,,,,,2.0,LOW,L,Low,92,Precipitation is expected,08:26,15:40,,,,,0,LOW,L,Low,10,Light Rain Showers,A moderate breeze from the south west,SW,SW,South Westerly,25,15,2650225,Edinburgh
2024-12-05T09:45:00+00:00,2024-12-05T16:01:01.425Z,Light rain and a gentle breeze,36,23,2024-12-06,,,,,7,44,2,36,8,46,1,34,,,,,2.0,LOW,L,Low,70,Chance of precipitation,08:28,15:40,,,,,1,LOW,L,Low,12,Light Rain,A gentle breeze from the south west,SW,SW,South Westerly,16,10,2650225,Edinburgh
2024-12-05T09:45:00+00:00,2024-12-05T16:01:01.425Z,Gusty winds and rain,65,41,2024-12-07,,,,,6,42,3,37,7,44,1,35,,,,,2.0,LOW,L,Low,70,Chance of precipitation,08:29,15:39,,,,,1,LOW,L,Low,12,Light Rain,Gusty winds from the north west,NW,NW,North Westerly,31,19,2650225,Edinburgh
2024-12-05T09:45:00+00:00,2024-12-05T16:01:01.425Z,Sunny intervals and a moderate breeze,59,37,2024-12-08,,,,,6,43,4,38,7,45,2,35,,,,,2.0,LOW,L,Low,22,Low chance of precipitation,08:31,15:39,,,,,1,LOW,L,Low,3,Sunny Intervals,A moderate breeze from the north,N,N,Northerly,24,15,2650225,Edinburgh
2024-12-05T09:45:00+00:00,2024-12-05T16:01:01.425Z,Light cloud and a gentle breeze,39,24,2024-12-09,,,,,6,43,1,33,7,45,-1,29,,,,,2.0,LOW,L,Low,0,Precipitation is not expected,08:32,15:39,,,,,1,LOW,L,Low,7,Light Cloud,A gentle breeze from the north,N,N,Northerly,18,11,2650225,Edinburgh
2024-12-05T09:45:00+00:00,2024-12-05T16:01:01.425Z,Sunny intervals and light winds,16,10,2024-12-10,,,,,4,40,0,32,7,44,-2,29,,,,,,,,,0,Precipitation is not expected,08:33,15:38,,,,,1,LOW,L,Low,3,Sunny Intervals,Light winds from the north west,NW,NW,North Westerly,6,4,2650225,Edinburgh
2024-12-05T09:45:00+00:00,2024-12-05T16:01:01.425Z,Misty and light winds,13,8,2024-12-11,,,,,4,39,1,33,6,43,-1,30,,,,,,,,,0,Precipitation is not expected,08:34,15:38,,,,,1,LOW,L,Low,5,Mist,Light winds from the west,W,W,Westerly,6,4,2650225,Edinburgh
2024-12-05T09:45:00+00:00,2024-12-05T16:01:01.425Z,Light rain and light winds,10,6,2024-12-12,,,,,5,41,1,34,6,43,-1,30,,,,,,,,,30,Low chance of precipitation,08:35,15:38,,,,,1,LOW,L,Low,12,Light Rain,Light winds from the south west,SW,SW,South Westerly,7,4,2650225,Edinburgh
2024-12-05T16:01:01+00:00,2024-12-05T16:01:01.425Z,Sunny intervals and light winds,19,12,2024-12-13,,,,,5,41,2,36,7,45,0,33,,,,,,,,,31,Chance of precipitation,08:36,15:38,,,,,1,LOW,L,Low,3,Sunny Intervals,Light winds from the south west,SW,SW,South Westerly,10,6,2650225,Edinburgh
2024-12-05T16:01:01+00:00,2024-12-05T16:01:01.425Z,Light rain and a gentle breeze,35,22,2024-12-14,,,,,6,42,2,35,8,46,-1,31,,,,,,,,,70,Chance of precipitation,08:37,15:38,,,,,1,LOW,L,Low,12,Light Rain,A gentle breeze from the south west,SW,SW,South Westerly,16,10,2650225,Edinburgh
2024-12-05T16:01:01+00:00,2024-12-05T16:01:01.425Z,Sunny and a gentle breeze,23,15,2024-12-15,,,,,5,42,1,33,8,46,-2,29,,,,,,,,,19,Low chance of precipitation,08:38,15:38,,,,,1,LOW,L,Low,1,Sunny,A gentle breeze from the south west,SW,SW,South Westerly,18,11,2650225,Edinburgh
2024-12-05T16:01:01+00:00,2024-12-05T16:01:01.425Z,Light rain and a gentle breeze,33,21,2024-12-16,,,,,6,42,3,38,9,48,1,33,,,,,,,,,50,Chance of precipitation,08:39,15:38,,,,,1,LOW,L,Low,12,Light Rain,A gentle breeze from the south west,SW,SW,South Westerly,17,10,2650225,Edinburgh
2024-12-05T16:01:01+00:00,2024-12-05T16:01:01.425Z,Light rain and a gentle breeze,33,21,2024-12-17,,,,,6,42,2,36,9,48,-1,30,,,,,,,,,51,Chance of precipitation,08:40,15:38,,,,,1,LOW,L,Low,12,Light Rain,A gentle breeze from the west,W,W,Westerly,19,12,2650225,Edinburgh
2024-12-05T16:01:01+00:00,2024-12-05T16:01:01.425Z,Light cloud and a gentle breeze,24,15,2024-12-18,,,,,5,42,2,36,9,48,-2,29,,,,,,,,,31,Chance of precipitation,08:41,15:39,,,,,1,LOW,L,Low,7,Light Cloud,A gentle breeze from the south west,SW,SW,South Westerly,17,11,2650225,Edinburgh
