issueDate,lastUpdated,report.enhancedWeatherDescription,report.gustSpeedKph,report.gustSpeedMph,report.localDate,report.lowermaxTemperatureC,report.lowermaxTemperatureF,report.lowerminTemperatureC,report.lowerminTemperatureF,report.maxTempC,report.maxTempF,report.minTempC,report.minTempF,report.mostLikelyHighTemperatureC,report.mostLikelyHighTemperatureF,report.mostLikelyLowTemperatureC,report.mostLikelyLowTemperatureF,report.pollenIndex,report.pollenIndexBand,report.pollenIndexIconText,report.pollenIndexText,report.pollutionIndex,report.pollutionIndexBand,report.pollutionIndexIconText,report.pollutionIndexText,report.precipitationProbabilityInPercent,report.precipitationProbabilityText,report.sunrise,report.sunset,report.uppermaxTemperatureC,report.uppermaxTemperatureF,report.upperminTemperatureC,report.upperminTemperatureF,report.uvIndex,report.uvIndexBand,report.uvIndexIconText,report.uvIndexText,report.weatherType,report.weatherTypeText,report.windDescription,report.windDirection,report.windDirectionAbbreviation,report.windDirectionFull,report.windSpeedKph,report.windSpeedMph,location_id,location_name
2023-04-09T22:52:00+01:00,2023-04-10T01:34:31.979+01:00,Light rain and a gentle breeze,46,28,2023-04-09,,,,,12,53,8,46,14,57,6,43,4.0,MODERATE,M,Moderate,3.0,LOW,L,Low,98,Precipitation is expected,06:24,20:06,,,,,0,LOW,L,Low,39,Light Rain,A gentle breeze from the south,S,S,Southerly,19,12,2650225,Edinburgh
2023-04-09T22:52:00+01:00,2023-04-10T01:34:31.979+01:00,Light rain showers and a fresh breeze,47,29,2023-04-10,,,,,12,53,3,38,14,57,2,36,4.0,MODERATE,M,Moderate,3.0,LOW,L,Low,90,High chance of precipitation,06:21,20:08,,,,,4,MODERATE,M,Moderate,10,Light Rain Showers,A fresh breeze from the south west,SW,SW,South Westerly,31,19,2650225,Edinburgh
2023-04-09T22:52:00+01:00,2023-04-10T01:34:31.979+01:00,Light rain and a moderate breeze,53,33,2023-04-11,,,,,11,52,3,37,13,55,2,35,4.0,MODERATE,M,Moderate,10.0,VERY_HIGH,VH,Very High,46,Chance of precipitation,06:19,20:11,,,,,4,MODERATE,M,Moderate,12,Light Rain,A moderate breeze from the west,W,W,Westerly,26,16,2650225,Edinburgh
2023-04-09T22:52:00+01:00,2023-04-10T01:34:31.979+01:00,Heavy rain and a fresh breeze,63,39,2023-04-12,,,,,8,46,3,38,10,49,2,35,4.0,MODERATE,M,Moderate,3.0,LOW,L,Low,70,Chance of precipitation,06:16,20:13,,,,,1,LOW,L,Low,15,Heavy Rain,A fresh breeze from the south west,SW,SW,South Westerly,35,22,2650225,Edinburgh
2023-04-09T22:52:00+01:00,2023-04-10T01:34:31.979+01:00,Light rain showers and a moderate breeze,40,25,2023-04-13,,,,,10,50,1,34,11,52,-1,30,4.0,MODERATE,M,Moderate,10.0,VERY_HIGH,VH,Very High,40,Chance of precipitation,06:13,20:15,,,,,3,MODERATE,M,Moderate,10,Light Rain Showers,A moderate breeze from the west,W,W,Westerly,24,15,2650225,Edinburgh
2023-04-09T22:52:00+01:00,2023-04-10T01:34:31.979+01:00,Light rain showers and light winds,19,12,2023-04-14,,,,,10,50,1,34,12,54,-2,29,,,,,,,,,36,Chance of precipitation,06:11,20:17,,,,,3,MODERATE,M,Moderate,10,Light Rain Showers,Light winds from the north,N,N,Northerly,11,7,2650225,Edinburgh
2023-04-09T22:52:00+01:00,2023-04-10T01:34:31.979+01:00,Sunny intervals and a gentle breeze,21,13,2023-04-15,,,,,12,53,3,38,13,55,2,35,,,,,,,,,21,Low chance of precipitation,06:08,20:19,,,,,4,MODERATE,M,Moderate,3,Sunny Intervals,A gentle breeze from the west,W,W,Westerly,13,8,2650225,Edinburgh
2023-04-09T22:52:00+01:00,2023-04-10T01:34:31.979+01:00,Light cloud and a gentle breeze,37,23,2023-04-16,,,,,14,58,7,44,17,62,5,40,,,,,,,,,70,Chance of precipitation,06:06,20:21,,,,,2,LOW,L,Low,7,Light Cloud,A gentle breeze from the south west,SW,SW,South Westerly,20,12,2650225,Edinburgh
2023-04-10T01:34:31+01:00,2023-04-10T01:34:31.979+01:00,Sunny intervals and a moderate breeze,46,29,2023-04-17,,,,,16,60,7,44,18,64,5,40,,,,,,,,,11,Low chance of precipitation,06:03,20:23,,,,,3,MODERATE,M,Moderate,3,Sunny Intervals,A moderate breeze from the south west,SW,SW,South Westerly,23,14,2650225,Edinburgh
2023-04-10T01:34:31+01:00,2023-04-10T01:34:31.979+01:00,Sunny and a gentle breeze,25,16,2023-04-18,,,,,17,63,6,42,19,67,3,38,,,,,,,,,13,Low chance of precipitation,06:01,20:25,,,,,4,MODERATE,M,Moderate,1,Sunny,A gentle breeze from the south west,SW,SW,South Westerly,18,11,2650225,Edinburgh
2023-04-10T01:34:31+01:00,2023-04-10T01:34:31.979+01:00,Sunny and light winds,15,9,2023-04-19,,,,,17,63,5,41,20,68,2,35,,,,,,,,,0,Precipitation is not expected,05:58,20:27,,,,,5,MODERATE,M,Moderate,1,Sunny,Light winds from the south,S,S,Southerly,12,7,2650225,Edinburgh
2023-04-10T01:34:32+01:00,2023-04-10T01:34:31.979+01:00,Gusty winds and sunny,67,41,2023-04-20,,,,,16,61,5,42,20,67,2,35,,,,,,,,,0,Precipitation is not expected,05:56,20:29,,,,,4,MODERATE,M,Moderate,1,Sunny,Gusty winds from the south west,SW,SW,South Westerly,18,11,2650225,Edinburgh
2023-04-10T01:34:32+01:00,2023-04-10T01:34:31.979+01:00,Light rain and a gentle breeze,50,31,2023-04-21,,,,,14,57,3,38,18,64,-1,29,,,,,,,,,25,Low chance of precipitation,05:53,20:31,,,,,2,LOW,L,Low,12,Light Rain,A gentle breeze from the west,W,W,Westerly,16,10,2650225,Edinburgh
2023-04-10T01:34:32+01:00,2023-04-10T01:34:31.979+01:00,Light rain showers and a gentle breeze,16,10,2023-04-22,,,,,13,56,3,38,18,65,-2,29,,,,,,,,,28,Low chance of precipitation,05:51,20:33,,,,,5,MODERATE,M,Moderate,10,Light Rain Showers,A gentle breeze from the south west,SW,SW,South Westerly,13,8,2650225,Edinburgh
