issueDate,lastUpdated,report.enhancedWeatherDescription,report.gustSpeedKph,report.gustSpeedMph,report.localDate,report.lowermaxTemperatureC,report.lowermaxTemperatureF,report.lowerminTemperatureC,report.lowerminTemperatureF,report.maxTempC,report.maxTempF,report.minTempC,report.minTempF,report.mostLikelyHighTemperatureC,report.mostLikelyHighTemperatureF,report.mostLikelyLowTemperatureC,report.mostLikelyLowTemperatureF,report.pollenIndex,report.pollenIndexBand,report.pollenIndexIconText,report.pollenIndexText,report.pollutionIndex,report.pollutionIndexBand,report.pollutionIndexIconText,report.pollutionIndexText,report.precipitationProbabilityInPercent,report.precipitationProbabilityText,report.sunrise,report.sunset,report.uppermaxTemperatureC,report.uppermaxTemperatureF,report.upperminTemperatureC,report.upperminTemperatureF,report.uvIndex,report.uvIndexBand,report.uvIndexIconText,report.uvIndexText,report.weatherType,report.weatherTypeText,report.windDescription,report.windDirection,report.windDirectionAbbreviation,report.windDirectionFull,report.windSpeedKph,report.windSpeedMph,location_id,location_name
2024-05-31T22:42:00+01:00,2024-06-01T09:02:10.339+01:00,Sunny and light winds,18,11,2024-06-01,,,,,18,65,7,44,21,71,6,42,1.0,LOW,L,Low,4.0,MODERATE,M,Moderate,0,Precipitation is not expected,04:34,21:48,,,,,6,HIGH,H,High,1,Sunny,Light winds from the north east,NE,NE,North Easterly,8,5,2650225,Edinburgh
2024-05-31T22:42:00+01:00,2024-06-01T09:02:10.339+01:00,Sunny intervals and a moderate breeze,45,28,2024-06-02,,,,,18,64,12,54,19,66,11,53,1.0,LOW,L,Low,3.0,LOW,L,Low,0,Precipitation is not expected,04:33,21:49,,,,,5,MODERATE,M,Moderate,3,Sunny Intervals,A moderate breeze from the west,W,W,Westerly,27,17,2650225,Edinburgh
2024-05-31T22:42:00+01:00,2024-06-01T09:02:10.339+01:00,Sunny intervals and a moderate breeze,44,27,2024-06-03,,,,,17,63,10,51,19,66,9,48,1.0,LOW,L,Low,3.0,LOW,L,Low,0,Precipitation is not expected,04:32,21:50,,,,,6,HIGH,H,High,3,Sunny Intervals,A moderate breeze from the west,W,W,Westerly,29,18,2650225,Edinburgh
2024-05-31T22:42:00+01:00,2024-06-01T09:02:10.339+01:00,Drizzle and a fresh breeze,53,33,2024-06-04,,,,,14,57,6,42,15,59,5,40,1.0,LOW,L,Low,3.0,LOW,L,Low,40,Chance of precipitation,04:32,21:51,,,,,5,MODERATE,M,Moderate,11,Drizzle,A fresh breeze from the west,W,W,Westerly,32,20,2650225,Edinburgh
2024-05-31T22:42:00+01:00,2024-06-01T09:02:10.339+01:00,Light rain showers and a fresh breeze,52,32,2024-06-05,,,,,13,55,6,43,14,58,5,41,1.0,LOW,L,Low,3.0,LOW,L,Low,67,Chance of precipitation,04:31,21:52,,,,,3,MODERATE,M,Moderate,10,Light Rain Showers,A fresh breeze from the west,W,W,Westerly,32,20,2650225,Edinburgh
2024-05-31T22:42:00+01:00,2024-06-01T09:02:10.339+01:00,Sunny intervals and a moderate breeze,39,24,2024-06-06,,,,,14,58,7,45,16,60,6,43,,,,,,,,,29,Low chance of precipitation,04:30,21:54,,,,,4,MODERATE,M,Moderate,3,Sunny Intervals,A moderate breeze from the west,W,W,Westerly,24,15,2650225,Edinburgh
2024-05-31T22:42:00+01:00,2024-06-01T09:02:10.339+01:00,Light rain and a moderate breeze,36,22,2024-06-07,,,,,15,59,8,47,18,64,6,43,,,,,,,,,41,Chance of precipitation,04:29,21:55,,,,,4,MODERATE,M,Moderate,12,Light Rain,A moderate breeze from the west,W,W,Westerly,21,13,2650225,Edinburgh
2024-05-31T22:42:00+01:00,2024-06-01T09:02:10.339+01:00,Drizzle and a gentle breeze,27,17,2024-06-08,,,,,15,59,7,44,18,64,5,41,,,,,,,,,59,Chance of precipitation,04:29,21:56,,,,,5,MODERATE,M,Moderate,11,Drizzle,A gentle breeze from the north west,NW,NW,North Westerly,16,10,2650225,Edinburgh
2024-06-01T09:02:10+01:00,2024-06-01T09:02:10.339+01:00,Drizzle and light winds,26,16,2024-06-09,,,,,16,61,10,49,18,65,7,45,,,,,,,,,50,Chance of precipitation,04:28,21:57,,,,,5,MODERATE,M,Moderate,11,Drizzle,Light winds from the north,N,N,Northerly,12,7,2650225,Edinburgh
2024-06-01T09:02:10+01:00,2024-06-01T09:02:10.339+01:00,Light rain and light winds,16,10,2024-06-10,,,,,17,63,11,51,20,68,8,47,,,,,,,,,55,Chance of precipitation,04:28,21:57,,,,,4,MODERATE,M,Moderate,12,Light Rain,Light winds from the east,E,E,Easterly,9,5,2650225,Edinburgh
2024-06-01T09:02:10+01:00,2024-06-01T09:02:10.339+01:00,Light rain showers and light winds,22,14,2024-06-11,,,,,17,63,11,52,20,68,8,46,,,,,,,,,59,Chance of precipitation,04:27,21:58,,,,,4,MODERATE,M,Moderate,10,Light Rain Showers,Light winds from the east,E,E,Easterly,12,7,2650225,Edinburgh
2024-06-01T09:02:10+01:00,2024-06-01T09:02:10.339+01:00,Light rain showers and a gentle breeze,40,25,2024-06-12,,,,,17,62,10,51,20,68,7,44,,,,,,,,,70,Chance of precipitation,04:27,21:59,,,,,4,MODERATE,M,Moderate,10,Light Rain Showers,A gentle breeze from the east,E,E,Easterly,16,10,2650225,Edinburgh
2024-06-01T09:02:10+01:00,2024-06-01T09:02:10.339+01:00,Light rain and light winds,27,17,2024-06-13,,,,,17,62,10,51,21,69,6,43,,,,,,,,,61,Chance of precipitation,04:26,22:00,,,,,3,MODERATE,M,Moderate,12,Light Rain,Light winds from the north east,NE,NE,North Easterly,11,7,2650225,Edinburgh
2024-06-01T09:02:10+01:00,2024-06-01T09:02:10.339+01:00,Light rain and a gentle breeze,26,16,2024-06-14,,,,,17,63,11,53,22,71,7,45,,,,,,,,,55,Chance of precipitation,04:26,22:00,,,,,5,MODERATE,M,Moderate,12,Light Rain,A gentle breeze from the north east,NE,NE,North Easterly,13,8,2650225,Edinburgh
